,Rank,Artist,Lyrics,Title,album_name,release_date,total_tracks,duration,track_number,album_single,chart
131,N/A,John Denver,"When I was a little bitty boy
Just up off the floor
We used to go down to grandma's house
Ev'ry month end or so
We'd have chicken pie and country ham
And homemade butter on the bread
But the best darn thing about Grandma's house
Was a great big feather bed

It was nine feet high and six feet wide
Soft as a downy chick
It was made from the feathers of forty 'leven geese
Took a whole bolt of cloth for the tick
It'd hold eight kids 'n' four hound dogs
And a piggy we stole from the shed
We didn't get much sleep but we had a lot of fun
On grandma's feather bed

After supper we'd sit around the fire
The old folks'd spit and chew
Pa would talk about the farm and the war
And granny'd sing a ballad or two
I'd sit and listen and watch the fire
Till the cobwebs filled my head
Next thing I'd know I'd wake up in the morning
In the middle of the old feather bed

It was nine feet high and six feet wide
Soft as a downy chick
It was made from the feathers of forty 'leven geese
Took a whole bolt of cloth for the tick
It'd hold eight kids 'n' four hound dogs
And a piggy we stole from the shed
We didn't get much sleep but we had a lot of fun
On grandma's feather bed

Well I love my ma, I love my pa
I love granny and grandpa too
I've been fishin' with my uncle, I rassled with my cousin
I even kissed Aunt Lou, eww!
But if I ever had to make a choice
I guess it ought to be said
That I'd trade 'em all plus the gal down the road
For grandma's feather bed

It was nine feet high and six feet wide
Soft as a downy chick
It was made from the feathers of forty 'leven geese
Took a whole bolt of cloth for the tick
It'd hold eight kids 'n' four hound dogs
And a piggy we stole from the shed
We didn't get much sleep but we had a lot of fun
On grandma's feather bed
We didn't get much sleep but we had a lot of fun
On grandma's feather bed",Grandma's Feather Bed,An Evening With John Denver,1975,23,5:02,Track 'B4',Album,False
132,N/A,John Denver,"You fill up my senses
Like a night in the forest
Like the mountains in springtime
Like a walk in the rain

Like a storm in the desert
Like a sleepy blue ocean
You fill up my senses
Come fill me again

Come let me love you
Let me give my life to you
Let me drown in your laughter
Let me die in your arms

Let me lay down beside you
Let me always be with you
Come let me love you
Come love me again

Let me give my life to you
Come let me love you
Come love me again

You fill up my senses
Like a night in the forest
Like the mountains in springtime
Like a walk in the rain

Like a storm in the desert
Like a sleepy blue ocean
You fill up my senses
Come fill me again",Annie's Song,An Evening With John Denver,1975,23,2:37,Track 'B5',Album,False
133,N/A,John Denver,"I am the eagle,
I live in high country
In rocky cathedrals that reach to the sky

I am the hawk
And there's blood on my feathers
But time is still turning they soon will be dry

And all those who see me,
And all who believe in me
Share in the freedom I feel when I fly

Come dance with the west wind and touch on the mountain tops
Sail o'er the canyons and up to the stars
And reach for the heavens and hope for the future
And all that we can be and not what we are",The Eagle And The Hawk,An Evening With John Denver,1975,23,3:32,Track 'B6',Album,False
134,N/A,John Denver,"Lady, are you crying, do the tears belong to me
Did you think our time together was all gone
Lady, you've been dreaming, I'm as close as I can be
And I swear to you our time has just begun

Close your eyes and rest your weary mind
I promise I will stay right here beside you
Today our lives were joined, became entwined
I wish that you could know how much I love you

Lady, are you happy, do you feel the way I do
Are there meanings that you've never seen before
Lady, my sweet lady, I just can't believe it's true
And it's like I've never, ever loved before

Lady, are you crying, do the tears belong to me
Did you think our time together was all gone
Lady, my sweet lady, I'm as close as I can be
And I swear to you our time has just begun",My Sweet Lady,An Evening With John Denver,1975,23,2:22,Track 'C1',Album,False
135,N/A,John Denver,"I'm bringin' me home to you
It's all that I have to give
My life, my love, my everything
It's you I choose to be with

Had a wonderful time in the city
I smile when I recall
The space, the songs, the company
I really had a ball

It's a funny set of circumstances
Is me out on the road alone
With the moon lookin' over my shoulder
I'm findin' my way back home

I'm bringin' me home to you
It's all that I have to give
My life, my love, my everything
It's you I choose to be with

Ridin' high in the Rocky Mountains
It's a quiet and peaceful time
I'd swear the stars are smilin'
Like they know what's on my mind

You see on any such an occasion
My thoughts will turn to you
The time I spend all by myself
I mostly spend with you

La la la...

I'm bringin' me home to you
It's all that I have to give
My life, my love, my everything
It's you I choose to be with

When I laid down beside you
And all the love that you showed
I want to live my life with you
It's all the dreams that I know

Bringin' me home to you
It's all that I have to give
My life, my love, my everything
It's you I choose to be with
It's you I choose to be with
It's you I want to live with

La la la...",Annie's Other Song,An Evening With John Denver,1975,23,4:55,Track 'C2',Album,False
136,N/A,John Denver,"Because he called the forest brother
Because he called the earth his mother
They drove him out into the rain
Some people even said the boy from the country was insane

Because he spoke with fish in the creek
He tried to tell us that the animals could speak
Who knows, perhaps they do
How do you know they don't
Just because they've never spoken to you

Boy from the country, left his home when he was young
Boy from the country, he loves the sun

He tried to tell us, we should love the land
We just turned our heads and laughed
You see, we did not understand
Sometimes I think the boy from the country
Is the only one who sees
'Cause the boy from the country
Doesn't want to see the forest for the trees

Boy from the country, left his home when he was young
Boy from the country, he loves the sun",Boy From The Country,An Evening With John Denver,1975,23,3:05,Track 'C3',Album,False
137,N/A,John Denver,"So you speak to me of sadness, the coming of the winter
Fear that is within you now that seems to never end
And the dreams that have escaped you
And the hope that you've forgotten
You tell me that you need me now, you want to be my friend

And you wonder where we're going
Where's the rhyme and where's the reason?
And if you cannot accept it is here we must begin
To seek the wisdom of the children
And the graceful way of flowers in the wind

For the children and the flowers are my sisters and my brothers
Their laughter and their loveliness could clear a cloudy day
Like the music of the mountains and the colors of the rainbow
They're a promise of the future and a blessing for today

Though the cities start to crumble and the towers fall around us
The sun is slowly fading and it's colder than the sea
It is written: ""From the desert to the mountains they shall lead us""
By the hand and by the heart, they will comfort you and me
In their innocence and trusting, they will teach us to be free

For the children and the flowers are my sisters and my brothers
Their laughter and their loveliness could clear a cloudy day
And the song that I am singing is a prayer to nonbelievers
Come and stand beside us, we can find a better way",Rhymes & Reasons,An Evening With John Denver,1975,23,5:00,Track 'C4',Album,False
138,N/A,John Denver,"Oh lay me down in Forest Lawn in a silver casket,
Put golden flowers over my head in a silver basket.
Let the drum and bugle corp play taps while cannons roar
And sixteen liveried employees sell souvenirs from the funeral store.

I want to go simply when I go,
They'll give me a simple funeral there I know,
With a casket lined in fleece
And fireworks spelling out ""rest in peace.""
Oh take me when I'm gone to Forest Lawn.

Oh lay me down in Forest Lawn, they understand there.
They have a heavenly choir and a military band there.
Just put me in their care, I'll find my comfort there
With sixteen planes in a last salute they'll drop a cross in a parachute.

I want to go simply when I go,
They'll give me a simple funeral there I know:
With a hundred strolling strings
And topless dancers with golden wings!
Oh take me when I'm gone to Forest Lawn.

Oh, come, come, come, come,
Come to the church in the wildwood,
Kindly leave a contribution in the pail.
Be as simple and as trusting as a child would
And we'll sell you the church in the dale.

To find a simple resting place is my desire;
To lay me down with a smiling face comes a little bit higher.
My likeness cast in brass will stand in plastic grass
While hidden weights and springs tip it's hat to the mourners filing past!

I want to go simply when I go.
They'll give me a simple funeral there I know.
I'll lie beneath the sand
With piped in tapes of Billy Graham.
Oh take me when I'm gone to Forest Lawn.

Rock of Ages, cleft for me,
For a slightly higher fee!

Oh take me when I'm gone to Forest Lawn!",Forest Lawn,An Evening With John Denver,1975,23,3:17,Track 'C5',Album,False
139,N/A,John Denver,Instrumental,Pickin' The Sun Down,An Evening With John Denver,1975,23,2:58,Track 'D1',Album,False
140,N/A,John Denver,"Well, life on the farm is kinda laid back
Ain't much an old country boy like me can't hack
It's early to rise, early in the sack
Thank God I'm a country boy

Well, the simple kind of life never did me no harm
A raisin' me a family and workin' on the farm
My days are all filled with an easy country charm
Thank God I'm a country boy

Well, I got me a fine wife, I got me old fiddle
When the sun's comin' up, I got cakes on the griddle
And life ain't nothin' but a funny, funny riddle
Thank God I'm a country boy

When the work's all done and the sun's settin' low
I pull out my fiddle and I rosin up the bow
The kids are asleep so I keep it kinda low
Thank God I'm a country boy

I'd play ""Sally Goodin"" all day if I could
But the Lord and my wife wouldn't think it very good
So I fiddle when I can and I work when I should
Thank God I'm a country boy

Well, I got me a fine wife, I got me old fiddle
When the sun's comin' up, I got cakes on the griddle
Life ain't nothin' but a funny, funny riddle
Thank God I'm a country boy, wooh

Well, I wouldn't trade my life for diamonds or jewels
I never was one of them money hungry fools
I'd rather have my fiddle and my farmin' tools
Thank God I'm a country boy

Yeah, city folk drivin' in a black limousine
A lotta sad people thinkin' ""thatsa mighty keen!""
Well son, let me tell you now exactly what I mean
I thank God I'm a country boy

Well, I got me a fine wife, I got me old fiddle
When the sun's comin' up, I got cakes on the griddle
Life ain't nothin' but a funny, funny riddle
Thank God I'm a country boy

Well, my fiddle was my daddy's till the day he died
And he took me by the hand, held me close to his side
Said, ""Live a good life, play my fiddle with pride,
Thank God you're a country boy""

Well, my daddy taught me young how to hunt and how to whittle
Taught me how to work and play a tune on the fiddle
He taught me how to love and how to give just a little
And thank God I'm a country boy

Well, I got me a fine wife, I got me old fiddle
When the sun's comin' up, I got cakes on the griddle
Life ain't nothin' but a funny, funny riddle
Wooh, thank God I'm a country boy, yes",Thank God I'm A Country Boy,An Evening With John Denver,1975,23,2:17,Track 'D2',Album,False
141,N/A,John Denver,"Almost heaven, West Virginia
Blue Ridge Mountains, Shenandoah River
Life is old there, older than the trees
Younger than the mountains, growing like a breeze

Country roads, take me home to the place I belong
West Virginia, Mountain Mama
Take me home, country roads

All my memories gather 'round her
Miner's lady, stranger to blue water
Dark and dusty, painted on the sky
Misty taste of moonshine, teardrop in my eye

Country roads, take me home to the place I belong
West Virginia, Mountain Mama
Take me home, country roads

I hear her voice, in the mornin' hour she calls me
The radio reminds me of my home far away
And drivin' down the road, I get a feelin
That I should have been home yesterday, yesterday

Country roads, take me home to the place I belong
West Virginia, Mountain Mama
Take me home, country roads

Country roads, take me home to the place I belong
West Virginia, Mountain Mama
Take me home, country roads
Take me home, (down) country roads
Take me home, (down) country roads","Take Me Home, Country Roads",An Evening With John Denver,1975,23,3:40,Track 'D3',Album,False
142,N/A,John Denver,"I've been lately thinkin' about my life's time
All the things I've done and how it's been
And I can't help believin' in my own mind
I know I'm gonna hate to see it end

I've seen a lot of sunshine, slept out in the rain
Spent a night or two all on my own
I've known my lady's pleasures, had myself some friends
Spent a time or two in my own home

And I have to say it now, it's been a good life all in all
It's really fine to have the chance to hang around
Lie there by the fire and watch the evening tire
While all my friends and my old lady sit and pass a pipe around

And talk of poems, and prayers and promises and things that we believe in
How sweet it is to love someone, how right it is to care
How long it's been since yesterday, what about tomorrow?
And what about our dreams and all the memories we share?

The days they pass so quickly now, nights are seldom long
Time around me whispers when it's cold 
The changes somehow frighten me, still I have to smile
It turns me on to think of growing old

For though my life's been good to me, there's still so much to do
So many things my mind has never known
I'd like to raise a family, I'd like to sail away
And dance across the mountains on the moon

And I have to say it now, it's been a good life all in all
It's really fine to have the chance to hang around
Lie there by the fire and watch the evening tire
While all my friends and my old lady sit and pass a pipe around

And talk of poems, and prayers and promises and things that we believe in
How sweet it is to love someone, how right it is to care
How long it's been since yesterday, what about tomorrow?
And what about our dreams and all the memories we share?","Poems, Prayers And Promises",An Evening With John Denver,1975,23,3:17,Track 'D4',Album,False
143,N/A,John Denver,"He was born in the summer of his twenty-seventh year
Comin' home to a place he'd never been before
He left yesterday behind him, you might say he was born again
You might say he found a key for ev'ry door

When he first came to the mountains his life was far away
On the road and hangin' by a song
But the string's already broken and he doesn't really care
It keeps changin' fast and it don't last for long

But the Colorado Rocky Mountain high
I've seen it rainin' fire in the sky
The shadow from the starlight is softer than a lullaby
Rocky Mountain high (Colorado)
Rocky Mountain high (high in Colorado)

He climbed cathedral mountains, he saw silver clouds below
He saw ev'rything as far as you can see
And they say that he got crazy once and he tried to touch the sun
And he lost a friend but kept the memory

Now he walks in quiet solitude, the forests and the streams
Seeking grace in every step he takes
His sight has turned inside himself to try and understand
The serenity of a clear blue mountain lake

And the Colorado Rocky Mountain high
I've seen it rainin' fire in the sky
Talk to God and listen to the casual reply
Rocky Mountain high (high in Colorado)
Rocky Mountain high (high in Colorado)

Now his life is full of wonder but his heart still knows some fear
Of a simple thing he cannot comprehend
Why they try to tear the mountains down to bring in a couple more
More people, more scars upon the land

And the Colorado Rocky Mountain high
I've seen it rainin' fire in the sky
I know he'd be a poorer man if he never saw an eagle fly
Rocky Mountain high

A Colorado Rocky Mountain high
I've seen it rain fire in the sky
Friends around the campfire and ev'rybody's high
Rocky Mountain high (high in Colorado)
Rocky Mountain high (high in Colorado)
Rocky Mountain high (high in Colorado)
Rocky Mountain high (high in Colorado)
Rocky Mountain high (high in Colorado)
Rocky Mountain high (high in Colorado)",Rocky Mountain High,An Evening With John Denver,1975,23,4:40,Track 'D5',Album,False
144,N/A,John Denver,"This old guitar taught me to sing a lovesong,
Showed me how to laugh and how to cry,
Introduced me to some friends of mine,
And brightened up some days,
It helped me make it through some lonely nights,
Oh, what a friend to have on a cold lonely night.

This old guitar gave me my lovely lady,
It opened up her eyes and ears to me,
It brought us close together,
I guess it broke her heart,
But it opened up the space for us to be,
What a lovely place, a lovely space to be.

This old guitar gave me my life my living,
And all the things I know I love to do,
To serenade the stars that shine
From a sunny mountain side,
Most of all to sing my songs for you,
Ooh, I love to sing my songs for you,
Yes I do, Lord, I love to sing my songs for you.",This Old Guitar,An Evening With John Denver,1975,23,5:04,Track 'D6',Album,False
145,N/A,Elvis Presley,"Lord, help me walk
Another mile, just one more mile
I'm tired of walkin' all alone

Lord, help me smile
Another smile, just one more smile
You know I just can't make it on my own

I never thought I needed help before
I thought that I could get by by myself
But now I know I just can't take it anymore
With a humble heart on bended knee
I'm beggin' you please, help me

Come down from your golden throne
To me, to lowly me
I need to feel the touch of your tender hand

Remove the chains of darkness
And let me see, Lord let me see
Just where I fit into your master plan

I never thought I needed help before
I thought that I could get by by myself
But now I know I just can't take it anymore
With a humble heart on bended knee
I'm beggin' you please, help me

With a humble heart on bended knee
I'm beggin' you please, help me",Help Me,If You Talk In Your Sleep,1974,2,2:25,Track 'B',Single,False
146,N/A,Bill Anderson,"There's just no way to tie a river down no way to hold back the wind
Rrain is gonna fall where it wants to fall and like the sun I'm gonna shine it on again

The only life I've ever known is driftin' a little somethin' I've picked up from my dad
Watchin' the sunset from a town he'd never been was the only dream he ever had
I guess this way of life rubbed off on me 'cause when I stay in one place too long
I start to hear the strains of a distant melody
And I'm off to sing that old highway song
There's just no way...

Once I met a girl in Colorado and I thought for a chance I'd settled down
But just when I thought I would make it I was on the highway leadin' out of town
Cause wonderin' where that long road would take me
Has its own special brand of charm
And it doesn't matter how much I'd like to I can't stay too long in one pair of arms
There's just no way...
There's just no way...",Gonna Shine It On Again,World Of Make Believe,1973,2,2:38,Track 'B',Single,False
147,N/A,John Denver,"Back in 1958 we drove an old V8 and when it'd gone a hundred thou' we got out and pushed it a mile
We didn't know who we were, we didn't know what we did
We were just on the road

Headin' down from Canada on a gravel road a mile from Montana
Then my Daddy read a sign and took us in the wrong direction
I asked my Daddy where are we goin', he said we'll just follow
Our nose, so I looked out the window and dreamed I was a cowboy

We didn't know who we were, we didn't know what we did
We were just on the road

I met a girl in a truck cafe, fell in love almost right away
Then the Mercury was ready to go and I had to leave her

Shoo-be-doo-be-doo-Sh-doo
Shoo-be-doo-be-doo-Sh-doo-Sh-doo

Go home said the man in the moon go home
Go home said the man in the moon go home

Because it's gettin'sorta late and I'll soon turn out my light
Go home said the man in the moon
Go home

We didn't know who we were, we didn't know what we did
We were just on the road

We didn't know who we were, we didn't know what we did
We were just a ridin' on
We were just a ridin' on the road",On The Road,Back Home Again,1974,12,4:42,Track 'A2',Album,False
148,N/A,John Denver,"When I was a little bitty boy
Just up off the floor
We used to go down to grandma's house
Ev'ry month end or so
We'd have chicken pie and country ham
And homemade butter on the bread
But the best darn thing about Grandma's house
Was a great big feather bed

It was nine feet high and six feet wide
Soft as a downy chick
It was made from the feathers of forty 'leven geese
Took a whole bolt of cloth for the tick
It'd hold eight kids 'n' four hound dogs
And a piggy we stole from the shed
We didn't get much sleep but we had a lot of fun
On grandma's feather bed

After supper we'd sit around the fire
The old folks'd spit and chew
Pa would talk about the farm and the war
And granny'd sing a ballad or two
I'd sit and listen and watch the fire
Till the cobwebs filled my head
Next thing I'd know I'd wake up in the morning
In the middle of the old feather bed

It was nine feet high and six feet wide
Soft as a downy chick
It was made from the feathers of forty 'leven geese
Took a whole bolt of cloth for the tick
It'd hold eight kids 'n' four hound dogs
And a piggy we stole from the shed
We didn't get much sleep but we had a lot of fun
On grandma's feather bed

Well I love my ma, I love my pa
I love granny and grandpa too
I've been fishin' with my uncle, I rassled with my cousin
I even kissed Aunt Lou, eww!
But if I ever had to make a choice
I guess it ought to be said
That I'd trade 'em all plus the gal down the road
For grandma's feather bed

It was nine feet high and six feet wide
Soft as a downy chick
It was made from the feathers of forty 'leven geese
Took a whole bolt of cloth for the tick
It'd hold eight kids 'n' four hound dogs
And a piggy we stole from the shed
We didn't get much sleep but we had a lot of fun
On grandma's feather bed
We didn't get much sleep but we had a lot of fun
On grandma's feather bed",Grandma's Feather Bed,Back Home Again,1974,12,2:33,Track 'A3',Album,False
149,N/A,John Denver,"I had an uncle name of Matthew
He was his father's only boy
Born just south of Colby, Kansas
He was his mother's pride and joy

Yes, and joy was just the thing that he was raised on
Love was just the way to live and die
Gold is just a windy Kansas wheat-field
Blue is just a Kansas summer sky

And all the stories that he told me
Back when I was just a lad
All the memories that he gave me
All the good times that he had

Growin' up a Kansas farmboy
Life was mostly havin' fun
Ridin' on his daddy's shoulders
Behind a mule beneath the sun

Yes, and joy was just the thing that he was raised on
Love was just the way to live and die
Gold is just a windy Kansas wheatfield
Blue is just a Kansas summer sky

Well, I guess there were some hard times
And I'm told some years were lean
They had a storm in '47
A twister came and stripped 'em clean

He lost the farm and lost his family
He lost the wheat and lost his home
But he found the family Bible
A faith as solid as a stone

Yes, and joy was just the thing that he was raised on
Love was just the way to live and die
Gold is just a windy Kansas wheat-field
And blue just a Kansas summer sky

And so he came to live at our house
And he came to work the land
He came to ease my daddy's burden
And he came to be my friend

And so I wrote this down for Matthew
And it's for him this song is sung
Ridin' on his daddy's shoulders
Behind a mule beneath the sun

Yes, and joy was just the thing that he was raised on
Love was just the way to live and die
Gold is just a windy Kansas wheat-field
Blue was just a Kansas summer sky

Yes, and joy was just the thing that he was raised on
Love was just the way to live and die
Gold is just a windy Kansas wheat-field
Blue is just a Kansas summer sky",Matthew,Back Home Again,1974,12,2:15,Track 'A4',Album,False
