,Rank,Artist,Lyrics,Title,album_name,release_date,total_tracks,duration,track_number,album_single,chart
263,N/A,C.W. McCall,"Me an' Earl was haulin' chickens on a flatbed out of Wiggins, and we'd spent all night on the uphill side of thirty-seven miles of hell called Wolf Creek Pass. Which is up on the Great Divide? 

We was settin' there suckin' toothpicks, drinkin' Nehi and onion soup mix, and I said, ""Earl, let's mail a card to Mother then send them chickens on down the other side. Yeah, let's give 'em a ride."" 

Wolf Creek Pass, way up on the Great Divide
Truckin' on down the other side 

Well, Earl put down his bottle, mashed his foot down on the throttle, and then a couple'a boobs with a thousand cubes in a nineteen-forty-eight Peterbilt screamed to life. We woke up the chickens. 

Well, we roared up offa that shoulder sprayin' pine cones, rocks, and boulders, and put four hundred head of them Rhode Island reds and a couple a' burnt-out roosters on the line. Look out below; 'cause here we go! 

Well, we commenced to truckin' and them hens commenced to cluckin' and then Earl took out a match and scratched his pants and lit up the unused half of a dollar cigar and took a puff. Says ""My, ain't this purdy up here."" 

I says, ""Earl, this hill can spill us. You better slow down or you gonna kill us. Just make one mistake and it's the Pearly Gates for them eight-five crates a' USDA-approved cluckers. You wanna hit second?"" 

Wolf Creek Pass, way up on the Great Divide
Truckin' on down the other side 

Well, Earl grabbed on the shifter and he stabbed her into fifth gear and then the chromium-plated, fully-illuminated genuine accessory shift knob come right off in his hand. I says, ""You wanna screw that thing back on, Earl?"" 

He was tryin' to thread it on there when the fire fell off a' his cigar and dropped on down, sorta rolled around, and then lit in the cuff of Earl's pants and burned a hole in his sock. Yeah, sorta set him right on fire. 

I looked on outta the window and I started countin' phone poles, goin' by at the rate of four to the seventh power. Well I put two and two together, and added twelve and carried five; come up with twenty-two thousand telephone poles an hour. 

I looked at Earl and his eyes was wide, his lip was curled, and his leg was fried. And his hand was froze to the wheel like a tongue to a sled in the middle of a blizzard. I says, ""Earl, I'm not the type to complain; but the time has come for me to explain that if you don't apply some brake real soon, they're gonna have to pick us up with a stick and a spoon."" 

Well, Earl rared back, and cocked his leg, stepped as down as hard as he could on the brake, and the pedal went clear to the floor and stayed there, right there on the floor. He said it was sorta like steppin' on a plum. 

Well, from there on down it just wasn't real purdy: it was hairpin county and switchback city. One of 'em looked like a can full'a worms; another one looked like malaria germs. Right in the middle of the whole damn show was a real nice tunnel, now wouldn't you know? 

Sign says clearance to the twelve-foot line, but the chickens was stacked to thirteen-nine. Well we shot that tunnel at a hundred-and-ten, like gas through a funnel and eggs through a hen, and we took that top row of chickens off slicker than scum off a Lousiana swamp. Went down and around and around and down 'til we run outta ground at the edge of town. Bashed into the side of the feed store... in downtown Pagosa Springs. 

Wolf Creek Pass, way up on the Great Divide
Truckin' on down the other side
Wolf Creek Pass, way up on the Great Divide
Truckin' on down the other side",Wolf Creek Pass,C.W. McCall's Greatest Hits,1978,12,3:55,Track 'A4',Single,False
264,N/A,C.W. McCall,"I's thumbin' through the want ads in the Shelby County Tribune when this classified advertisement caught my eye. It said, ""Take imme-di-ate delivery on this '57 Chevrolet half-ton pickup truck. Will sell or swap for a hide-a-bed and thirty-five bucks. Call One-four-oh, ring two, and ask for Bob."" 

Well, I called Bob up on the telephone, he says, ""Hello, this is Bob speakin'."" I says ""This here the Bob got the pickup truck for sale?"" He says, ""Yeah."" I says, ""Where are ya?"" He says, ""Fourteen east on County 12, turn right on the one-lane gravel road, you can park in the yard, beware of the dog, wipe your feet off, knock three times, and bring your billfold."" 

Well, I tooled on east on County 12, turned right on the one-lane gravel road, and I parked in the yard and a German shepherd come out and grabbed onto my leg. Then I knocked three times and wiped my feet, the dog let go and the screen door opened and Bob come out and says ""Whaddya want?"" I says, ""Come to see your truck."" He says, ""Follow me. Come on, Frank."" (Dog's name is Frank.) 

Well, we all went past the chicken house, through the hog pen, down to the tractor shed, and then wound up in back of the barn in a field of cowpies. And settin' right there in a pool of grease was a half-ton Chevy pickup truck with a 1960 license plate, a bumper sticker says ""Vote for Dick"" and Brillo box full of rusty parts, and Bob says ""Whaddya think?"". 

Well, I kicked the tires and I got in the seat and set on a petrified apple core and found a bunch of field mice livin' in the glove compartment. He says, ""Her shaft is bent and her rear end leaks, you can fix her quick with an oily rag. Use a nail as a starter; I lost the key. Don't pay no mind to that whirrin' sound. She use a little oil, but outside a' that, she's cherry."" 

I says, ""What'll take?"" He says, ""What've you got?"" I says, ""Twenty-eight dollars and fifteen cents."" He says, ""You got a deal. Sign here, I'll go get the title and a can full of gas."" I put the nail in the slot and fired 'er up; she coughed and belched up a bunch a' smoke and I backed her right through the hog pen into the yard. 

Well, Frank jumped in and bit my leg and I beat him off with a crowbar. He jumped on out and the door fell off and the left front tire went flat. I jacked it up and patched the tube and Frank tore a piece of my shirt off. Then Bob come out and called him off and says ""You better'd get on out of here."" 

I went left on the one-lane gravel road, went fourteen west on County 12. Took two full quarts of forty-weight oil just to get her to the Conoco station. And I pulled up to the Regular pump and then Harold Sykes and his kid come out. He says, ""I've seen better stuff at junkyards and where'd you ever get that truck?"" 

I says, ""That's a long story, Harold. I's thumbin' through the want ads in the Shelby County Tribune when this classified advertisement caught my eye. It said, ""Take imme-di-ate delivery on this '57 Chevrolet half-ton pickup truck. Will sell or swap for a hide-a-bed and thirty-five bucks...""",Classified,C.W. McCall's Greatest Hits,1978,12,2:28,Track 'A5',Single,False
265,N/A,C.W. McCall,"Well, it's only gonna be about an hour, friend
Till they dam your favorite river
So you can water-ski just one more reservior
And them supersonic ships are gonna take you
'Cross a sea of pavement
To one more faceless brickyard on the shore

Yeah, it's only gonna be about an hour or so
Till they rip off all your mountains, boy
And that one last tired old eagle bites the sand
And all of that high-and-mighty scenery's
Gonna be leveled to the ground, boy
By a bunch a' them mindless strip mines on the land

So listen well, my brothers
When you hear the night wind sigh
And you see the wild goose flying
Through the gray, polluted sky
There won't be no country music
There won't be no rock 'n' roll
'Cause when they take away our country
They'll take away our soul

Well, it's only gonna take about a minute or so
Till the junkyards fell the prairies, boy
And them smokin' yellow grass fires start to burn
And the warnings on them beer cans
Gonna be buried in them landfills
No deposit, no sad songs, and no returns

Yeah, it's only gonna take about a minute or so
Till the factories blot the sun out
You gonna have to turn your lights on just to see
And them lights are gonna be neon, sayin'
""Fly Our Jets To Paradise""
And the whole damn world is gonna be made of styrene

So listen well, my brothers
When you hear the night wind sigh
And you see the wild goose flying
Through the gray, polluted sky
There won't be no country music
There won't be no rock 'n' roll
'Cause when they take away our country
They'll take away our soul

Yeah, it's only gonna be about a second, boy
Till they take away all'a this country
And they'll tell you not to listen to this here song
And that far-off sound of freedom's
Gonna be an echo from the past
And the final tune is gonna be sad and long

And it's only gonna be about an eye-blink, boy
Till they pull out the wool to blind us
So we just can't read all the messages on the wall
But the only words that matter
Oughta be scribbled all over them billboards
In big old black and bloody letters, ten feet tall

There won't be no country music
There won't be no rock 'n' roll
'Cause when they take away our country
They'll take away our soul

There won't be no country music
There won't be no rock 'n' roll
'Cause when they take away our country
They'll take away our soul

There won't be no country music
There won't be no rock 'n' roll
'Cause when they take away our country
They'll take away our soul

There won't be no country music
There won't be no rock 'n' roll
'Cause when they take away our country
They'll take away our soul
'Cause when they take away our country
They'll take away our soul",There Won't Be No Country Music (There Won't Be No Rock'N'Roll),C.W. McCall's Greatest Hits,1978,12,3:50,Track 'A6',Single,False
266,N/A,C.W. McCall,"Well, Interstate 80, we was cuttin' the fog
Just me an' old Sloan (Old Sloan's my dog)
We had an eighteen-wheeler with ten on the floor and stereo layin' a strip
Now we spied a sign, says ""Eat Gas Now""
We decided to whip in and pick up some chow
At the Old Home Filler-Up An' Keep On A-Truckin' Cafe 

Oh, the Old Home Filler-Up An' Keep On A-Truckin'
Oh, the Old Home Filler-Up An' Keep On A-Truckin' (a-lookin' for Mavis)
Oh, the Old Home Filler-Up An' Keep On A-Truckin' Cafe 

Now we've been every place between here and South Sioux
And we've seen us a truck-stop waitress or two
But this gal's built like a burlap bag full of bobcats:
She's got it to-gether 

Well, she filled my tank; I said ""Thank you, honey.""
Her name was Mavis, I gave her the money
Old Sloan just set there, watchin' and waggin' and wishin'.
I says, ""You wait in the truck, boy."" 

Then I went inside. She says, ""What'll it be?""
I says ""A cup of your best and a number three.""
She come back with an order to go and a quart of hot C and a bone for Sloan.
I said, ""Much obliged""; old Sloan gave a bark
I left her a buck and he left his heart
At the Old Home Filler-Up An' Keep On A-Truckin' Cafe 

Oh, the Old Home Filler-Up An' Keep On A-Truckin'
Oh, the Old Home Filler-Up An' Keep On A-Truckin'
Oh, the Old Home Filler-Up An' Keep On A-Truckin' Cafe 

Well, Saturday night we was truckin' along
Yeah, me and old Sloan was a-gettin' it on
I said, ""Sloan, I've been thinkin' on a-gettin' up my courage, and tonight's the night""
Well, I popped the clutch, gave the tranny a spin
Took the Beebeetown ramp and slid on in
To the Old Home Filler-Up An' Keep On A-Truckin' Cafe 

Oh, the Old Home Filler-Up An' Keep On A-Truckin'
Oh, the Old Home Filler-Up An' Keep On A-Truckin' (it never closes)
Oh, the Old Home Filler-Up An' Keep On A-Truckin' Cafe 

Well, I got me a stool, took a load off my shoes,
Made Mavis an offer that she couldn't refuse
I says, ""How'd ya like to go for a ride with me and old Sloan? I just had my truck warshed.""
She allowed as how it sounded like a whole lot of fun
But we was gonna have ta wait until the dishes was done
And was it all right with me if she brought along her mother as a chaperone?
I said, ""Why not?"" 

Well, we geared that tranny into super-low
And the four of us went to see a picture show
Yeah, I took 'em to the drive-in the-a-ter over by Pisgah, to see True Grit
Saw the late, late show; old Sloan hit the sack
And then along about two o'clock I hauled 'em all back
To the Old Home Filler-Up An' Keep On A-Truckin' Cafe 

Oh, the Old Home Filler-Up An' Keep On A-Truckin'
Oh, the Old Home Filler-Up An' Keep On A-Truckin'
Oh, the Old Home Filler-Up An' Keep On A-Truckin' Cafe (eight stools and a promise)
Oh, the Old Home Filler-Up An' Keep On A-Truckin'
Oh, the Old Home Filler-Up An' Keep On A-Truckin'
Oh, the Old Home Filler-Up An' Keep On A-Truckin' Cafe (they got a real nice place there)",Old Home Filler-Up An' Keep On A-Truckin' Cafe,C.W. McCall's Greatest Hits,1978,12,2:45,Track 'B1',Single,False
267,N/A,C.W. McCall,"One day about four or five years ago
We is settin' at the Conoco station
Kickin' tires, and swattin' flies,
And discussin' the State of the Union
When right out in front of the Baptist church
Come a big ol' purple school bus
Had astrological signs upon it
And thirty-five hippies and dogs inside
About half of 'em went for the courthouse lawn
And them dogs commenced on the fireplug
Rest of 'em set there starin' at us
And I says, ""Roy, go get your Flit gun""
He says, ""Which is the hippies? And which is the dogs?""
I says, ""Beats the hell outta me, Roy.""
What they was, was a bunch a' them Crispy Critters
And their leader was a space cadet 

He says, ""Sagittarius, we has arrived.
Prepare to disembark, men.
Get the incense goin' and the sitar out
We gonna camp in the city park, man."" 

I says, ""Boys, let me explain the situation to ya.
A: you're gettin' me down
And B: we got us a leash law here
And C: you in the wrong town.
You drop one string a' beads in that there park
And you gonna see a whole lotta stars.
You got fifteen seconds to get out of town, boys,
Or we gonna blow ya ta Mars."" 

Well, they all got back in the purple bus
And proceeded to the city limits.
Then the telephone rang, was the swimmin' pool
Says a mess a' wild Critters was in it!
So we all got in the Marshal's Plymouth
(Which is always at the Conoco station)
Went flashin' on down to the swimmin' pool 
To give them Critters a citation 

By the time we arrived, it was too damn late
Them critters is all had their pants down
Them dogs was tearin' the bathhouse apart,
And they's after the fish in the fish pond!
I says, ""Roy, you get the one in the silver T-shirt
""And I'll get the rest with a net.
We gonna have a jail full a' naked Crispy Critters 
And a drip-dry space cadet."" 

Well, we gave 'em hell, but we lost the war
'Cause them Critters outnumbered us
So they moved in and set up camp
And they lived in that purple school bus
Six weeks later, there was nothin' in town
But eighty-four dogs and a head shop
Sellin' dried up weeds, and sunflower seeds,
And astrological postcards 

Yeah, Critters took over the City Council
And the dogs all barked their brains out
And the whole damn town was Crispy Critters
And the mayor was a space cadet",Crispy Critters,C.W. McCall's Greatest Hits,1978,12,2:50,Track 'B2',Single,False
268,N/A,C.W. McCall,,'Round The World With The Rubber Duck,C.W. McCall's Greatest Hits,1978,12,3:59,Track 'B3',Single,False
269,N/A,C.W. McCall,"Me an' RJ an' the kids was on a camp-out in the mountains, and we had us one'a them U-Drive-'Em Army Jeep cars which we rented from a fella by the name of Kubozke for thirty bucks a day, buy your gas along the way, take a rabbit's foot and leave a pint of blood for a dee-posit.

And he 'splained it all to us how we was supposed to get to Telluride, which is fifty miles away by way of the regular highway, however, there was a shortcut but unless we had drove the Black Bear Road before, we'd better be off to stay, stay in bed and sleep late. (Pay no attention to the gitar there.)

Well, we took up off'n the highway and we come upon a sign says ""Black Bear Road. You don't have to be crazy to drive this road, but it helps."" I says, ""RJ, this must the shortcut road Kubozke was talkin' about."" She didn't pay no mind, 'cause she was makin' peanut butter sandwiches for the kids in the back seat throwin' rocks and drinkin' Kool-Aid and playin' count-the-license-plates. But they wasn't havin' too much fun a-countin' license plate or cars, 'cause there weren't no other cars.

We went about a mile-and-a-half in about four hours, busted off the right front fender, tore a hole in the oil pan on a rock as big as a hall closet. Went over a bump and spilt the Kool-Aid and Roy Gene stuck his bolo knife right through the convertible top and the dog threw up all over the back seat. Peanut butter don't agree with him, you see.

So we had to stop and take off the top and air everything out and clean it up. The dog run off and RJ says she felt her asthma comin' on. I was sittin' there wonderin' what to do when the en-tire scenic San Joo-wan U-Drive-'Em Army Jeep car sank in the mud. At thirteen thousand feet above sea level.

Well, we shoveled it out and ate our lunch, the dog made a yellow hole in the snow and Roy Gene got out his Instamatic and took a snapshot of it. Mary Elizabeth drawed a picture of the road; it looked like a whole bunch a' Zs and Ws all strung together. And RJ took one look at it and said that the only way that Jeep car is goin' down that road is over her dead body. Then a rock slipped out from under the wheel and the U-Drive-'Em Army Jeep car went right over the edge of the cliff. Yahoo-ooh-ooh-ooh!

""Doggone-it, Roy Gene! How many times do I have to 'splain it to you? When I tell you to put a rock under the wheel, I mean rock! Now look at that, what you have there is no bigger'n a grapefruit.""",Black Bear Road,C.W. McCall's Greatest Hits,1978,12,2:00,Track 'B4',Single,False
270,N/A,C.W. McCall,"One night last summer we were camped at ten thousand feet up where the air is clear, high in the Rockies of Lost Lake, Colorado. And as the fire burned low and only a few glowing embers remained, we laid on our backs all warm in our sleeping bags and looked up at the stars. 

And as I felt myself falling into the vastness of the Universe, I thought about things, and places, and times. 

I thought about the time my grandma told me what to say when I saw the evening star. You know, Star light, star bright, first star I see tonight. I wish I may, I wish I might, have the wish I wish tonight.

The air is crystal-clear up here; that's why you can see a million stars. 

I remember a time a bunch of us were in a canyon of the Green River in Wyoming; it was a night like this. And we had our rafts pulled up on the bank an' turned over so we could sleep on 'em, and one of the guys from New York said, ""Hey! Look at the smog in the sky! Smog clear out here in the sticks!"" And somebody said, ""Hey, Joe, that's not smog; that's the Milky Way."" 

Joe had never seen the Milky Way. 

And we saw the Northern Lights once, in the Bitterroot Mountains of Montana. They're like flames from some prehistoric campfire, leaping and dancing in the sky and changing colors. Red to gold, and blue to violet... Aurora Borealis. It's like the equinox, the changing of the seasons. Summer to fall, young to old, then to now. And then tomorrow... 

And then everyone was asleep, except me. And as I saw the morning star come up over the mountains, I realized that life is just a collection of memories. And memories are like starlight: they go on forever.",Aurora Borealis,C.W. McCall's Greatest Hits,1978,12,3:24,Track 'B6',Single,False
271,N/A,Jim Ed Brown,,My Heart Cries For You,"Saying Hello, Saying I Love You, Saying Goodbye",1976,2,2:28,Track 'B',Single,False
272,N/A,Mel Tillis,,Wedding Bells,Heart Healer,1977,10,2:29,Track 'A2',Album,False
273,N/A,Mel Tillis,,"Play It Again, Sam",Heart Healer,1977,10,3:26,Track 'A3',Album,False
274,N/A,Mel Tillis,,Someone Else Tends The Garden,Heart Healer,1977,10,2:28,Track 'A4',Album,False
275,N/A,Mel Tillis,,The Morning After Baby Let Me Down,Heart Healer,1977,10,2:49,Track 'A5',Album,False
276,N/A,Mel Tillis,"(Burning mem'ries burning mem'ries)
Tonight I'm burning old love letters photographs and memories of you
Hoping somehow I'll feel better and when the smoke is gone I won't want you
Burning mem'ries burning mem'ries memories of you that I can't use
My heart to you no longer matters and I can't live on memories
Into the fire those dreams you've shattered
And when the smoke is gone then I'll be free
(Burning mem'ries burning mem'ries)",Burning Memories,Heart Healer,1977,10,3:04,Track 'B1',Album,False
277,N/A,Mel Tillis,,Golden Nugget Gambling Casino,Heart Healer,1977,10,2:41,Track 'B2',Album,False
278,N/A,Mel Tillis,,I Don't Want To Feel This Way Forever,Heart Healer,1977,10,2:55,Track 'B3',Album,False
279,N/A,Mel Tillis,,Everyone Needs Someone,Heart Healer,1977,10,2:47,Track 'B4',Album,False
280,N/A,Mel Tillis,,It's Just Not That Easy To Say,Heart Healer,1977,10,2:00,Track 'B5',Album,False
281,N/A,Glen Campbell,"I have to admit
That no-one could love me like you did
And there were more laughs
Than tears any day
Like children at play
But somewhere and somehow
We lost each other

How high did we go-o
When we loved each o-other
How high did we go-o
When we said we care-hare-are-hared
For the first time I'm scare-ared

I have no regrets
Lookin' back
I hold nothi-ing against you
'Cause I learned to love
And that's more than most ever know-ow-ow
And I just can't belie-ieve
That we've lost each other

How high did we go-o
When we loved each o-other
How high did we go-o
When we said we care-hare-are-hare-ared
For the first time I'm scare-ared

How high did we go-o-ho-ho
When we loved each o-other
How high did we go-o
When we said we care-hare-are-hared",How High Did We Go,Sunflower,1977,2,2:49,Track 'B',Single,False
282,N/A,Elvis Presley,"Babe, you're getting closer
The lights are goin' dim
The sound of your breathin'
Has made the mood I'm in

All of my resistance
Is lying on the floor
Taking me to places
I've never been before

Ooh, and I can feel it
Feel it, feel it, feel it

Way down where the music plays
(Way down) Way down like a tidal wave
(Way down) Way down where the fires blaze
Way down, down, way, way on down

Ooh, my head is spinnin'
You got me in your spell,
A hundred magic fingers
On a whirling carousel

The medicine within me
No doctor could prescribe
Your love is doing something
That I just can't describe

Ooh, and I can feel it
Feel it, feel it, feel it

Way down where the music plays
(Way down) Way down like a tidal wave
(Way down) Way down where the fires blaze
Way down, down, way, way on down

Hold me again as tight as you can
I need you so, baby, let's go

(Way down) Way down where it feels so good
(Way down) Way down where I hoped it would
(Way down) Way down where I never could
Way down, down, way, way on down",Way Down,Way Down / Pledging My Love,1977,2,2:36,Track 'A',Single,False
283,N/A,Dave,,Livin' At The End Of The Rainbow,I'm Knee Deep In Loving You,1977,2,2:34,Track 'B',Single,False
284,N/A,Merle Haggard,"Are you lonesome tonight, do you miss me tonight?
Are you sorry we drifted apart?
Does your memory stray to a bright summer day
When I held you and called you sweetheart

Do the chairs in your parlor seem empty and bare?
Do you gaze at your doorstep and picture me there?
Is your heart filled with pain, shall I come back again
Tell me dear are you lonesome tonight?

I wonder if you're lonesome tonight
You know that someone said the world's a stage and each must play a part
And fate had me playin' ""In Love"" with you as my sweetheart
Act one was where we met I loved you at first glance
You read your lines so cleverly and never missed a cue, then came act two
You seemed to change and you acted strange and why I've never known
Honey, you lied when you said you loved me and I had no cause to doubt you
But I'd rather go on hearing your lies than to have to go on living without you
Now the stage is bare and I'm standing there with emptiness all around
And if you won't come back to me they can bring the curtain down

Is your heart filled with pain should I come back again
Tell me dear are you lonesome tonight?",Are You Lonesome Tonight,From Graceland To The Promised Land,1977,2,2:17,Track 'B',Single,False
285,N/A,Loretta Lynn,,The Bed I'm Dreaming On,I Can't Love You Enough  / The Bed I'm Dreaming On,1977,2,2:52,Track 'B',Single,False
286,N/A,Loretta Lynn,"He's forty but he thinks that he's twenty
He's got that boyish grin and he grins plenty
At every pretty girl that he's passin
He thinks that they're all his for the asking

He's never aged a day hear him swear
Loving cares done wonders for his hair
Except a few bald spots are showing
The old rooster's back and he's crowing

The Old roosters back and he's crowing
Age ain't taught him nothing and it's showin
One of these days he'll wake up and know
He's been knocked off his roostin pole

He's the king of the roost see him struttin
For punishment that ole boy's a glutton
This old hen might start feather picking
If he don't stop eye balling the chickens

Adamantly he's taken by the truck load
He says that he's never gonna grow old
But I've got news for him that's quite alarming
He became a grandpa this morning",Old Rooster,Out Of My Head And Back In My Bed,1977,2,2:40,Track 'B',Single,False
287,N/A,Crystal Gayle,,I'm Not So Far Away,I'll Do It All Over Again,1976,2,2:52,Track 'B',Single,False
