,Rank,Artist,Lyrics,Title,album_name,release_date,total_tracks,duration,track_number,album_single,chart
0,1,Bill Anderson,"(Still) though you broke my heart
(Still) though we're far apart
I love you still
(Still) after all this time
(Still) you're still on my mind
I love you still

I've lost count of the hours 
And I've lost track of the days  
In fact, I've lost just about everything 
Since you went away  
Everything, that is, except the memories you left me
And that's one thing that no one can mar  

I don't know who you're with 
I don't even know where you've gone  
My only hope is that some day you might hear this song 
And you'll know that I wrote it especially for you  
And I love you, wherever you are

(Still) after all this time
(Still) you're still on my mind
I love you still

This flame in my heart is like an eternal fire 
For every day it burns hotter 
And every day it burns higher  
And I haven't been able to put out one little flicker 
Not even with all of these tears  

My friends think I'm crazy and maybe I am  
But I'll carry this torch just as long as I can 
For some day, you might just decide to come home 
And I want you to know   
I'm still here

(Still) though you broke my heart
(Still) though we're far apart
I love you still",Still,Still,1963,2,2:45,Track 'A',Single,True
1,2,Bobby Bare,"Lord I'm five hundred miles away from home
Teardrops fell on mama's note when I read the things she wrote
She said we miss you son we love you come on home
Well I didn't have to pack I had it all right on my back
Now I'm five hundred miles away from home

Away from home away from home cold and tired and all alone
Yes I'm five hundred miles away from home

I know this is the same road I took the day I left home
But it sure looks different now
Well I guess I look different too cause time changes everything
I wonder what they'll say when they see their boy looking this way

Oh I wonder what they'll say when I get home
Can't remember when I ate it's just thumb and walk and wait
And I'm still five hundred miles away from home
If my luck had been just right I'd be with them all tonight
But I'm still five hundred miles away from home

Away from home away from home cold and tired and all alone
Yes I'm five hundred miles away from home
Lord I'm still five hundred miles away from home",500 Miles Away From Home,500 Miles Away From Home,1963,2,2:35,Track 'A',Single,True
2,3,George Hamilton IV,"Abilene Abilene prettiest town I've ever seen
Women there don't treat you mean in Abilene my Abilene

I sit alone most every night watch those trains pull out of sight
Don't I wish they were carryin' me back to Abilene my Abilene
Abilene Abilene...

Crowded city ain't nothing free nothing in this town for me
Wish to the Lord that I could be in Abilene sweet Abilene
Abilene Abilene...
(Women there don't treat you mean) in Abilene my Abilene",Abilene,Abilene,1963,12,2:10,Track 'B2',Album,True
3,4,Johnny Cash,"Love is a burning thing
And it makes a fiery ring
Bound by wild desire
I fell into a ring of fire

I fell into a burning ring of fire
I went down, down, down and the flames went higher
And it burns, burns, burns
The ring of fire, the ring of fire

I fell into a burning ring of fire
I went down, down, down and the flames went higher
And it burns, burns, burns
The ring of fire, the ring of fire

The taste of love is sweet
When hearts like ours meet
I fell for you like a child
Oh, but the fire went wild

I fell into a burning ring of fire
I went down, down, down and the flames went higher
And it burns, burns, burns
The ring of fire, the ring of fire

I fell into a burning ring of fire
I went down, down, down and the flames went higher
And it burns, burns, burns
The ring of fire, the ring of fire

And it burns, burns, burns
The ring of fire, the ring of fire
The ring of fire, the ring of fire",Ring Of Fire,Ring Of Fire  (The Best Of Johnny Cash),1963,12,2:37,Track 'A1',Single,True
4,5,"Lester Flatt, Earl Scruggs and the Foggy Mountains Boys",,,,,,,,,
5,6,Skeeter Davis,"Why does the sun go on shining?
Why does the sea rush to shore?
Don't they know it's the end of the world?
'Cause you don't love me anymore

Why do the birds go on singing?
Why do the stars glow above?
Don't they know it's the end of the world?
It ended when I lost your love

I wake up in the morning and I wonder
Why everything's the same as it was
I can't understand, no, I can't understand
How life goes on the way it does

Why does my heart go on beating?
Why do these eyes of mine cry?
Don't they know it's the end of the world?
It ended when you said goodbye

Why does my heart go on beating?
Why do these eyes of mine cry?
Don't they know it's the end of the world?
It ended when you said goodbye",The End Of The World,The End Of The World,1963,12,2:33,Track 'A1',Album,True
6,7,Jim Reeves,"Welcome to my world
Welcome to my world
Won't you come on in
Miracles I guess
Still happen now and then
Step into my heart
Leave your cares behind
Welcome to my world
Built with you in mind
Knock and the door will open
Seek and you will find
Ask and you will be given
The key to this world of mine
I'll be waiting here
With my arms unfurled
Waiting just for you
Welcome to my world",Welcome To My World,The Best Of Jim Reeves Vol. II,1966,12,2:34,Track 'A2',Single,True
7,8,Marty Robbins,"I said hello to the man that tried to win your hand
A long time ago.
I tried to smile as he talked of the days
When he was your beau,

But I could see he was a-shamin' me
When he talked of his wealth and fame --
Ruby Ann took the hand of this poor, poor man,
Ain't true love a funny thing?

Big man, you got money in your hand,
So what?
You're at a table for two, but still there's only you,
Big shot!
Well, your money can't buy if your power can't hold,
You can't romance your fame --
Ruby Ann took the hand of this poor, poor man,
Ain't true love a funny thing?

Big man, you got money in your hand,
So what?
You're at a table for two, but still there's only you,
Big shot!
Well, your money can't buy if your power can't hold,
You can't romance your fame --
Ruby Ann took the hand of this poor, poor man,
Ain't true love a funny thing?
Ruby Ann took the hand of this poor, poor man,
Ain't true love a funny thing?",Ruby Ann,Ruby Ann,1962,2,,Track 'A',"7""",True
8,9,Buck Owens,"Oh the sun's gonna shine, in my life once more
Love's gonna live here again
Things are gonna be the way they, were before
Love's gonna live here again

Love's gonna live here
Love's gonna live here
Love's gonna live here again
No more loneliness, only happiness
Love's gonna live here again

I hear bells a-ringin', I hear birds a-singin'
Love's gonna live here again
I hear bee's a-hummin, and I know the days' a-comin'
Love's gonna live here again

Love's gonna live here
Love's gonna live here
Love's gonna live here again
No more loneliness, only happiness
Love's gonna live here again
Love's gonna live here again",Love's Gonna Live Here,Love's Gonna Live Here / Getting Used To Losing You,1963,2,2:00,Track 'A',Single,True
9,10,Ned Miller,"From a Jack to a King
From loneliness to a wedding ring
I played an Ace and I won a Queen
And walked away with your heart

From a Jack to a King
With no regret I stacked the cards last night
And lady luck played her hand just right
To make me King of your heart
For just a little while
I thought that I might lose the game
Then just in time
I saw the twinkle in your eye

From a Jack to a King
From loneliness to a wedding ring
I played an Ace and I won a Queen
You made me King of your heart

For just a little while
I thought that I might lose the game
Then just in time
I saw the twinkle in your eye
From a Jack to a King
From loneliness to a wedding ring
I played an Ace and I won a Queen
You made me King of your heart",From A Jack To A King,From A Jack To A King,1963,2,,Track 'A',Single,True
10,11,Hawkshaw Hawkins,"Had our number changed today, although I hated to
But each time the phone would ring
They'ed want to speak to you
And it hurt's to tell them, your not here with me
May be now, oh telephone will let me be

It's not in the book now, so you'd better write it down
Just in case your love for me, should ever come around
You might want to call, and break the news to me
Just call lonesome 7-7203

I keep the telephone be side me all the time
Hoping you might want to call, and say
You've changed your mind
If you do then darling you know, where I'll be
I'm at lonesome 7-7203

Your the only one I'm giving our new number too
So now if the telephone should ring I'll know It's you
If you ever long for love that used to be
Just call lonesome 7-7203
Just call lonesome 7-7203",Lonesome 7-7203,Lonesome 7-7203,1963,2,2:38,Track 'A',Single,True
11,12,Buck Owens,"They're going to put me in the movies 
They're going to make a big star out of me 
We'll make a film about a man that's sad and lonely 
And all I got to do is act naturally 

Well, I bet you I'm a gonna be a big star 
Might win an Oscar you can never tell 
The movie's going to make me a big star
'Cause I can play the part so well

Well, I hope you come and see me in the movie 
Then I'll know that you will plainly see 
The biggest fool that's ever hit the big time 
And all I got to do is act naturally

We'll make a scene about a man that's sad and lonely 
And begging down upon his bended knee 
I'll play the part but I won't need rehearsing 
All I have to do is act naturally

Well, I bet you I'm a going to be a big star 
Might win an Oscar you can never tell 
The movie's going to make me a big star
'Cause I can play the part so well

Well, I hope you come and see me in the movie 
Then I'll know that you will plainly see 
The biggest fool that's ever hit the big time 
And all I got to do is act naturally",Act Naturally,Act Naturally,1989,2,2:59,Track 'A',Single,True
12,13,Johnny Cash,"The crowd is waiting for the bullfight
Matador
My final fight the place is packed once more
Anita won't throw me a rose this fight
The one she wears is not for me tonight

She's watching now with her new love I know
Walk proud and slow
Be strong and sure give the crowd their show
They want blood you know!
You're still their idol as you were before
Kill just one more!
Remind Anita, you're the greatest Matador

Walk on out, forget Anita in the stands
Be a tall and brave and noble man
Be better than you've ever been before
Make this you're greatest moment Matador

She's watching now with her new love I know
Walk proud and slow
Be strong and sure give the crowd a show
They want blood you know!
You're still their idol as you were before
Kill just one more!
Remind Anita, you're the greatest Matador",The Matador,The Matador,1963,2,2:45,Track 'A',Single,True
13,14,Dave Dudley,"Well I pulled out of Pittsburgh, a-rollin' down that Eastern Seaboard
I got my diesel wound up and she's a-runnin' like a-never before
There's a speed zone ahead, but all right 
I don't see a cop in sight
Six days on the road and I'm a-gonna make it home tonight

I got me ten forward gears and a Georgia overdrive
I'm taking little white pills and my eyes are open wide
I just passed a Jimmy in a white 
I been a passing everything in sight
Six days on the road and I'm a-gonna make it home tonight

Well it seems like a month since I kissed my baby goodbye
I could have a lot of women but I'm not a-like a-some other guys
I could find one to hold me tight 
But I could never make believe it's all right
Six days on the road and I'm a-gonna make it home tonight

ICC is a checking on down the line
Well I'm a little overweight and my log book's way behind
But nothin' bothers me tonight 
I can dodge all the scales all right
Six days on the road and I'm a-gonna make it home tonight

Well my rig's a little old but that don't mean she's slow
There's a flame from her stack and that smoke's a-blowing black as coal
My hometown's a-comin' in sight 
If you think I'm a-happy, you're right
Six days on the road and I'm a-gonna make it home tonight
Six days on the road and I'm a-gonna make it home tonight
Six days on the road and I'm a-gonna make it home tonight",Six Days On The Road,Dave Dudley Sings Six Days On The Road,1963,12,,Track 'A1',Album,True
14,15,Ernest Ashworth,,Talk Back Trembling Lips,Talk Back Trembling Lips,1963,2,2:33,Track 'A',Single,True
15,16,Bill Anderson,"(Eight by ten eight by ten)
All that's left of all our love now
Is just your picture, eight by ten
(A souvenir of things that might have been.)

My lonely world is only eight by ten eight by ten eight by ten
I remember the night that you gave me that picture I ought to
I've relived it so many times I remember how I couldn't wait to get home
Put it in a frame and tell everybody that you were mine.

Because you were mine at least until someone else came along
And took you off out of my sight
It's a good thing that you did leave me your picture to hold
Because now I can cry on your shoulder every night.

(Eight by ten eight by ten)
My lonely world is only eight by ten.

It's awful to be jealous of an old picture frame
But I'm jealous of anything that's close to you
And that picture frame seems to be holding you pretty tight
That looks like more than I'll ever do.

I wish that I could just be the glass in that frame
And be so close to the lips that I love
I am glad that I've at least got your picture to hold
But sometimes it's just not enough

(Eight by ten eight by ten)
My lonely world is only eight by ten...",8 X 10,8 X 10,1963,2,2:48,Track 'A',Single,True
16,17,Jim Reeves,"I've been accused, convicted and condemned
The trial's over, and now I face the end,
Is this your way of telling me we're through
When all I'm guilty of, is loving you.

You were the judge, the jury all in one
You found me guilty and now my term's begun.
I must confess, I've never been untrue
And all I'm guilty of, is loving you.

Loving you, and now I'm losing you
Losing you, for things I didn't do.

Please let your heart, consider an appeal
For now you know, exactly how I feel.
Don't punish me for things I didn't do
When all I'm guilty of, is loving you.

Yes, all I'm guilty of, is loving you...",Guilty,The International Jim Reeves,1963,12,3:09,Track 'A6',Album,True
17,18,Hank Snow,"I took you home from a party and we kissed in fun
A few stolen kisses and no harm was done
Instead of stoppin' when we could we went right on
Till suddenly we found the brakes were gone
You belong to someone else and I do too it's just crazy bein' here with you
As a bad motorcycle with the devil in the seat
Doin' ninety miles an hour down a dead end street
I didn't want to want you now I have no choice
It's too late to listen to the warning voice
All I hear is thunder when two hearts beat
Doin' ninety miles an hour down a dead end street
You're not free to belong to me and you know I can never be your own
Your lips on mine are like sweet sweet wine but we're headin' for a wall of stone
Warnin' signs are flashin' by us but we we pay no heed
Stead of slowin' down the pace we keep picking up the speed
Disaster's gettin' closer every time we meet
Doin' ninety miles an hour down a dead end street
You're not free...",Ninety Miles An Hour (Down A Dead End Street),Ninety Miles An Hour (Down A Dead End Street) / Blue Roses,1963,2,2:34,Track 'A',Single,True
18,19,Marty Robbins,"I left you this morning couldn't take anymore
You laughed and you dared me to walk out the door
You said that I'd come back you knew what I'd do
And you know you were right 'cause I'm back here tonight begging to you

I won't disappoint you I'm begging to stay
That's what you wanted to hear anyway
It must make you happy to make me so blue
What a pityful sight I must be tonight begging to you

You don't want my loving but you let me stay around
I guess just to walk on so you won't touch the ground
To you it don't matter what you cause me to do
As long as you keep me begging to you",Begging To You,Begging To You / Over High Mountain,1963,2,,Track 'A',Single,True
19,20,Ray Price,"Oh make the world go away and get it off my shoulder
It goes bigger day by day please make the world go away
I was wrong the day I left you and let the world leave me astray
If you'll say that you forgive me you'll make the world go away
Oh make the world go away and get it off my shoulder
I go weaker day by day please make the world go away
I'm sorry that I hurt you I'll make it up day by day
Can you love me like you used to and make the world go away
Make the world go away and get it off my shoulder
Can you love me like you used to and make the world go away
Say the things you used to say and make the world go away
I can't stand another day please make the world go away
Say you'll take me back to stay and make the world go away",Make The World Go Away ,Make The World Go Away / Night Life,1963,2,,Track 'A',Single,True
20,21,David Houston,"Got a Mountain of love for the girl in the valley
Got an ocean of DREAMS for the girl in the valley
Someday I will marry the girl in the valley
Cause this mountain boy holds a world full of joy
For the girl in the valley

She's a sweet little thing that lives by the spring in the valley
Every day she goes by with her head held up high like a high steppin' PHILLY
I tried every thing even bought her a ring she won't WEAR IT
She said she loves me but she's not yet quite ready to marry.

Got a mountain...",Mountain Of Love,Mountain Of Love / Angeline,1963,2,,Track 'A',Single,True
21,22,Bobby Bare,"I wanna go home
I wanna go home
Oh, how I wanna go home

Last night I went to sleep in Detroit City
And I dreamed about those cotton fields and home
I dreamed about my mother
Dear old papa, sister, and brother
I dreamed about that girl
Who's been waiting for so long

I wanna go home
I wanna go home
Oh, how I wanna go home

Homefolks think I'm big in Detroit City
From the letters that I write, they think I'm fine
By day, I make the cars
By night, I make the bars
If only they could read between the lines

Spoken:
'Cause you know, I rode the freight train north to Detroit City
And after all these years, I find I just been wastin' my time
So I just think I'll take my foolish pride
And put it on a Southbound freight and ride
And go on back to the loved ones
The ones I left waitin' so far behind

I wanna go home
I wanna go home
Oh, how I wanna go home",Detroit City,Detroit City And Other Hits By Bobby Bare,1963,12,2:48,Track 'A1',Single,True
22,23,Jim Reeves,"Is this me, is it really me
Sittin' here crying
Well, it shouldn't be, it just can't be me
My eyes are lying.

'Cause that's not you, it just can't be you
You wouldn't be cheatin'
It's someone else, yes, it's someone else
Whose darling's leavin'.

I just can't believe my eyes
You took me by surprise
Oh, how I wish I'd just stayed home
I'd still be thinking you're all my own.

This isn't me, it just can't be me,
Sittin' here crying
Is it just a dream, I know it's just a dream
Our love can't be dying...",Is This Me?,Missing Angel / Is This Me?,1963,2,,Track 'B',Single,True
23,24,Patsy Cline,"Sweet dreams of you
Every night I go through
Why can't I forget you and start my life anew
Instead of having sweet dreams about you

You don't love me its plain
I should know I'll never wear your ring
I should hate you the whole night through
Instead of having sweet dreams about you

Sweet dreams of you
Things I know can't come true
Why can't I forget the past
Start loving someone new
Instead of having sweet dreams about you",Sweet Dreams (Of You),Sweet Dreams (Of You),1963,2,2:33,Track 'A',Single,True
24,25,Dave Dudley,"Well all of my life I been a tryin' to save to get a pair of cowboy boots
Sixteen years of my life I gave to get a pair of cowboy boots
I wanna go where the money's free Hollywood is a callin' me
Oh what a great big star I'll be in a pair of cowboy boots
I'm gonna get on a TV show in a pair of cowboy boots
I'm gonna ride in a rodeo in a pair of cowboy boots
I wanna go where the family lurk I'm gonna get a job and go to work
Givin' lessons to that Stony Burk in a pair of cowboy boots
Oh give me a home where the swimmin' pools roam
Where the money grows on trees the gals all wanna be squeezed
Well I'm a gonna get there if I have to crawl in a pair of cowboy boots
Get in the movies and that ain't all in a pair of cowboy boots
I'm gonna get me a leather vest a gun on my hip and a star on my chest
Well I'll be the terror of the Golden West in a pair of cowboy boots

Oh give me a home...
In a pair of cowboy boots in a pair of cowboy boots in a pair of cowboy boots",Cowboy Boots,Cowboy Boots,1963,2,,Track 'A',Single,True
25,26,Roy Drusky,,Such A Fool,Roy Drusky,1965,12,2:05,Track 'A3',Album,True
26,27,George Jones & Melba Montgomery,"We said our goodbyes long ago
Never thinking we'd miss each other so
All the memories we can't leave behind
Oh, we must have been out of our minds

I thought I loved another, not you
How foolish, I thought the same, too
They both turned out to be the wrong kind
Oh, we (must have been out of our minds

Let's forgive and forget the past we've known
And reap together the wild seeds we've sown
Surely they can forgive us and find
That we must have been out of our minds

I thought I loved another, not you
How foolish, I thought the same, too
They both turned out to be the wrong kind
Oh, we must have been out of our minds

Yes, we must have been out of our minds",We Must Have Been Out Of Our Minds,Until Then / We Must Have Been Out Of Our Minds,1963,2,2:36,Track 'B',Single,True
27,28,Faron Young,"This is the story of the Yellow Bandana
A handsome young soldier and the girl named Rosana.

Oh, way down west in the winds on New Mexico
There lived a girl and the soldier who loved her so
And every night neath the full crimson moon above
This brave young soldier would pledge her his love.

And he gave Rosana his yellow bandana
To wear in her hair till he's with her once more
He gave Rosana his yellow bandana
Mounted his pony and rode off to war.

His orders came and he had to ride west again
Seems that Apaches were causing unrest again
He kissed Rosana goodbye as he rode away
Promising this time he'd come back to stay.

And he gave Rosana his yellow bandana
To wear in her hair till he's with her once more
He gave Rosana his yellow bandana
Mounted his pony and rode off to war.

That war was over and he came back home and found
That the Apaches had burned the whole village down
And neath the tree where he'd last kissed Rosana
Gripped on the cross was his yellow bandana.

And he gave Rosana his yellow bandana
To wear in her hair till he's with her once more
He gave Rosana his yellow bandana
Mounted his pony and rode off to war.

He gave Rosana his yellow bandana
To wear in her hair till he's with her once more
He gave Rosana his yellow bandana
Mounted his pony and rode off to war...",The Yellow Bandana,Faron Young's Greatest Hits,1965,12,2:25,Track 'A1',Single,True
28,29, Rose Maddox,,Sing A Little Song Of Heartache,Sing A Little Song Of Heartache,1975,9,,Track 'A1',LP,True
29,30,Ernest Tubb,"Thanks thanks a lot I got a broken heart that's all I've got
You made me cry now I cried a lot I lost your love baby thanks a lot

You told our friend as I was passin' by that you're not sorry that you made me cry
You said I deserve just what I got well if that's how you feel honey thanks a lot
Thanks thanks a lot...

You wanted a fool and I played the part now all I've got is a broken heart
We loved a little and laughed a lot then you were gone honey thanks a lot
Thanks thanks a lot...",Thanks A Lot,Ernest Tubb's Greatest Hits,1968,11,2:30,Track 'A5',Album,True
30,31,The Wilburn Brothers,"Roll muddy river, roll on muddy river, roll on
I've got a notion you'll go to the ocean, alone
'Cause I've got a baby in Tennessee
Who's long been a-waitin' for a-little old me
So roll muddy river, roll on muddy river, roll on

New Orleans on to old Saint Lou
Stopped in Memphis, Minneapolis, too 
Back in Nashville I'll be through
So roll muddy river roll on 

Roll muddy river, roll on muddy river roll on
I've got a notion you'll go to the ocean, alone
'Cause I've got a baby in Tennessee
Who's long been a-waitin' for a-little old me
So roll muddy river, roll on muddy river, roll on

I love you but just call it fate
You and I are gonna separate
You'll be here but she won't wait
So roll muddy river roll on

Roll muddy river, roll on muddy river, roll on
I've got a notion you'll go to the ocean, alone 
'Cause I've got a baby in Tennessee
Who's long been a-waitin' for a-little old me
So roll muddy river, roll on muddy river, roll on
Roll muddy river, roll on muddy river, roll on",Roll Muddy River,The Wilburn Brother's Greatest Hits,1968,11,2:17,Track 'B5',Single,True
31,32,Eddy Arnold,,Does He Mean That Much To You?,Does He Mean That Much To You?,1962,2,2:20,Track 'A',Single,True
32,33,Skeeter Davis,"I'm saving my love for someone who loves me
For someone who loves me the way I loved you
I'm saving my lips for someone to kiss me
For someone to kiss me the way I kissed you.

Time after time I've waited for your caress
Time after time I've waited in loneliness
I'm saving my dreams for someone to dream of
For someone to dream of like I dreamed of you.

Time after time I've waited for your caress
Time after time I've waited in loneliness
I'm saving my love for someone who loves me
For someone who loves me the way I loved you...",I'm Saving My Love,I'm Saving My Love,1963,2,1:59,Track 'A',Single,True
