,Rank,Artist,Lyrics,Title,album_name,release_date,total_tracks,duration,track_number,album_single,chart
0,1,Crystal Gayle,"Don't know when I've been so blue
Don't know what's come over you
You've found someone new
And don't it make my brown eyes blue

I'll be fine when you're gone
I'll just cry all night long
Say it isn't true
And don't it make my brown eyes blue

Tell me no secrets, tell me some lies
Give me no reasons, give me alibis
Tell me you love me and don't let me cry
Say anything but don't say goodbye

I didn't mean to treat you bad
Didn't know just what I had
But, honey, now I do
And don't it make my brown eyes
Don't it make my brown eyes
Don't it make my brown eyes blue

Don't it make my brown eyes
Don't it make my brown eyes
Don't it make my brown eyes blue

Don't it make my brown eyes
Don't it make my brown eyes
Don't it make my brown eyes blue",Don't It Make My Brown Eyes Blue,Don't It Make My Brown Eyes Blue,1977,2,2:37,Track 'A',Single,True
1,2,Bonnie Tyler,"It's a heartache
Nothing but a heartache
Hits you when it's too late
Hits you when you're down

It's a fool's game
Nothing but a fool's game
Standing in the cold rain
Feeling like a clown

It's a heartache
Nothing but a heartache
Love him till your arms break
Then he lets you down

It ain't right, with love to share
When you find he doesn't care for you
It ain't wise to need someone
As much as I depended on you

Ah, it's a heartache
Nothing but a heartache
Hits you when it's too late
Hits you when you're down

It's a fool's game
Nothing but a fool's game
Standing in the cold rain
Feeling like a clown

It ain't right, with love to share
When you find he doesn't care for you
It ain't wise to need someone
As much as I depended on you

Ah, it's a heartache
Nothing but a heartache
Love him till your arms break
Then he lets you down

It's a fool's game
Standing in the cold rain
Feeling like a clown

It's a heartache
Love him till your arms break
Then he lets you down

It's a fool's game",It's A Heartache,It's A Heartache,1977,2,3:31,Track 'A',Single,True
2,3,Kenny Rogers,"In a bar in Toledo across from the depot
On a bar stool she took off her ring
I thought I'd get closer, so I walked on over
I sat down and asked her name
When the drinks finally hit her, she said, ""I'm no quitter
But I finally quit livin' on dreams
I'm hungry for laughter and here ever after
I'm after whatever the other life brings""

In the mirror I saw him and I closely watched him
I thought how he looked out of place
He came to the woman who sat there beside me
He had a strange look on his face
The big hands were calloused; he looked like a mountain
For a minute I thought I was dead
But he started shakin', his big heart was breakin'
He turned to the woman and said

""You picked a fine time to leave me, Lucille
With four hungry children and a crop in the field
I've had some bad times, lived through some sad times
But this time your hurtin' won't heal
You picked a fine time to leave me, Lucille""

After he left us, I ordered more whisky
I thought how she'd made him look small
From the lights of the bar room to a rented hotel room
We walked without talking at all
She was a beauty, but when she came to me
She must have thought I'd lost my mind
I couldn't hold her, 'cause the words that he told her
Kept comin' back time after time

""You picked a fine time to leave me, Lucille
With four hungry children and a crop in the field
I've had some bad times, lived through some sad times
But this time your hurtin' won't heal
You picked a fine time to leave me, Lucille""

You picked a fine time to leave me, Lucille
With four hungry children and a crop in the field
I've had some bad times, lived through some sad times
But this time your hurtin' won't heal
You picked a fine time to leave me, Lucille",Lucille,Lucille,1977,2,3:39,Track 'A',Single,True
3,4,Dolly Parton,"Here you come again
Just when I've begun to get myself together
You waltz right in the door
Just like you've done before
And wrap my heart 'round your little finger

Here you come again
Just when I'm about to make it work without you
You look into my eyes
And lie those pretty lies
And pretty soon I'm wonderin' how I came to doubt you

All you got to do is smile that smile
And there go all my defenses
Just leave it up to you and in a little while
You're messin' up my mind and fillin' up my senses

Here you come again
Lookin' better than a body has a right to
And shakin' me up so
That all I really know
Is here you come again
And here I go

All you got to do is smile that smile
And there go all my defenses
Just leave it up to you and in a little while
You're messin' up my mind and fillin' up my senses

Here you come again
Lookin' better than a body has a right to
And shakin' me up so
That all I really know
Is here you come again
And here I go
Here I go
And here I go
And here I go

Here you come again
And here I go
Here I go
And here I go
Here I go",Here You Come Again,Here You Come Again,1977,10,2:56,Track 'A1',Album,True
4,5,Glen Campbell,"Southern nights
Have you ever felt a Southern night
Free as a breeze, not to mention the trees
Whistling tunes that you know and love so

Southern nights
Just as good even when you close your eyes
I apologize to anyone who can truly say
That he has found a better way

Southern skies
Have you ever noticed Southern skies?
Its precious beauty lies just beyond the eye
It goes running through your soul
Like the stories of old

Old man, he and his dog
They walk the old land
Every flower touched his cold hand
As he slowly walked by
Weeping willows would cry for joy, joy

Feels so good
Feels so good, it's frightening
Wish I could stop this world from fighting
La da da da da........

Mystery like this and
Many others in the trees
Blow in the night in the Southern skies

Southern nights
They feel so good, it's frightening
Wish I could stop this world from fighting
La da da da da........",Southern Nights,Southern Nights,1977,2,2:58,Track 'A',Single,True
5,6,Waylon Jennings,"I'm not here to forget you
I'm here to recall the things we used to say and do
I don't wanna get over you
I don't wanna get over you

I haunt the same places we used to go
Alone at a table for two
I don't wanna get over you
I don't wanna get over you

They oughta give me the Wurlitzer Prize
For all the silver I let slide down the slot
Playin' those songs sung blue
That help me remember you
I don't wanna get over you

A fresh roll o' quarters, same old songs
Missin' you through and through
I don't wanna get over you
I don't wanna get over you

They oughta give me the Wurlitzer Prize
For all the silver I let slide down the slot
Playin' those songs sung blue
They help me remember you
'Cause I don't wanna get over you
I don't wanna get over you
I don't wanna get over you",The Wurlitzer Prize (I Don't Want To Get Over You),The Wurlitzer Prize (I Don't Want To Get Over You) / Lookin' For A Feeling,1977,2,,Track 'A',Single,True
6,7,Eric Clapton,"There is nothing that is wrong
In wanting you to stay here with me
I know you've got somewhere to go
But won't you make yourself at home and stay with me?
And don't you ever leave

Lay down, Sally, and rest here in my arms
Don't you think you want someone to talk to?
Lay down, Sally, no need to leave so soon
I've been trying all night long just to talk to you

The sun ain't nearly on the rise
And we still got the moon and stars above
Underneath the velvet skies
Love is all that matters, won't you stay with me?
And don't you ever leave

Lay down, Sally, and rest here in my arms
Don't you think you want someone to talk to?
Lay down, Sally, no need to leave so soon
I've been trying all night long just to talk to you

I long to see the morning light
Colouring your face so dreamily
So don't you go and say goodbye
You can lay your worries down and stay with me
And don't you ever leave

Lay down, Sally, and rest here in my arms
Don't you think you want someone to talk to?
Lay down, Sally, no need to leave so soon
I've been trying all night long just to talk to you

Lay down, Sally, and rest here in my arms
Don't you think you want someone to talk to?
Lay down, Sally, there's no need to leave so soon
I've been trying all night long just to talk to you",Lay Down Sally,Lay Down Sally,1977,2,,Track 'A',Single,True
7,8,Elvis Presley,"Babe, you're getting closer
The lights are goin' dim
The sound of your breathin'
Has made the mood I'm in

All of my resistance
Is lying on the floor
Taking me to places
I've never been before

Ooh, and I can feel it
Feel it, feel it, feel it

Way down where the music plays
(Way down) Way down like a tidal wave
(Way down) Way down where the fires blaze
Way down, down, way, way on down

Ooh, my head is spinnin'
You got me in your spell,
A hundred magic fingers
On a whirling carousel

The medicine within me
No doctor could prescribe
Your love is doing something
That I just can't describe

Ooh, and I can feel it
Feel it, feel it, feel it

Way down where the music plays
(Way down) Way down like a tidal wave
(Way down) Way down where the fires blaze
Way down, down, way, way on down

Hold me again as tight as you can
I need you so, baby, let's go

(Way down) Way down where it feels so good
(Way down) Way down where I hoped it would
(Way down) Way down where I never could
Way down, down, way, way on down",Way Down,Way Down,1977,2,2:37,Track 'A',Single,True
8,9,Waylon Jennings,"The only two things in life
That make it worth livin'
Is guitars that tune good 
And firm feelin' women
I don't need my name in the marquee lights
I got my song and I got you with me tonight
Maybe it's time we got back to the basics of love

Let's go to Luckenbach, Texas
With Waylon and Willie and the boys
This successful life we're livin'
Got us feudin' like the Hatfields and McCoys
Between Hank Williams' pain songs
And Newbury's train songs
And 'Blue Eyes Cryin' in the Rain'
Out in Luckenbach, Texas
Ain't nobody feelin' no pain

So, baby, let's sell your diamond ring
Buy some boots and faded jeans and go away
This coat and tie is chokin' me
In your high society, you cry all day
We've been so busy
Keepin' up with the Jones'
Four-car garage and we're still buildin' on
Maybe it's time we got back
To the basics of love

Let's go to Luckenbach, Texas 
With Waylon and Willie and the boys
This successful life we're livin'
Got us feuding like the Hatfields and McCoys
Between Hank Williams' pain songs
And Newbury's train songs
And 'Blue Eyes Cryin' in the Rain'
Out in Luckenbach, Texas 
Ain't nobody feelin' no pain

Let's go to Luckenbach, Texas 
With Willie and Waylon and the boys
This successful life we're livin' 
Got us feuding like the Hatfields and McCoys
Between Hank Williams' pain songs
And Jerry Jeff's train songs
And 'Blue Eyes Cryin' in the Rain'
Out in Luckenbach, Texas 
There ain't nobody feelin' no pain","Luckenbach, Texas (Back To The Basics Of Love)","Luckenbach, Texas (Back To The Basics Of Love)",1977,2,3:18,Track 'A',Single,True
9,10,Ronnie Milsap,"Once in every life ... someone comes along,
And you came to me ... it was almost like a song.

You were in my heart ... right where you belong,
And we were so in love ... it was almost like a song.

January through December ... we had such a perfect year,
Then the flames became a dying ember ...
All at once you weren't here.

Now my broken heart ... cries for you each night,
And it's almost like a song ... but it's much too sad to write.

Now my broken heart ... cries for you each night,
And it's almost like a song ... but it's much to sad to write ...
Much too sad to write.",It Was Almost Like A Song,It Was Almost Like A Song,1977,10,,Track 'A3',Album,True
10,11,The Kendalls,"Heaven's just a sin away, oh, wo, just a sin away
I can't wait another day I think I'm givin' in
Though I'd love to hold you tight, oh, wo, be with you tonight
But that still won't make it right 'cause I belong to him

Oh, way down deep inside I know that it's all wrong
Your eyes keep tempting me and I never was that strong-ong
Oh, devil's got me now, oh, wo, gone and got me now
I can't fight him anyhow I think he's gonna win

Heaven's just a sin away, oh, wo, just a sin away
Heaven help me when I say I think I'm givin' in lead

Heaven's just a sin away, oh, wo, just a sin away
I can't wait another day I think I'm givin' in
Though I'd love to hold you tight, oh, wo, be with you tonight
But that still won't make it right 'cause I belong to him",Heaven's Just A Sin Away,Heaven's Just A Sin Away,1977,10,,Track 'B4',LP,True
11,12,Elvis Presley,"And now the end is near
So I face the final curtain
My friend, I'll say it clear
I'll state my case of which I'm certain

I've lived a life that's full
I've traveled each and every highway
And more, much more than this
I did it my way

Regrets, I've had a few
But then again, too few to mention
I did what I had to do
And saw it through without exception

I planned each charted course
Each careful step along the byway
Oh, and more, much more than this
I did it my way

Yes, there were times, I'm sure you know
When I bit off more than I could chew
But through it all when there was doubt
I ate it up and spit it out
I faced it all and I stood tall
And did it my way

I've loved, I've laughed and cried
I've had my fails, my share of losing
And now as tears subside
I find it all so amusing
To think I did all that
And may I say, not in a shy way
Oh, no, no not me
I did it my way

For what is a man, what has he got
If not himself, then he has not
To say the words he truly feels
And not the words he would reveal
The record shows I took the blows
And did it my way
The record shows I took the blows
And did it my way",My Way,My Way,1977,2,3:51,Track 'A',Single,True
12,13,Charlie Rich,"Once was a thought inside my head
'Fore I'd reach thirty I'd be dead
But somehow on and on I go
I keep on rollin' with the flow

Folks said that I would change my mind
I'd straighten up and do just fine
Ah, but I still love rock and roll
I keep on rollin' with the flow

While guys my age are raising kids
I'm raisin' hell just like I did
I've got a lot of crazy friends
And they forgive me of my sins

Some might be callin' me a bum
But I'm still out there havin' fun
And Jesus loves me, yes, I know
So, I keep on rollin' with the flow
(Keep on rollin' with the flow)

While guys my age are raising kids
But I'm raisin' hell just like I did
I've got a lot of crazy friends
And they forgive me of my sins

Can't take it with you when you're gone
But I want enough to get there on
And I ain't ever growin' old
So, I keep on rollin' with the flow
(Keep on rollin' with the flow)

I ain't ever growin' old,
If I keep on rollin' with the flow
(Keep on rollin', keep on rollin')
Keep on rollin' with the flow
(Keep on rollin', keep on rollin')
Keep on rollin' with the flow
(Keep on rollin', keep on rollin')",Rollin' With The Flow,Rollin' With The Flow,1977,10,2:40,Track 'A1',Album,True
13,14,Kenny Rogers,"And he'll tell her he's working late again
But she knows too well there's something going on
She's been neglected, and she needs a friend
So her trembling fingers dial the telephone

Lord, it hurts her doing this again
He's the best friend that her husband ever knew
When she's lonely, he's more than just a friend
He's the one she longs to give her body to

Daytime friends and nighttime lovers
Hoping no one else discovers
Where they go, what they do, in their secret hideaway
Daytime friends and nighttime lovers
They don't want to hurt the others
So they love in the nighttime
And shake hands in the light of day

When it's over, there's no peace of mind
Just a longing for the way things should have been
And she wonders why some men never find
That a woman needs a lover and a friend

Daytime friends and nighttime lovers
Hoping no one else discovers
Where they go, what they do, in their secret hideaway
Daytime friends and nighttime lovers
They don't want to hurt the others
So they love in the nighttime
And shake hands in the light of day

Daytime friends and nighttime lovers
Hoping no one else discovers
Where they go, what they do, in their secret hideaway
Daytime friends and nighttime lovers
They don't want to hurt the others
So they love in the nighttime
And shake hands in the light of day

Daytime friends and nighttime lovers
Hoping no one else discovers
Where they go, what they do, in their secret hideaway
Daytime friends and nighttime lovers
They don't want to hurt the others
So they love in the nighttime
And shake hands in the light of day",Daytime Friends,Daytime Friends,1977,11,3:10,Track 'A1',Album,True
14,15,Linda Ronstadt,"I feel so bad, I got a worried mind
I'm so lonesome all the time
Since I left my baby behind
On Blue Bayou

Saving nickels, saving dimes
Working 'til the sun don't shine
Looking forward to happier times
On Blue Bayou

I'm going back someday
Come what may
To Blue Bayou
Where the folks are fine
And the world is mine
On Blue Bayou
Where those fishing boats
With their sails afloat
If I could only see
That familiar sunrise
Through sleepy eyes
How happy I'd be

Gonna see my baby again
Gonna be with some of my friends
Maybe I'll feel better again
On Blue Bayou

Saving nickels, saving dimes
Working 'til the sun don't shine
Looking forward to happier times
On Blue Bayou

I'm going back someday
Come with me to Blue Bayou
Where the folks are fine
And the world is mine
On Blue Bayou
Where those fishing boats
With their sails afloat
If I could only see
That familiar sunrise through sleepy eyes
How happy I'd be.

Oh, that boy of mine
By my side
The silver moon and the evening tide
Oh, some sweet day
Gonna take away
This hurting inside
Well, I'll never be blue
My dreams come true
On Blue Bayou",Blue Bayou,Blue Bayou / Old Paint,1977,2,3:57,Track 'A',Single,True
15,16,Ronnie Milsap,"When you need a good friend well here I am
And if you have a problem I'll be your helping hand
If you have a bad day I'll make you a good night
And if you ever lose your way you know I'll be your guiding light.

Just let my love be your pillow
Lay your worries down and rest your head on me
Just let my love be your pillow
And let me turn your life into a beautiful dream.

Well, I won't promise you there won't be hard times
We'll share whatever comes down each road of life
And if things turn out wrong you can turn to me
Let my arms be your blanket when you sleep.

Just let my love be your pillow
Lay your worries down girl rest your head on me
Just let my love be your pillow
And let me turn your life into a beautiful dream.

Just let my love be your pillow
Lay your worries down and rest your head on me
Just let my love be your pillow
And let me turn your life into a beautiful dream...",,,,,,,,
16,17,Tom Jones,"Say you'll stay until tomorrow
I can't face tonight alone
Though I know it's over and we're through
Say you'll stay until tomorrow
I need you

The words have all been said
Your mind's made up to go
You're standing by the bed
Like someone I don't know
Your love has died and there is nothing you can do
Though you try (though you try)
Yes you try (yes you try)
You can't live (you can't live)
With a lie so...

Say you'll stay until tomorrow
I can't face tonight alone
Though I know it's over and we're through
Say you'll stay until tomorrow
I need you

I've known for some time now
That thing's just ain't been right
'Cause when we try to talk
We both get so uptight
But now you've told the truth
And I know where I stand
Though it hurts (though it hurts)
Deep inside (deep inside)
Give me time (give me time)
I'll get by so...

Say you'll stay until tomorrow
I can't face tonight alone
Though I know it's over and we're through
Say you'll stay until tomorrow
I need you
Though I know it over and we're through
Say you'll stay until tomorrow
I neeeeeeeeedddd you",Say You'll Stay Until Tomorrow,Say You'll Stay Until Tomorrow,1977,10,,Track 'A1',Album,True
17,18,Mickey Gilley,"She's pulling me back again
Darling, don't let her win
Take me in your arms, right now
Hold me tight

She's standing outside again
She's wanting to come back in
So if you've ever loved
Love me tonight

I can feel her reaching
In the night
So lay a little closer
By my side

Let me take my weakness
And love it out on you
Right now, I need your love
To hold on to

She's pulling me back again
Darling, don't let her win
Take me in your arms, right now
Hold me tight

She's standing outside again
Wanting to come back in
So if you've ever loved
Love me tonight

She's pulling me back again",She's Pulling Me Back Again,She's Pulling Me Back Again / Sweet Mama Goodtimes,1977,2,2:25,Track 'A',"7""",True
18,19,Don Williams,"Coffee black, cigarettes,
Start this day, like all the rest,
First thing every morning that I do,
Is start missing you

Some broken hearts never mend,
Some memories never end,
Some tears will never dry,
My love for you will never die

Rendezvous in the night,
A willing woman to hold me tight,
But in the middle of love's embrace,
I see your face

Some broken hearts never mend,
Some memories never end,
Some tears will never dry,
My love for you will never die",Some Broken Hearts Never Mend,Some Broken Hearts Never Mend,1977,2,2:43,Track 'A',Single,True
19,20,Ronnie Milsap,"What a difference you've made in my life.
What a difference you've made in my life
You're my sunshine day and night
Oh, what a difference you've made in my life.

What a change you have made in my heart
What a change you have made in my heart
You replaced all the broken parts
Oh, what a change you have made in my heart.

Love to me was just a word in a song that had been way overused
But now I've joined in the singin'
'Cause you've shown me love's true meanin'
That's why I want to spread the news.

What a difference you've made in my life
What a difference you've made in my life
You're my sunshine day and night
Oh, what a difference you've made in my life.

What a difference you've made in my life (listen to it)
What a difference you've made in my life
You're my sunshine day and night
Oh, what a difference you've made, yeah.

What a difference you've made in my life
Difference you've made in my life
What a difference you've made in my life
You're my sunshine day and night
Oh, what a difference you've made.

Go ahead and sing it.

What a difference you've made in my life
What a difference you've made in my life, 
Yeah-heah-eah-eah-heah
You're my sunshine day and night 
Oh yeah, sing it to me
What a difference you've made.

What a difference you've made in my life, woh-oh-oh-oh
What a difference you've made in my life
You're my sunshine day and night
Oh, what a difference you've made
What a difference you've made, in my life...",What A Difference You've Made In My Life,What A Difference You've Made In My Life / Selfish,1977,2,3:57,Track 'A',Single,True
20,21,Loretta Lynn,"I've got your picture
That you gave to me
And it's signed with love
Like it used to be

The only thing different
The only thing new
I've got your picture
She's got you

I've got the records
That we used to share
And they still sound the same
As when you were here

The only thing different
The only thing new
I've got the records
She's got you

I've got your memory
Or has it got me
I really don't know
But I know it won't let me be

I've got your class
That proved you cared
And it still looks the same
As when you gave it dear

The only thing different
The only thing new
I've got these little things
She's got you",She's Got You,She's Got You,1977,2,3:04,Track 'A',Single,True
21,22,Don Williams,"I ain't gonna marry in the fall
I ain't gonna marry in the spring
'Cause I'm in love with a pretty little girl
Who wears a diamond ring

And I'm just a country boy
Money have I none
But I've got silver in the stars
Gold in the mornin' sun
Gold in the mornin' sun

Never gonna kiss
The ruby red lips
Of the prettiest girl in town
Never gonna ask her if she'd
Marry me
I know she'd turn me down

'Cause I'm just a country boy
Money have I none
But I've got silver in the stars
And gold in the mornin' sun
Gold in the mornin' sun

I never could afford
A store bought ring
With a sparkling diamond stone
All I could afford
Is a loving heart
The only one I own

'Cause I'm just a country boy
Money have I none
But I've got silver in the stars
And gold in the mornin' sun
Gold in the mornin' sun",I'm Just A Country Boy,I'm Just A Country Boy,1977,2,3:01,Track 'A',Single,True
22,23,Conway Twitty,"Play, guitar play
Take me back to yesterday
Let me see, cotton growing, in the fields
Let me hear, my momma calling
Look a-yonder y'all who's coming
Down the road, he's a coming home
But they know I never will

I left them living with that awful thing I done
I didn't tell them I just packed my clothes and run

Play, guitar play
Help me through another day
Help me make another dollar, before I go
We got time, for one more song
Then we'll have to move along
Another town, another crowd
Lord, I wonder if they know

Can they read between the lines in my song
As I sing about a good boy that's went wrong
Guitar we got years to kill
We got to climb that distant hill
I wonder if they think of me
(Guitar play)...","Play, Guitar Play","Play, Guitar Play",1977,10,,Track 'A1',LP,True
23,24,Donna Fargo,,That Was Yesterday,Fargo Country,1977,10,3:15,Track 'B4',Album,True
