,Rank,Artist,Lyrics,Title,album_name,release_date,total_tracks,duration,track_number,album_single,chart
117,N/A,Ronnie Milsap,"What a difference you've made in my life.
What a difference you've made in my life
You're my sunshine day and night
Oh, what a difference you've made in my life.

What a change you have made in my heart
What a change you have made in my heart
You replaced all the broken parts
Oh, what a change you have made in my heart.

Love to me was just a word in a song that had been way overused
But now I've joined in the singin'
'Cause you've shown me love's true meanin'
That's why I want to spread the news.

What a difference you've made in my life
What a difference you've made in my life
You're my sunshine day and night
Oh, what a difference you've made in my life.

What a difference you've made in my life (listen to it)
What a difference you've made in my life
You're my sunshine day and night
Oh, what a difference you've made, yeah.

What a difference you've made in my life
Difference you've made in my life
What a difference you've made in my life
You're my sunshine day and night
Oh, what a difference you've made.

Go ahead and sing it.

What a difference you've made in my life
What a difference you've made in my life, 
Yeah-heah-eah-eah-heah
You're my sunshine day and night 
Oh yeah, sing it to me
What a difference you've made.

What a difference you've made in my life, woh-oh-oh-oh
What a difference you've made in my life
You're my sunshine day and night
Oh, what a difference you've made
What a difference you've made, in my life...",What A Difference You've Made In My Life,It Was Almost Like A Song,1977,10,,Track 'A1',Album,False
118,N/A,Ronnie Milsap,"No one will ever know my heart is breaking
Although a million teardrops start to fall
I cry myself to sleep and wake up smiling
I'll miss you but no one will ever know.

I'll tell them we grew tired of each other
And realized our dreams could never be
I'll even make believe I never loved you
Then no one will ever know the truth but me.

No one will ever know how much I'm pining
As the past comes back to haunt me so
No one will ever see the tears I'm hiding
You've hurt me but no one will ever know.

I'll tell them we grew tired of each other
And realized our dreams could never be
I'll even make believe I never loved you
Then no one will ever know the truth but me...",No One Will Ever Know,It Was Almost Like A Song,1977,10,,Track 'A2',Album,False
119,N/A,Ronnie Milsap,"Selfish, call me selfish
'Cause I'm thinking only of me
But I can't help it,
You're everything I need.

Selfish, yeah, I'm selfish
I want you my whole life through
And I don't care if I'm selfish
When it comes to loving you.

Well, there are people wanting this, people wanting that
Everybody's chasing who knows what
But now that I've found what I want
I'm holding on to what I got.

And if that's selfish then go on and call me selfish
And I won't deny it, yes it's true
But I don't care if I'm selfish
When it comes to loving you...",Selfish,It Was Almost Like A Song,1977,10,,Track 'A4',Album,False
120,N/A,Ronnie Milsap,"To her I'm just some time she spent in '74
Just a closet she never opens anymore
It's sad to know that all we've become
Is just a long distance memory.

A now and then call to San Antone
Well, it hurts to know I'm just a friend she'll forget
Just a piece of her life that didn't fit
And tears fill my eyes when I realize she's gone
Now I'm a long distance memory.

She's a now and then call to San Antone
Will time be a healer, it's just a friend
And nothing ever fills the space where love has been
And I'm not well enough to leave well enough alone.

I'm just a long distance memory.
She's a now and then call to San Antone
No, I'm not well enough to leave well enough alone
I'm just a long distance memory.

She's a now and then call to San Antone...",Long Distance Memory,It Was Almost Like A Song,1977,10,,Track 'A5',Album,False
121,N/A,Ronnie Milsap,"Our neighbors are in Rio and wanted us to know
They're having such a good time and they're sorry that we couldn't go
My boss is in Jamaica and probably feeling sorry for us
But they don't know that we're in the best place of all, here in love.

Here in love we're enjoying the sights and the sounds
And the feelings we've found here in love
We recommend it to friends, It's the in place this year
Lets send them a card and say wish you were here in love.

We've never been to Paris and we may never see Rome
But still we know where the greenest grass grows right here at home
All our friends have flown away searching for a place in the sun
But we're here alone in a world of our own, here in love.

Here in love we're enjoying the sights and the sounds
And the feelings we've found here in love
We recommend it to friends, It's the in place this year
Lets send them a card and say wish you were here, in love.

Here in love we're enjoying the sights and the sounds
And the feelings we've found here in love
We recommend it to friends, It's the in place this year
Lets send them a card and say wish you were here in love.

Here in love we're enjoying the sights and the sounds
And the feelings we've found here in love
We recommend it to friends, It's the in place this year
Lets send them a card and say wish you were here in love.

Here in love we're enjoying the sights and the sounds
And the feelings we've found here in love
We recommend it to friends, It's the in place this year
Lets send them a card and say wish you were here in love...",Here In Love,It Was Almost Like A Song,1977,10,,Track 'B1',Album,False
122,N/A,Ronnie Milsap,"I left Decatur helping to forget her
Bought a ticket to Skowhegan, Maine
I wound up in Seattle too drunk and too rattled
To know that I caught the wrong train.

I met some fast easy women and some hard drinking men
Trying to drown the sorrow in me
Ah I once had a lot but the future is not
Not what it used to be.

Ah the years they went by and I went steadily down
Till I had no place to go
Made the soup lines by morning and the dives every night
Wrecking my body and soul.

And then I met a lady and in time she made me forget
Yes her love set me free
Ah we ain't got a lot but the future is not
Not what it used to be.

Oh I never thought I could live to get over
For the past cut a hole deep in me
But there's a chance I'll be here a while longer
At least now I wanna be.

Somebody told me that you were in town
I found out today
And you know that I'm sorry to hear that you're down
But what can I say.

That I know your sorrow and I know your pain
Don't you know I know your need
I used to love you a lot but the furture is not
Not what it used to be...",The Future Is Not What It Used To Be,It Was Almost Like A Song,1977,10,,Track 'B2',Album,False
123,N/A,Ronnie Milsap,"Arms go ahead and hold her the way we want to
Lips don't be shy kiss her the way we planned to
It will be our secret no one will ever know a thing
We're only dreaming and it don't hut to dream.

Eyes keep on looking, ain't she a sight to see
Hands touch her hairIs it really as soft as it seems
Fingers caress her gently remove her wedding ring
We're only dreaming and it don't hurt to dream.

We're only dreaming, Lord, if it only were real
I know we could think up a thousand ways to show her how we feel
But we'll never have her... That's the way it's gotta be
We're only dreaming and it don't hurt to dream.

We'll keep on dreaming 'cause it don't hurt to dream...",It Don't Hurt To Dream,It Was Almost Like A Song,1977,10,,Track 'B3',Album,False
124,N/A,Ronnie Milsap,"When everyone you love hurts you in return
And when every road you take is just another lesson learned
And when the shadows catch you crying looking back at yesterday
Just listen to the magic sound of the crystal falling rain.

As the rain comes down and you look out through the blinds
You know somewhere I'll be watching too from another place and time
And if you have a need for loving just press your lips against the pane
And know somewhere I'll be kissing you through the crystal falling rain.

For all the love we once had now it's painful to believe
That we're one more card at Christmas and one less set of keys
But if you ever count your memories and a tear falls on my cheek
Just listen to the magic sound of the crystal falling rain.

As the rain comes down and you look out through the blinds
You know somewhere I'll be watching too from another place and time
And if you have a need for loving just press your lips against the pane
And know somewhere I'll be kissing you through the crystal falling rain",Crystal Fallin' Rain,It Was Almost Like A Song,1977,10,,Track 'B4',Album,False
125,N/A,Ronnie Milsap,,The Lovin' Kind,It Was Almost Like A Song,1977,10,,Track 'B5',Album,False
126,N/A,The Kendalls,,Makin' Believe,Heaven's Just A Sin Away,1977,10,,Track 'A1',LP,False
127,N/A,The Kendalls,,Let Me Get Lost,Heaven's Just A Sin Away,1977,10,,Track 'A2',LP,False
128,N/A,The Kendalls,,Sing Me,Heaven's Just A Sin Away,1977,10,,Track 'A3',LP,False
129,N/A,The Kendalls,,I'm A Pushover (For A Country Song),Heaven's Just A Sin Away,1977,10,,Track 'A4',LP,False
130,N/A,The Kendalls,,Don't Call Me Your Only Sunshine,Heaven's Just A Sin Away,1977,10,,Track 'A5',LP,False
131,N/A,The Kendalls,,Live And Let Live,Heaven's Just A Sin Away,1977,10,,Track 'B1',LP,False
132,N/A,The Kendalls,,Let The Music Play,Heaven's Just A Sin Away,1977,10,,Track 'B2',LP,False
133,N/A,The Kendalls,,You're My Man,Heaven's Just A Sin Away,1977,10,,Track 'B3',LP,False
134,N/A,The Kendalls,,Don't Let Me Cross Over,Heaven's Just A Sin Away,1977,10,,Track 'B5',LP,False
135,N/A,Elvis Presley,"O beautiful for spacious skies
For amber waves of grain
For purple mountain majesties
Above thy fruited plain
America, America
God shed His grace on thee
And crown thy good with brotherhood
From sea to shining sea
For beautiful... for spacious skies
For amber waves of grain
For purple mountain... majesties
Above the fruited plain...
America!...America!...
God shed His grace... on thee...
And crowned thy good, with brotherhood
From sea... to shining sea...
America!..America!
God shed his grace on thee
And crown thy good with brotherhood
From sea... to... shining... sea!
America!...",America,My Way,1977,2,3:51,Track 'B',Single,False
136,N/A,Charlie Rich,,Somebody Wrote That Song For Me,Rollin' With The Flow,1977,10,2:40,Track 'A2',Album,False
137,N/A,Charlie Rich,,Windsong,Rollin' With The Flow,1977,10,2:21,Track 'A3',Album,False
138,N/A,Charlie Rich,"Love is a baby drinkin' from his mama's breast
Love is a robin buildin' springtimes nest
Love is you lovin' me
Baby, baby, that's what love is

Love is a rose bloomin' in the rain
Love is a reason for every precious thing
Love is me lovin' you
Baby, baby, that's what love is

Love is a key to everythin' locked up
Inside of your heart and your mind
Love is you lovin' me
Baby, baby, baby, that's what love is

You whisper you love me
And send me to the clouds
However I can fly much higher
When you say the words of love

Love will be around until the end of time
Love will last baby as long as you are mine
Love is me lovin' you, lovin' me, lovin' you
Lovin' me, lovin' you

Like a baby drinkin' from his mama's breast
Love is a robin buildin' springtimes nest",That's What Love Is,Rollin' With The Flow,1977,10,2:32,Track 'A4',Album,False
139,N/A,Charlie Rich,,Night Talk,Rollin' With The Flow,1977,10,2:56,Track 'A5',Album,False
140,N/A,Charlie Rich,"You are my dream come true
And I believe in you, beautiful woman
And you are like a breath of spring
Warm like the summer rain, beautiful woman

Every breath I take
Every move that I make
I'm reaching out
(Reaching out, reaching out)

Just to get a little closer
Just a little bit closer
Move a little closer, baby
Closer, closer

You, you are my dream come true
And I believe in you, beautiful woman

Every breath I take
Every move I make
I'm reaching out
(Reaching out, reaching out)

Just to get a little closer
Just a little bit closer
Move a little closer, baby
Closer, closer to you

You are my dream come true
And I believe in you, beautiful woman
And you are like a breath of spring
Warm like summer rain, beautiful woman",Beautiful Woman,Rollin' With The Flow,1977,10,3:25,Track 'B1',Album,False
141,N/A,Charlie Rich,,To Sing A Love Song,Rollin' With The Flow,1977,10,2:51,Track 'B2',Album,False
142,N/A,Charlie Rich,,Love Survived,Rollin' With The Flow,1977,10,2:53,Track 'B3',Album,False
143,N/A,Charlie Rich,,Somewhere In My Lifetime,Rollin' With The Flow,1977,10,3:01,Track 'B4',Album,False
144,N/A,Charlie Rich,,That's The Way A Cowboy Rocks And Rolls,Rollin' With The Flow,1977,10,3:29,Track 'B5',Album,False
145,N/A,Kenny Rogers,"Desperado, why don't you come to your senses
You've been out ridin' fences for so long now
Oh and you're a hard one, but I know that you've got your reasons
The things that are pleasin' you, can hurt you somehow.

Don't you draw the queen of diamonds boy, she'll beat you if she's able
You know the queen of hearts is always your best bet
Now it seems to me some fine things have been laid upon your table
But you only want the ones you can't get.

Desperado, you ain't gettin' no younger
Your pain and your hunger, they're drivin' you home
And freedom, oh freedom, well that's just some people talkin'
Your prison is walking through this world all alone.

Don't your feet get cold in the wintertime
The sky won't snow and the sun won't shine
It's hard to tell the nighttime from the day
And you're losin' all your highs and lows
Ain't it funny how the feelin' goes away?

Desperado, why don't you come to your senses
Come down from your fences- open the gates
It may be rainin, but there's a rainbow above you
You'd better let somebody love you, let somebody love you.

You'd better let somebody love you
Before it's too late...",Desperado,Daytime Friends,1977,11,3:10,Track 'A2',Album,False
146,N/A,Kenny Rogers,,Rock And Roll Man,Daytime Friends,1977,11,3:44,Track 'A3',Album,False
147,N/A,Kenny Rogers,"The morning sun woke me 
I felt the warm soft skin beneath my hands 
The last night the devil got to me 
In the day I'm just a common man. 

So I'll get up and say goodbye 
And on the way home I'll make up my life 
That holds our lives together 
One more time. 

I'll be lying again, I'll be trying again 
Hoping I don't hurt you like the last time 
But you'll be crying again 
You know I'm lying again 
Telling you this is the last time.",Lying Again,Daytime Friends,1977,11,2:46,Track 'A4',Album,False
148,N/A,Kenny Rogers,"I've tried in every way I could to share my love
Every girl I've ever known rearranged my love
I guess I'm not the kind of guy that turns the ladies on
So I'll just write my music and sing my songs
I'll just write my music and sing my songs
Good or bad, weak or strong I'll write right on
Cause my melodies and my harmonies never turn out wrong
So I'll just write my music and sing my songs

I'll write a song about heartache, cause heartache is my namesake
We've come to know each other so very well
And misery is my lover, it's closer than my brother
Cause it runs in my bloodstream so deep and so mean

I've seen LA, New Orleans and New York town
I have yet one time to say that I have found
A love that's real, the kind that makes you feel like a soul is heaven-bound
Heaven-bound, heaven-bound, heaven-bound

I'll write a song about heartache, cause heartache is my namesake.
We've come to know each other so very well
And misery is my lover, it's closer than a brother
Cause it runs in my bloodstream so deep and so mean

Cause my melodies and my harmonies never turn out wrong
I'll just write my music and sing my songs
So I'll just write my music and sing my songs",I'll Just Write My Music And Sing My Songs,Daytime Friends,1977,11,2:41,Track 'A5',Album,False
149,N/A,Kenny Rogers,"My world was no more than a dream
And waitin' on a dream can sure get lonely
Your love just fell right into place
And filled and empty space to overflowing, overflowing
My world begins with havin' a friend when I'm feeling blue
My world would end if ever I heard you say we were through
Just don't know what I'd do
Cause my world begins and ends with you
Sometimes I tell little lies to see if your eyes are looking through me
But you know lying's not my style
I just need your smile coming to me
Reassuring me
My world begins with havin' a friend when I'm feeling blue
My world would end if ever I heard you say we were through
Just don't know what I'd do
Cause my world begins and ends with you",My World Begins And Ends With You,Daytime Friends,1977,11,2:55,Track 'A6',Album,False
150,N/A,Kenny Rogers,"I wouldn't listen, and I couldn't see,
And all I have left now,
Are words you said to me

Sing me a song sweet music man,
'Cause I won't be there to hold your hand
Like I used to, 
I'm through with you
You're a helluva singer
And a powerful man but you surround yourself
With people who demand so little of you
You touched my soul with your beautiful song
You even had me singing along right with you
You said ""I need you""
Then you changed the words and that harmony
And you sang that song you'd written for me 
To someone new

But nobody sings a love song quite like you do,
And nobody else can make me sing along,
And nobody else can make me feel
That things are right when you know they're wrong,
Nobody sings a love song quite like you.

Sing me a song sweet music man,
Your making a living doing one night stands
That do for you what you need them to
Your still a hell of a singer but a broken man
And you surround yourself with people who demand
So little of you

But nobody sings a love song quite like you do,
You travel the world with a six piece band
That does for you what you ask 'em to
And you try to stay up with the songs you sung
To so many people that all begun to come
Back on you

Sing me a song sad music man
You're making your living doing one night
Stands that's do with you they
Don't need you, you're still a helluva singer
But a broken man but you keep on looking for
One last band to sing with you

But nobody sings a love song quite like you do,
And nobody else can make me sing along,
And nobody else can make me feel
That things are right when you're wrong with a song,
Nobody sings a love song quite like you.

So sing me a song sweet music man,
I believe in you",Sweet Music Man,Daytime Friends,1977,11,2:43,Track 'B1',Album,False
151,N/A,Kenny Rogers,"I don't' understand your hesitation
You always were so quit to say, what needed to be said
But you're standing there saying nothing
Please, say something, just don't tell me I'm too late.

It took a while for me to understand my feelings for you
I hope it's not too late to say I love you, 'cause I do
Before you turn away and the chance I had to love you is gone
You've got to know I've finally found a feeling
I know I've not told you but I've lived my life to hold you.

Am I too late to show myself, is it too late to let you know
Do you feel me, I'm touching you
It scares me to think you might say ""no""
'Cause it's too late to let you go.

But you're standing there saying nothing
Please, say something, just don't tell me I'm too late.

Just don't tell me that I'm too late to show myself, is it too late to let you know
Do you feel me, I'm touching you
It scares me to think you might say ""no""
'Cause it's too late to let you go.",Am I Too Late,Daytime Friends,1977,11,4:16,Track 'B2',Album,False
152,N/A,Kenny Rogers,"The love that we have
Is not so bad
Unless you think about
The love that we had
I don't know, who closed the door
But we don't make love anymore

We used to love
You used to care
Now it's hard to find
The feeling we shared
You found a way
To even the score
And we don't make love anymore

So come lie down
Beside me and talk to me
Touch me with your body and your mind
Help me find the feeling 
And push all this behind
We'll make sweet, sweet love one more time

But you won't try
And I'll understand
We'll just live our lives
The best we can
We turn out the lights
We still lock the door
But we don't make love anymore",We Don't Make Love Anymore,Daytime Friends,1977,11,3:31,Track 'B3',Album,False
153,N/A,Kenny Rogers,"He's living in that big old house that he knows was built by me
He's playing with the baby that belongs to her and me.
At night he loves a woman that was held by these two hands
He must be leaving hell to live with a ghost of another man.
My name is in the side wall outside our bedroom door
He can't help but see what's too dare in me everywhere he goes.
He gladly walked through heaven to forget what he can't stand
He must be leaving hell to live with a ghost of another man.
I don't mean to haunt him when they turn out the lights
I'm there in the bedroom with both of them each night.
And he wonders if he just loved her
As good as I loved her back then
He must be leaving hell to live
With a ghost of another man.",Ghost Of Another Man,Daytime Friends,1977,11,3:51,Track 'B4',Album,False
154,N/A,Kenny Rogers,,Let Me Sing For You,Daytime Friends,1977,11,2:57,Track 'B5',Album,False
155,N/A,Linda Ronstadt,"I ride an old paint
I lead an old dam
I'm going to Montana
To throw a houlihan
They feed in the coolies
They water in the draw
Their tails are all matted
Their backs are all raw

Ride around
Ride around real slow
The fiery and the snuffy are raring to go

Old Bill Brown
Had a daughter and a son
One went to Denver
And the other went wrong
His wife she died in a poolroom fight
And still he keeps singing from morning till night

Ride around
Ride around real slow
Well the fiery and the snuffy are raring to go

Well when I die
Take my saddle from the wall
Put it on my pony
And lead him from his stall
Tie my bones to his back
Turn our faces to the west
And we'll ride the prairie
That we like the best

Ride around
Ride around real slow
Well the fiery and the snuffy are raring to go

Ride around
Ride around real slow
Well the fiery and the snuffy are raring to go",Old Paint,Blue Bayou / Old Paint,1977,2,3:57,Track 'B',Single,False
156,N/A,Tom Jones,"You caught me fooling around with somebody new
You caught me fooling around now I'm losing you
'Cause you're a one man woman
You're a one man woman
You're a one man woman
But I'm a two timing man

The nights you left me alone
And you disappeared
The nights your voice on the phone
Said I'm waiting here

'Cause I'm a one man woman
Yes, you're a one man woman
'Cause I'm a one man woman
But I'm a two timing man

Oh Baby you know I'm sorry
Oh sure, it's the same old story
I keep coming back
And I let you
'Cause I'd rather forgive than forget you

Now I won't need no chains to tie me down
You lost you're way my love
But now you've found
That I'm a one man woman
Yes, you're a one man woman
Oh, I'm a one man woman
But I'm a two timing man

I'm a one man woman
I'll be your one woman man
You're a one man woman
I'm a one woman man
Yes, you're a one man woman
You're a one woman man...",One Man Woman,Say You'll Stay Until Tomorrow,1977,10,,Track 'A2',Album,False
157,N/A,Tom Jones,"Oh, how we danced on the night we were wed
We vowed our true love, though a word wasn't said
The world was in bloom, there were stars in the skies
Except for the few that were there in your eyes 

Dear, as I held you close in my arms
Angels were singing a hymn to your charms
Two hearts gently beating, murmuring low 
""Darling, I love you so"" 

The night seemed to fade into blossoming dawn 
The sun shone anew but the dance lingered on
Could we but recall that sweet moment sublime
We'd find that our love is unaltered by time 

Dear, as I held you close in my arms
Angels were singing a hymn to your charms
Two hearts gently beating, murmuring low 
""Darling, I love you so""",Anniversary Song,Say You'll Stay Until Tomorrow,1977,10,,Track 'A3',Album,False
158,N/A,Tom Jones,"You like to mix with people
But I like to be alone
Baby you can stay out all night
I'd just as well stay home

Two people with so little in common
And different as we can be
We come together 'round midnight
When it's just you and me

When it's just you and me and there's nothing between us
Oh, but our own sweet love
When it's time to be tender
We try to remember what we're doin' here

Baby, I don't mind we're not two of a kind but if we agree
Sometime along 'round midnight when it's just you and me

You love to hear the music and get up and dance around
Baby, you can act so crazy, you turn it up way too loud
Now, I've got my share of hang-ups but you never seem to see
And as we come together 'round midnight when it's just you and me

When it's just you and me and there's nothing between us
Oh, but our own sweet love
When it's time to be tender
We try to remember what we're doin' here

Baby, I don't mind we're not two of a kind but if we agree
Sometime along 'round midnight when it's just you and me
Baby, I don't mind we're not two of a kind but if we agree
Sometime along 'round midnight when it's just you and me",When It's Just You And Me,Say You'll Stay Until Tomorrow,1977,10,,Track 'A4',Album,False
