,Rank,Artist,Lyrics,Title,album_name,release_date,total_tracks,duration,track_number,album_single,chart
96,97,George Strait,"If it was in your mind 
To really cut me down. 
If it was in your plan 
To walk me in the ground. 
You left with him last night 
And daylight told the rest. 
And if you planned on hurtin' me, 
You're an overnight success. 

I couldn't blame someone 
Who'd steal your love away, 
Because I know what I've lost 
And all he's gained. 
Sweetheart last night I know 
He's got the very best. 
And if you planned on hurtin' me, 
You're an overnight success. 

Can you handle all you've won 
From breakin' my pride? 
Will he stay with you and help you 
Spend all the tears I've cried? 
Sweetheart, I love you so 
And wish you, happiness. 
And if you planned on hurtin' me, 
You're an overnight success...",Overnight Success,Overnight Success / Hollywood Squares,1989,2,3:07,Track 'A',Single,True
97,98, Marty Stuart,"It comes from Mississippi and down in Alabam
Creepin' like a fever all across the land
From deep in the Delta on the Louisiana shore
The people got to have it, they wanna hear some more 

It's the hillbilly rock, beat it with a drum
Playin' them guitars like shootin' from a gun
Keepin' up the rhythm, steady as a clock
Doin' a little thing called the hillbilly rock

Some say it came from Memphis, down in Tennessee
Or it drifted in from Georgia about 1953
Just as long as it's greasy, as long as it's fast
As long as it's pumpin', honey, it's gonna last

It's the hillbilly rock, beat it with a drum
Playin' them guitars like shootin' from a gun
Keepin' up the rhythm, steady as a clock
Doin' a little thing called the hillbilly rock

Way back in old Kentucky where the bluegrass grows
Through the Carolinas on them dirt red roads
Burnin like a fire runnin' wild in the woods
From Arkansas to Texas, it sounds so good

It's the hillbilly rock, beat it with a drum
Playin' them guitars like shootin' from a gun
Keepin' up the rhythm, steady as a clock
Doin' a little thing called the hillbilly rock

So when the heat starts to risin' and you gotta blow some steam
Take a ride down the river, you'll see just what I mean
The juke joint's jumpin' when that cat goes on
The whole place is shakin', there's a-something goin' on

It's the hillbilly rock, beat it with a drum
Playin' them guitars like shootin' from a gun
Keepin' up the rhythm, steady as a clock
Doin' a little thing called the hillbilly rock
Doin' a little thing called the hillbilly rock
Doin' a little thing called the hillbilly rock",Hillbilly Rock,Hillbilly Rock,1990,2,2:38,Track 'A',Single,True
98,99,Marty Stuart,"Well, when the sun goes down at the end of the day
I want to see you again, I've got to find a way
Just to hear those little things you say

The way you touch me baby, the way you squeeze me tight
And when you hold me darlin' all through the night 
Those little things make me feel all right

(Little things) like the way you kiss
(Little things) that I can't resist
(Little things) make me feel so fine
I've got to have your lovin' honey all the time
(Little things) ooh, when we touch
(Little things) you know they mean so much
(Little things) never make me blue
I love those little things you do

I've got a fever baby and it's burnin' hot
I'm gonna give you my love, everything I've got
Cause those little things sure mean a lot

(Little things) like the way you kiss
(Little things) that I can't resist
(Little things) make me feel so fine
I've got to have your lovin' honey all the time
(Little things) ooh, when we touch
(Little things) you know they mean so much
(Little things) never make me blue
I love those little things you do

(Little things) like the way you kiss
(Little things) that I can't resist
(Little things) make me feel so fine
I've got to have your lovin' honey all the time
(Little things) ooh, when we touch
(Little things) you know they mean so much
(Little things) never make me blue
I love those little things you do
I love those little things you do
I love those little things you do",Little Things,Little Things,1990,2,3:10,Track 'A',Single,True
99,100,Willie Nelson,"It might be in the middle of the afternoon
Maybe somewhere in the middle of the night
I might not be thinking anything at all
When a perfect stranger's face catches a certain light

And my heart jumps 'cause all at once
There you are, standing right in front of me
There you are, as lovely as you'll always be
And here I go back into those memories
Where you are, still in love with me

I know I'll never hold you in my arms again
I know I'll never hear you speak my name
I look around this lonely room and I can see
Your memory's the only thing that hasn't changed

And I close my eyes and every time
There you are, standing right in front of me
There you are, as lovely as you'll always be
And here I go back into those memories
Where you are, still in love with me

There you are, still in love with me",There You Are,There You Are / Spirit,1989,2,3:04,Track 'A',Single,True
100,N/A,Alabama,"If I could design forever
I'd put you and me together each night
Together each night
The best I can do is promise
I'll love you true and honest and right
I'll love you right

Starting tonight and from now on
I will be yours and yours alone
Dependable and strong
A rock by your side
I'll be beside you through the storm
You'll have a fire to keep you warm
Not just for now but from now on
Starting tonight

If a man ever loved a woman
Then surely this is the moment for me
The moment for me
I've never known a feeling
So deep so real as being with you
As being with you

Starting tonight and from now on
I will be yours and yours alone
Dependable and strong
A rock by your side
I'll be beside you through the storm
You'll have a fire to keep you warm
Not just for now but from now on
Starting tonight...",Starting Tonight,Forever's As Far As I'll Go,1990,2,3:36,Track 'B',Single,False
101,N/A,Garth Brooks,"First time he saw the ground get busted 
He was ten and it was 1952 
His daddy worked hard from sunup to sundown 
And the goin' got tough behind them ol' grey mules 

The farm grew to be a moneymaker 
And the house he lived in grew up room by room 
The boy worked hard but soon got tired of farmin' 
So he slipped away one night 'neath the harvest moon 

His neck was red as Alabama clay 
But the city's call pulled him away 
He's got a factory job and runs a big machine 
He don't miss the farm or the fields of green 

Now the city's just a prison without fences 
His job is just a routine he can't stand 
And at night he dreams of wide-open spaces 
Fresh dirt between his toes and on his hands 

Then one day a picture came inside a letter 
Of a young girl with a baby in her arms 
And the words she wrote would change his life forever 
So he went to raise his family on the farm 

His neck is red as Alabama clay 
Now he's goin' home this time to stay 
Where the roots run deep on the family tree 
And the tractor rolls through the fields of green 

His neck is red as Alabama clay 
Now he's goin' home this time to stay 
Where the roots run deep on the family tree 
And the tractor rolls through the fields of green 

His neck is red as Alabama clay",Alabama Clay,Unanswered Prayers,1990,2,3:23,Track 'B',Single,False
102,N/A,Alabama,"In the corner of my mind stands a jukebox
It's playin' all my favorite mem-o-ries
One by one, they take me back
To the days when you were mine
And I can't stop this jukebox in my mind.

I don't need no quarters, don't need any dime
You filled it up forever
When you said good-bye
Heaven knows I love old melodies
They were meant to ease the pain
But the kind that's playin' on my mind
Are drivin' me insane.

In the corner of my mind stands a jukebox
It's playin' all my favorite mem-o-ries
One by one, they take me back
To the days when you were mine
And I can't stop this jukebox in my mind.

Song by song, those melodies
Were meant to ease the pain
But the kind that's playin' on my mind
Are drivin' me insane;

In the corner of my mind stands a jukebox
It's playin' all my favorite mem-o-ries
One by one, they take me back
To the days when you were mine
And I can't stop this jukebox in my mind.",Jukebox In My Mind (Edited Single Version),Jukebox In My Mind,1990,2,3:39,Track 'A',Single,False
103,N/A,Garth Brooks,"Nobody gets off in this town 
Trains don't even slow down
My high school sweetheart's married and gone
They met on a bus to San Antone 
The Greyhound stops and somebody gets on
But nobody gets off in this town 

Nobody gets off in this town 
Old folks 'round here wear a frown
Now let me see if I can set the scene 
It's a one-dog town and he's old and mean 
There's one stoplight but it's always green 
Nobody gets off in this town 

Nobody gets off in this town 
High school colors are brown 
They can't drag Main because it kicks up dust
Their cars and their dreams are all starting to rust
The high school dances are always a bust 
Nobody gets off in this town 

Nobody gets off in this town
They oughta just tear it down 
'Cause in the winter you freeze, and in the summer you fry
Utility bill's the only thing that gets high 
I'd go for a drink but this county is dry 
Nobody gets off, nobody gets off 
Nobody gets off in this square old merry-go-round 
No, nobody gets off in this town",Nobody Gets Off In This Town,Friends In Low Places (Edited) / Nobody Gets Off In This Town,1990,2,3:45,Track 'B',Single,False
104,N/A,George Strait,"Well, here we sit at a table for two
But bottle, there's just me and you
She loved me so, but I loved her so wrong
I gave her too much of too little, too long

So tell me bottle, are the things I hear true
That all the answers are in the bottle, of you
I need your help, this memory's is so strong
I gave her too much of too little, too long

Sometimes a man can get lost in a world of his own
He'll neglect his real world, who's waiting at home
A woman needs her man's love, to lean on
I gave her too much of too little, too long

I gave her too much of too little, too long...",Too Much Of Too Little,"Love WIthout End, Amen",1990,2,3:06,Track 'B',Single,False
105,N/A,Garth Brooks,"When loving turns to heart ache
I'm always the first to leave
'Cause when it comes to heart aches
I'd rather give than to receive
I've never cried myself to sleep
Just praying I'll get through
I've never lost a love
Not Counting You

Not counting you, I've never had a heart ache
Not counting you, I never have been blue
There's no exceptions to the rule
I've never been nobody's fool
I've never lost a love
Not Counting You

I've never got down on my knees
And asked the Lord above
If he would only bring me
The one I'm dreaming of
Begging to be taken back
And swearing I'll be true
Has never crossed my mind
Not Counting You

Not counting you, I've never had a heart ache
Not counting you, I never have been blue
There's no exceptions to the rule
I've never been nobody's fool
I've never lost a love
Not Counting You

There's no exceptions to the rule
I've never been nobody's fool
I've never lose a love
Not Counting You

I've never lost a love
Not Counting You",Not Counting You,Garth Brooks,1989,10,2:30,Track 'A1',Album,False
106,N/A,Garth Brooks,"She swears there's nothing wrong, but something's missing 
She's never been much good at telling lies 
'Cause you can hear the sound of leaving, if you listen 
This may be California, but Oklahoma's in her eyes 

I've got a good thing going 
It's plain to see she's tired of hanging on 
I've got a good thing going 
It's killing me that she's as good as gone 

By now she must be tired of always giving 
And tired of what she's getting in return 
I guess Oklahoma's more her style of living 
'Cause I can see her heart is heading 'cross a bridge I thought she'd burned 

I've got a good thing going 
It's plain to see she's tired of hanging on 
I've got a good thing going 
It's killing me that she's as good as gone 

Lord it's killing me that she's as good as gone",I've Got A Good Thing Going,Garth Brooks,1989,10,2:50,Track 'A2',Album,False
107,N/A,Garth Brooks,"Sometimes late at night
I lie awake and watch her sleeping
She's lost in peaceful dreams
So I turn out the lights and lay there in the dark
And the thought crosses my mind
If I never wake up in the morning
Would she ever doubt the way I feel
About her in my heart

If tomorrow never comes
Will she know how much I loved her
Did I try in every way to show her every day
That she's my only one
And if my time on earth were through
And she must face the world without me
Is the love I gave her in the past
Gonna be enough to last
If tomorrow never comes

'Cause I've lost loved ones in my life
Who never knew how much I loved them
Now I live with the regret
That my true feelings for them never were revealed
So I made a promise to myself
To say each day how much she means to me
And avoid that circumstance
Where there's no second chance to tell her how I feel

If tomorrow never comes
Will she know how much I loved her
Did I try in every way to show her every day
That she's my only one
And if my time on earth were through
And she must face the world without me
Is the love I gave her in the past
Gonna be enough to last
If tomorrow never comes

So tell that someone that you love
Just what you're thinking of
If tomorrow never comes",If Tomorrow Never Comes,Garth Brooks,1989,10,3:37,Track 'A3',Album,False
108,N/A,Garth Brooks,"Stuck in an airport in Austin
All of the flights are delayed
And as the rain keeps fallin', the mem'ries keep callin' me back
To another time and place
Back to a rainy day in Oklahoma
She was workin' at a roadside cafe
And it was just her and me and looked like it would be
At least till the storms rolled away

I played ""Please Come to Boston"" on the jukebox
She said, ""Hey that's my favorite song""
The next thing I knew
The song was all through
And we were still dancin' along
With that look in her eyes she pulled from me
Then she pulled off that apron she wore
And with her hand in mine we turned off the sign
And locked the rain outside the door

Everytime that it rains
I can hear her heart callin'
It rains
I can see that dress fallin'
The storm clouds roll on
Still the memory remains
Every time that it rains

One late rainy night I got a phone call
So I went back to see her again
And through the dance we both stumbled
And with the buttons we fumbled
So we decided just to call it at friends
If we ever had a thing now it's over
And only the memory remains
Of a roadside cafe on a September day
I relive every time that it rains


Everytime that it rains
I can hear her heart callin'
It rains
I can see that dress fallin'
The storm clouds roll on
Still the memory remains
Every time that it rains",Everytime That It Rains,Garth Brooks,1989,10,4:07,Track 'A4',Album,False
109,N/A,Garth Brooks,"First time he saw the ground get busted 
He was ten and it was 1952 
His daddy worked hard from sunup to sundown 
And the goin' got tough behind them ol' grey mules 

The farm grew to be a moneymaker 
And the house he lived in grew up room by room 
The boy worked hard but soon got tired of farmin' 
So he slipped away one night 'neath the harvest moon 

His neck was red as Alabama clay 
But the city's call pulled him away 
He's got a factory job and runs a big machine 
He don't miss the farm or the fields of green 

Now the city's just a prison without fences 
His job is just a routine he can't stand 
And at night he dreams of wide-open spaces 
Fresh dirt between his toes and on his hands 

Then one day a picture came inside a letter 
Of a young girl with a baby in her arms 
And the words she wrote would change his life forever 
So he went to raise his family on the farm 

His neck is red as Alabama clay 
Now he's goin' home this time to stay 
Where the roots run deep on the family tree 
And the tractor rolls through the fields of green 

His neck is red as Alabama clay 
Now he's goin' home this time to stay 
Where the roots run deep on the family tree 
And the tractor rolls through the fields of green 

His neck is red as Alabama clay",Alabama Clay,Garth Brooks,1989,10,3:35,Track 'A5',Album,False
110,N/A,Garth Brooks,"This ol' highway's gettin' longer
Seems there ain't no end in sight
To sleep would be best, but I just can't afford to rest
I've got to ride in Denver tomorrow night.

I called the house but no one answered
For the last two weeks no one's been home
I guess she's through with me, to tell the truth I just can't see
What's kept the woman holdin' on this long.

And the white line's gettin' longer, and the saddle's gettin' cold
I'm much too young to feel this damn old
All my cards are on the table with no ace left in the hole
I'm much too young to feel this damn old.

The competition's gettin' younger
Tougher broncs, you know I can't recall
The worn out tape of Chris LeDoux, lonely women and bad booze
Seem to be the only friends I've left at all.

And the white line's gettin' longer, and the saddle's gettin' cold
I'm much too young to feel this damn old
All my cards are on the table with no ace left in the hole
I'm much too young to feel this damn old.

Lord, I'm much too young to feel this damn old.",Much Too Young (To Feel This Damn Old),Garth Brooks,1989,10,2:53,Track 'B1',Album,False
111,N/A,Garth Brooks,"He told a good story
And all us kids listened
About his life on the border
And the way it was then
And we'd all believe
And when he was finished
We'd ask the old cowboy
To tell them again

You could almost hear
Those prairie winds blowin'
His saddle a creaking
'Neath his old faded jeans
You could taste the dry dust
From the trail he was ridin',
As he sat there and painted
Those west Texas scenes

And the grownups would tell us, ""You boys keep your distance""
""That old man's just telling you lies""
But to all us kids
Cowboy Bill was a hero
Just as true
As his blue Texas skies.

He told of the time
When he rode with the Rangers
Down on the Pecos
And he saved the day
Outnumbered by plenty
They were almost to cover
With 30 banditos
Headed their way

He looked back just in time
To see a horse stumble
The captain went down
And Bill pulled up on his reins
And through a flurry of bullets
He rescued the captain
They rode for a sunset
Just the story remains

And the grownups would tell us, ""You boys keep your distance""
""That old man's just telling you lies""
But to all us kids
Cowboy Bill was a hero
Just as true
As his blue Texas skies.

Well I still remember
The day that it happened
We waited and we waited
But Bill never showed
The folks at the feed store
Said that they hadn't seen him
So we set out for his place
Down old Christville road

And we cried when we found him
Lying there with his memories
The old trunk wide open
Things scattered about
He was clutching a badge
That said, ""Texas Ranger""
And in old yeller letters
Said, ""Texas Is Proud""

And those grownups that told us, ""You boys keep your distance""
That old man's just tellin' you lies""
Well now
They're all saying
That Cowboy Bill was a hero
Just as true
As his blue Texas skies

Just as true
As his blue Texas skies",Cowboy Bill,Garth Brooks,1989,10,4:28,Track 'B2',Album,False
112,N/A,Garth Brooks,"Nobody gets off in this town 
Trains don't even slow down
My high school sweetheart's married and gone
They met on a bus to San Antone 
The Greyhound stops and somebody gets on
But nobody gets off in this town 

Nobody gets off in this town 
Old folks 'round here wear a frown
Now let me see if I can set the scene 
It's a one-dog town and he's old and mean 
There's one stoplight but it's always green 
Nobody gets off in this town 

Nobody gets off in this town 
High school colors are brown 
They can't drag Main because it kicks up dust
Their cars and their dreams are all starting to rust
The high school dances are always a bust 
Nobody gets off in this town 

Nobody gets off in this town
They oughta just tear it down 
'Cause in the winter you freeze, and in the summer you fry
Utility bill's the only thing that gets high 
I'd go for a drink but this county is dry 
Nobody gets off, nobody gets off 
Nobody gets off in this square old merry-go-round 
No, nobody gets off in this town",Nobody Gets Off In This Town,Garth Brooks,1989,10,2:17,Track 'B3',Album,False
113,N/A,Garth Brooks,"When all your loves have ended 
When all your friends have flown 
Who'll be around to want you 
When all your loves have gone 

Only a fool would do it 
After the way you've done 
And how many fools would have you 
I Know One 

This fool keeps wondering why he fell in love at all 
But you might need this fool around in case you fall 
After the party's over and you've had your fill of fun 
If you need a fool to forgive you... I Know One 

You never know you might be lonely when all your loves have missed 
It wouldn't hurt to keep an extra fool on your list 
After your heart's been broken and you need a place to run 
If you'll take a fool who loves you... I Know One",I Know One,Garth Brooks,1989,10,2:49,Track 'B4',Album,False
114,N/A,George Strait,"There's a stranger in my arms tonight
And I know the reason why
I've left her all alone one two many times
She use to tremble at my touch
And her kiss was soft and warm
But tonight, there's a stranger in my arms

She still look's the same
And she still talks the same
And she answers when I call her by the same name
But now to late I realize
I let her love for me die
There's a stranger in my arms, tonight

She still look's the same
And she still talks the same
And she answers when I call her by the same name
But now to late I realize
I let her love for me die
There's a stranger in my arms, tonight

There's a stranger in my arms, tonight...",Stranger In My Arms,I've Come To Expect It From You,1990,2,3:44,Track 'B',Single,False
115,N/A,Clint Black,"Straight from the factory
We were made for each other
One of those things that's meant to be
Straight from the factory
Nothin' less than exactly
You're the only lock that's made to fit my key.

Many parts and many hearts
Been mismatched before
Still they make delivery.
Some folks send 'em back
And never find what they need
But babe my satisfaction's guaranteed.

Straight from the factory
We were made for each other
One of those things that's meant to be
Straight from the factory
Nothin' less than exactly
You're the only lock that's made to fit my key.

---Instrumental ---

Straight from the factory
We were made for each other
One of those things that's meant to be
Straight from the factory
Nothin' less than exactly
You're the only lock that's made to fit my key.

Sittin' tight and sittin' proud
Waitin' on a shove
Passers by just keep on passin' by
I'll admit I did a bit of passin' by myself
Till I found a perfect fit
And now I'm tied.

Straight from the factory
We were made for each other
Perfect match as anyone can see
Straight from the factory
Nothin' less than exactly
You're the only lock that's made to fit my key.

You're the only lock that's made to fit my key...",Straight From The Factory,Walkin' Away,1990,2,2:47,Track 'B',Single,False
116,N/A,Clint Black,"As past times go I guess I've seen some good
It's not always the best ones come and stay
There's a crowd that thinks there is one, and it should
'Cause they always seem to spend theirs the some old way.

And they call it winding down
The six to ten crowd, smoky bars
Notes on napkins and business cards
Describe the days events and go on home.

And it's likely they won't drown
The price goes up and one more round
They close up all the bars downtown
As the singer plays one last rip roaring song.

It seems like the same ole motions every night
He wants to hear a golden oldie to take him back
And I'll play out all the emotions I can't fight
Relieve the tensions and hope they're on the right track.

And they call it winding down
The six to ten crowd, smoky bars
Notes on napkins and business cards
Describe the days events and go on home.

And it's likely they won't drown
The price goes up and one more round
They close up all the bars downtown
As the singer plays one last rip roaring song.

Honky tonk heroes are turn the page 
And the books are closed tonight
'Cause everybody knows you gottta leave'em up
So they'll go home feeling right.

You gotta leave'em up 
So they'll go home feeling right...",Winding Down,Nobody's Home,1989,2,3:29,Track 'B',Single,False
117,N/A,Dan Seals,"C'mon and let the good times roll
We're gonna stay here till we soothe our soul
If it takes all night long
Yeah, c'mon and let the good times roll
We're gonna stay here till we soothe our soul
If it takes all night long

I could tell ya...

The evening sun is sinkin' low
The clock on the wall says it's time to go
I've got my plans, I don't know about you
I tell you exactly what I'm gonna do

Get in the groove and let the good times roll
I'm gonna stay here till I soothe my soul
If it takes all night long
Yeah, everybody let the good times roll
We're gonna stay here till we soothe our soul
If it takes all night long

Yeah, it might be one o'clock, it might be three
Time don't mean that much to me
I ain't felt this good since I don't know when
I might not feel this good again

So everybody let the good times roll
We're gonna stay here till we soothe our soul
If it takes all night long

All night, all night
And all night, and all night long
Somebody said it might take all night long
And all night, all night long

So c'mon and let the good times roll
We're gonna stay here till we soothe our souls
If it takes all night long, yeah.
So everybody let the good times roll
We're gonna stay here till we soothe our souls
If it takes all night long.

And all night, and all night
And all night, all night long
Somebody said it might take all night long
And all night, all night long",Good Times,On Arrival,1990,10,3:34,Track 'A1',Album,False
