,Rank,Artist,Lyrics,Title,album_name,release_date,total_tracks,duration,track_number,album_single,chart
409,N/A,Johnny Rodriguez,"Never before has a woman ever haunted me
But her magic spell keeps workin' overtime
Somebody please put her out of my misery
'Cause I just can't get her out of my mind

Never again will a woman ever conquer me
It's happened once and just once is one too many times
All I don't need is a woman's memory haunting me
But I just can't get her out of my mind

Never before has woman ever haunted me
But her magic spell keeps workin' overtime
Somebody please put her out of my misery
'Cause I just can't get her out of my mind

No, I just can't get her out of my mind",I Just Can't Get Her Out Of My Mind,The Greatest Hits Of Johnny Rodriguez,1975,14,2:32,Track 'A7',Single,False
410,N/A,Johnny Rodriguez,"Yes your love put a song, put a song, put a song, in my heart
Never have I had this beautiful feeling before
Yes your love put a song, put a song, put a song, in my

A beautiful song of two people in love evermore

It wasn't too long ago
I thought I would never know
What reason has anyone
To sing a happy song

I knew only loneliness
But then I found happiness
And now I just want to hold
This time and sing along

'Cause your love put a song, put a song, put a song, in my heart
Never have I heard this beautiful music before
Yes your love put a song, put a song, put a song, in my heart
A beautiful song of two people in love evermore

Never have I heard this beautiful music before
A beautiful song of two people in love evermore

Yes your love put a song, put a song, put a song, in my heart
Never have I heard this beautiful music before... fades
Yes your love put a song, put a song, put a song, in my heart",Love Put A Song In My Heart,The Greatest Hits Of Johnny Rodriguez,1975,14,2:45,Track 'B1',Single,False
411,N/A,Johnny Rodriguez,"I'm beginning to believe I get my kicks from being hurt
Instead of making love feel better, you just make it worse
You tell me go, then call me back, and then you set me free

You always come back to hurtin' me
You always come back to hurtin' me
As sweet and stinging as a honey bee
I'm never really sorry when you leave
You always come back to hurting me

Wanting you, I know I'm throwing good love after bad
But I'll admit the worst of you is still the best I've had
I'm this way, you're that way, and it maybe meant to be

You always come back to hurting me
You always come back to hurtin' me",You Always Come Back (To Hurting Me),The Greatest Hits Of Johnny Rodriguez,1975,14,2:30,Track 'B3',Single,False
412,N/A,Johnny Rodriguez,"We're over
I guess you know we're over
Even though, all the words are still unsaid

And we talk of other things instead

We're over
We come and go but we're over
We go on, like the actors in a play
Acting out our lives from day to day

Going through our phrases
With smiling, frozen faces
That tell more than they hide

And knowing when we fake it
It's not love when you make it
Without any feelin' inside

We're over
That's all we are, we're over
And all that's left is to find a reason why
We're over, and we still can't say goodbye",We're Over,The Greatest Hits Of Johnny Rodriguez,1975,14,2:17,Track 'B4',Single,False
413,N/A,Johnny Rodriguez,"Jealous heart, oh jealous heart, stop beating
Can't you see the damage you have done?
Can't you see the damage you have done?
You have driven her away forever
Jealous heart, now I'm the lonely one

I was part of everything she planned for
I know she loved me from the start
Now she hates the sight of all I stand for
All because of you, oh jealous heart

Jealous heart, why did I let you rule me?
When I knew the end would bring me pain
Now she's gone, she's gone and found another
Oh, I'll never see my love again

Through the years, her memory will haunt me
Even though we're many miles apart
It's so hard to know she'll never want me
'Cause she heard your beating, jealous heart",Jealous Heart,The Greatest Hits Of Johnny Rodriguez,1975,14,2:18,Track 'B5',Single,False
414,N/A,Johnny Rodriguez,,Just Get Up And Close The Door,The Greatest Hits Of Johnny Rodriguez,1975,14,2:23,Track 'B6',Single,False
415,N/A,Johnny Rodriguez,"I've been throwin' horseshoes
Over my left shoulder
I've spent most all my life 
Searchin' for that four leaf clover
Yet you run with me
Chasing my rainbow
Honey, I love you too
That's the way love goes

That's the way love goes, babe
Back to music God made
Over the whole wide world to sing
It never gets old
It only grows

Losing makes me sorry
You say, ""Honey, don't worry""
Honey, I love you too
That's the way love goes

Honey, I love you too
That's the way love goes",That's The Way Love Goes,The Greatest Hits Of Johnny Rodriguez,1975,14,1:58,Track 'B7',Single,False
416,N/A,Freddie Hart,,Phoenix City,Hang In There Girl,1974,10,2:21,Track 'A2',Album,False
417,N/A,Freddie Hart,,Thanks But No Thanks,Hang In There Girl,1974,10,2:32,Track 'A3',Album,False
418,N/A,Freddie Hart,,Let Me Be There,Hang In There Girl,1974,10,2:47,Track 'A4',Album,False
419,N/A,Freddie Hart,,Whatever Turns You On,Hang In There Girl,1974,10,2:53,Track 'A5',Album,False
420,N/A,Freddie Hart,,Till The Want-To's Out Of Me,Hang In There Girl,1974,10,2:27,Track 'B1',Album,False
421,N/A,Freddie Hart,,If Loving You Starts Hurting Me,Hang In There Girl,1974,10,2:04,Track 'B2',Album,False
422,N/A,Freddie Hart,,A Little Bit Of Heaven,Hang In There Girl,1974,10,2:58,Track 'B3',Album,False
423,N/A,Freddie Hart,,Apologize,Hang In There Girl,1974,10,2:31,Track 'B4',Album,False
424,N/A,Freddie Hart,,The Most Beautiful Girl In The World,Hang In There Girl,1974,10,2:24,Track 'B5',Album,False
425,N/A,Loretta Lynn,"My baby makes me proud
Lord don't he makes me proud
He never makes a scene
By hanging onto me in a crowd.

'Cause people like to talk
Lord don't they love to talk
But when they turn out the lights
I know he'll be leavin' with me.

And when we get behind closed doors
And I let my hair hang down
And he makes me glad that I'm a woman
Oh, no one knows what goes on behind closed doors.

My baby makes me smile
Lord don't he make me smile
He's never far away or too tired to say
Ah, honey I want you.

I'm always a lady
Just like a lady should be
But when they turn out the lights
I show 'em what a woman I can be.

And when we get behind closed doors
And I let my hair hang down
And he makes me glad that I'm a woman
Oh, no one knows what goes on behind closed doors.

Behind closed doors...",Behind Closed Doors,They Don't Make 'Em Like My Daddy,1974,11,2:18,Track 'A2',LP,False
426,N/A,Loretta Lynn,"You came when I was happy in your sunshine
I grew to love you more each passing day
Before too long I built my world around you
And I prayed you'd love enough of me to stay.

If you love me let me know if you don't then let me go
I can't take another minute of the day without you in it
If you love me let it be if you don't then set me free
Take the chains away that keep me loving you.

The arms that open wide to hold me closer
The hands that run their fingers through my hair
The smile that says hello it's good to see you
Anytime I turn around to find you there.

It's this and so much more that makes me love you
What else can I do to make you see
You know you have whatever's mine to give you
But a love affair for one can never be.

If you love me let me know if you don't then let me go
I can't take another minute of the day without you in it
If you love me let it be if you don't then set me free
Take the chains away that keep me loving you.

Take the chains away that keep me loving you...",If You Love Me (Let Me Know),They Don't Make 'Em Like My Daddy,1974,11,2:47,Track 'A3',LP,False
427,N/A,Loretta Lynn,"I can almost hear the stillness
As it yelds to the sound of my heart beating
And I can almost hear the echo
Of the thoughts that I know you must be thinking
You can feel my body tremble
As I wonder what this moment holds in store
And as you put my arms around me
You can tell I've never been this far before
I can hear you say you love me
As your trembling fingers touch forbidden places (pum pum pum)
But you don't know how I've waited
So long for the chance that we're finally takin' (pum pum pum)
I don't know and I don't care
What made you tell her you don't love her anymore
As I taste your tender kisses
You can tell I've never been this far before (pum pum pum)
And as you take the love I'm givin'
I can feel the tension buildin' in my mind (pum pum pum pum pum pum)
Now I wonder if tomorrow
Will you still love me like you're lovin' me tonight (pum pum pum pum pum pum)
Oh you have no way of knowin'
But tonight will only make me want you more
And I hope that you'll believe me
Cause you know I've never been this far before (pum pum pum pum pum pum)
(Pum pum pum)",I've Never Been This Far Before,They Don't Make 'Em Like My Daddy,1974,11,3:13,Track 'A4',LP,False
428,N/A,Loretta Lynn,"I didn't mean for this to get so out of hand when I first met you
But the more we see each other or the more we want to
We can't stop this ain't something we can't turn off like a light
It's too late we've already tasted love.

You made me feel the way he hasn't made me feel in so long
And it's beyond my pwerful courage just to walk out and go home
What we found in each other's arms it's always on my mind
It's too late we've already tasted love.

We can't stop this ain't something we can't turn off like a light
It's too late we've already tasted love.

You made me feel the way he hasn't made me feel in so long
And it's beyond my pwerful courage just to walk out and go home
What we found in each other's arms it's always on my mind
It's too late we've already tasted love...",We've Already Tasted Love,They Don't Make 'Em Like My Daddy,1974,11,3:15,Track 'A5',LP,False
429,N/A,Loretta Lynn,,Out Of Consideration,They Don't Make 'Em Like My Daddy,1974,11,2:14,Track 'A6',LP,False
430,N/A,Loretta Lynn,"There's trouble in paradise I can sit and I know the sign so well,
I know he's out there and 'round her everyday.
There's trouble but there won't be long 'cause in the mornin' it'll all be gone long gone
'Cause Lord I'm gonna love him till the devil goes away.
Now I know about those devil women, they'll set your lovers head to spinnin' and she's a demon she wants control,
But she ain't takin' my man's soul, she ain't takin' my man's soul...

There's trouble in paradise I can sit and I know the sign so well,
I know he's out there and 'round her everyday.
There's trouble but there won't be long 'cause in the mornin it'll all be gone, long gone
'Cause Lord I'm gonna love him till the devil goes away.

There's trouble in paradise, Lord I'm gonna love him till the devil goes away.",Trouble In Paradise,They Don't Make 'Em Like My Daddy,1974,11,2:58,Track 'B1',LP,False
431,N/A,Loretta Lynn,"I love little baby ducks, old pickup trucks
Slow moving trains and rain
I love little country streams, sleep without dreams
Sunday school in May and hay
And I love you too.

I love leaves in the wind, pictures of my friends
Birds of the world and squirrels
I love coffee in a cup, little fuzzy pups
Wine in a glass and grass
And I love you too.

I love honest open smiles, kisses from a child
Tomatos on the vine and onions
I love winners when they cry, losers when they try
Music when it's good and life
And I love you too...",I Love,They Don't Make 'Em Like My Daddy,1974,11,2:10,Track 'B2',LP,False
432,N/A,Loretta Lynn,"The lights're low I am too the crowd is high so are you
It's gettin' close to closin' time and the breakup oh it breakup my mind
You found me in this dimlit bar I'm with you and we're too far
Now you say my kind of girl just can't fit in your kind of world
Please don't leave me where you found me
Oh don't leave me where you found me
Keep your love wrapped warm around me
Don't leave me where you found me

I like to cook I like to sew I'd love to watch while babies grow
I'd work my fingers to the bone if you'll make me the maker of your home
Please forget the life I've led let me share more than your bed
I'll make a vow to God above you'll always be the keeper of my love
Please don't leave me...
Please don't leave me where you found me",Don't Leave Me Where You Found Me,They Don't Make 'Em Like My Daddy,1974,11,2:04,Track 'B3',LP,False
433,N/A,Loretta Lynn,"Blues go ahead and knock upon my door you can't hurt me anymore
Um-um ain't love a good thing
Rain go ahead and let it rain all night in the morning I'll be dry
Um-um ain't love a good thing
Ain't it good to know love can take away the rain
And make the sunshine again
And ain't it good to know love can take a lonely dream
And turn it into a real thing
Um-um ain't love a good thing um-um ain't love a good thing
Pain find yourself another heart to ache and another mind to break
Um-um ain't love a good thing
Time find yourself another fool to waste and another place to stay
Um-um ain't love a good thing
Ain't it good to know...
Um-um ain't love a good thing
Ain't love a good thing good thing
Ain't love a good thing",Ain't Love A Good Thing,They Don't Make 'Em Like My Daddy,1974,11,2:49,Track 'B4',LP,False
434,N/A,Loretta Lynn,,Nothin',They Don't Make 'Em Like My Daddy,1974,11,2:38,Track 'B5',LP,False
435,N/A,Sonny James,,"Whoever Finds This, I Love You",A Mi Esposa Con Amor,1974,10,3:11,Track 'A2',LP,False
436,N/A,Sonny James,,Take These Chains From My Heart,A Mi Esposa Con Amor,1974,10,4:12,Track 'A3',LP,False
437,N/A,Sonny James,,Blues Stay Away From Me,A Mi Esposa Con Amor,1974,10,2:45,Track 'A4',LP,False
438,N/A,Sonny James,,I Can't Find A Way Into Your Heart,A Mi Esposa Con Amor,1974,10,2:30,Track 'A5',LP,False
439,N/A,Sonny James,,Home Style Lovin',A Mi Esposa Con Amor,1974,10,2:58,Track 'B1',LP,False
440,N/A,Sonny James,,I Can See The End From The Beginning,A Mi Esposa Con Amor,1974,10,2:42,Track 'B2',LP,False
441,N/A,Sonny James,,Ever Since I Fell For You,A Mi Esposa Con Amor,1974,10,3:03,Track 'B3',LP,False
442,N/A,Sonny James,,A Poor Man's Gold,A Mi Esposa Con Amor,1974,10,2:32,Track 'B4',LP,False
443,N/A,Sonny James,,Baby's Blue,A Mi Esposa Con Amor,1974,10,2:26,Track 'B5',LP,False
444,N/A,Tammy Wynette,"Love has come our way before
But this time I am sure we just can't go wrong
'Cause love has never felt so real
The way you've made me feel right here in your arms

When I look into your eyes I still can see that far
We both thought it was gone
So give me one more chance to take
What's left over I'll make it right here in your arms

'Cause in your arms is right where I belong
Loving you forever from now on
One more chance is all we need
'Cause I know love will be right here in your arms",Right Here In Your Arms,Woman To Woman,1974,10,2:57,Track 'A2',Album,False
445,N/A,Tammy Wynette,,What's A Little Rain,Woman To Woman,1974,10,2:44,Track 'A3',Album,False
446,N/A,Tammy Wynette,"This time I almost made it
Came so close to saying no

I almost found the words to make you go

This time I almost made it
Almost pushed you away

But my heart cried out begging you to stay

Now I'm laying here beside you cryin' softly
'Cause I know you're going home to her

Cause you belong to her
And you go home to her

I know you steal away I know there'll be another day
That you'll come back again

And you'll say hello friend and I'll reach out my hand

This time I almost made it this time I almost made it

This time I almost made it this time I almost made it",This Time I Almost Made It,Woman To Woman,1974,10,2:23,Track 'A4',Album,False
447,N/A,Tammy Wynette,"You said please come to Boston for the spring time.
You're stayin' there with some friends
And they've got lots of room.
You can sell your paintings on the sidewalk
By a cafe where I hope to be workin' soon.
You said please come to Boston.
She said, ""No.
Would you come home to me?""

""Hey, ramblin' boy,
Why don't you settle down?
Boston ain't your kind of town.
There ain't no gold and
There ain't nobody like me.
I'm the number one fan
Of the man from Tennessee.""

You said please come to Denver with the snow fall.
We'll move up into the mountains so far
That we can't be found.
And though ""I love you"" echoes down the canyon
And then lie awake at night until they come back around.
You said please come to Denver.
She said, ""No.
Boy, would you come home to me?""

""Hey, ramblin' boy,
Why don't you settle down?
Denver ain't your kind of town.
There ain't no gold and
There ain't nobody like me.
'Cause I'm the number one fan
Of the man from Tennessee.""

(Instrumental)

Now, this drifter's world goes 'round and 'round
And I doubt that it's ever gonna stop,
But of all the dreams you've lost or found
And all that I ain't got.
I still need to lean to
Somebody I can sing to.

You said please come to L. A. to live forever.
California life alone is just too hard to build.
You live in a house that looks out over the ocean.
And there's some stars that fell from the sky
And livin' up on the hill.
You said please come to L. A.
I said, ""No.
Boy, won't you come home to me?""

""Hey, ramblin' boy,
Why don't you settle down?
L. A. ain't your kind of town.
There ain't no gold and
There ain't nobody like me.
I'm the number one fan
Of the man from Tennessee.""

I'm the number one fan
Of the man from Tennessee.",Please Come To Boston,Woman To Woman,1974,10,2:13,Track 'A5',Album,False
448,N/A,Tammy Wynette,"You know, I don't think much about him no more
And seldom if ever does he cross my mind
Yesterday's gone, for it's better forgotten
Like the poison red berries to die, on the vine

This morning at dawn Lord I pulled into town
Had some coffee and talked with some old friends of mine
Laughing at the good times they remembered
And then I remembered a time

Lord I can still see the bright lights back in Dallas
As yesterday moves like a dream through my mind
I didn't suppose that I'd ever forget him
And you know it took such a long time

But I don't think much about him no more
Seldom if ever does he cross my mind
Yesterday's gone, Lord it's better forgotten
It's like the poison red berries that cling, to the mind",I Don't Think About Him No More,Woman To Woman,1974,10,3:58,Track 'B1',Album,False
449,N/A,Tammy Wynette,"You work like a slave for the kids
And I'd go to my grave for the kids
But we watched our love fade as we suffered the same
With this bargain we made for the kids

Divorce is a curse for the kids
But this tention's much worse for the kids

And they're now old enough and they made the strongest stuff
Still it's gonna be rough for the kids

Find a new love you should for the kids
And I hope that she's good for the kids

And though I'm now out of singht if he don't treat them right
I'll be right back and I'll fight for the kids

(Instrumental)

These teardrops that fall for the kids
You know they're really not all for the kids

But I know you don't care and the only love there
Is the love that'd we shared for the kids

Yes I see you don't care the home that we shared
All our hopes and our prayers for the kids",For The Kids,Woman To Woman,1974,10,3:58,Track 'B2',Album,False
450,N/A,Tammy Wynette,,The Woman I Am,Woman To Woman,1974,10,3:09,Track 'B3',Album,False
451,N/A,Tammy Wynette,,Touching Love,Woman To Woman,1974,10,2:55,Track 'B4',Album,False
452,N/A,Tammy Wynette,,I've Been Loved Before (But Not Like This),Woman To Woman,1974,10,2:27,Track 'B5',Album,False
453,N/A,Johnny Rodriguez,,I Couldn't Be Here Without You,The Greatest Hits Of Johnny Rodriguez,1975,14,2:40,Track 'A1',Single,False
454,N/A,Johnny Rodriguez,"Would you look at what came down the road today?
Wanting me to be one more mistake to make
A bridge to burn to get to some one new
Hey pass me by if you're only passing through

You sure look like the traveling kind to me
Don't stop if this ain't where you want to be
Now I don't know what you think you run into
Hey pass me by if you're only passing through

I'm not going to be a steeping stone
Among the other hearts that you walk on
Lord help me if I fall in love with you
Hey pass me by if you're only passing through

Hey pass me by if you're only passing through",Pass Me By (If You're Only Passing Through),The Greatest Hits Of Johnny Rodriguez,1975,14,2:30,Track 'A2',Single,False
455,N/A,Johnny Rodriguez,"Something in the way she moves
Attracts me like no other lover
Something in the way he woos me
I don't wanna leave her now Lord you know I believe and how

Somewhere in her smile she knows
That I don't need no other lover
Something in her style that shows me
I don't wanna leave her now you know I believe and how

You're asking me will my love grow
I don't know I don't know
You stick around now it may show
I don't know I don't know

I don't wanna leave her now you know I believe and how

You're asking me will my love grow...

Something in the way he knows
And all I have to do is think of her
Something in the things he shows me
I don't wanna leave her now Lord you know I believe and how",Something,The Greatest Hits Of Johnny Rodriguez,1975,14,2:49,Track 'A3',Single,False
456,N/A,Johnny Rodriguez,"As I read the letters that you wrote to me
It's you, it's you that I'm thinking of
As I look at those lines that to me were so sweet
I remember our faded love

I miss you darlin' more and more everyday
As heaven would miss the stars above
With every heartbeat, I still think of you
And remember our faded love

As I think of the past, all the pleasures that we had
As I watch the mating of the doves
It was in the springtime that you said goodbye
I remember our faded love

(Spanish) I miss you darlin' more and more everyday
As heaven would miss the stars above
(Spanish) With every heartbeat, I still think of you
(Spanish) And remember our faded love
And remember our faded love",Faded Love,The Greatest Hits Of Johnny Rodriguez,1975,14,2:57,Track 'A4',Single,False
457,N/A,Johnny Rodriguez,"This old highway seems so lonesome when you're goin' where you've been
And a lonesome song can make you cry time and time again
If I had listened to a friend of mine ten years ago today
I'd have a better job than what I've got today

But the billboards on the highways and the brakelights on the cars
Make me jump out on the highway with my bag and my guitar
If she comes or if she goes it doesn't matter anymore
'Cause I'm ridin' my thumb to Mexico

Ridin' my thumb to Mexico
It don't matter when or how I go
I'll ride this thumb till I see her again
So I'm ridin' my thumb to Mexico

Well the reason why she left me's not the reason that I'm here
I'm a traveling kind of man just need a change of atmosphere
If there's any place I haven't been at all that's where I'll go
So I'm ridin' my thumb to Mexico

Ridin' my thumb to Mexico...",Ridin' My Thumb To Mexico,The Greatest Hits Of Johnny Rodriguez,1975,14,2:05,Track 'A5',Single,False
458,N/A,Johnny Rodriguez,"Born to lose, I've lived my life in vain
Every dream has only brought me pain
All my life, I've always been so blue
Born to lose, and now I'm losing you

(Spanish)
Solamente pa perder nacir
Cada sueno, en vano fue de ti
Tanto que yo, sufrir, por tu querer
Solamente pa perder nacir

Born to lose, it seems so hard to bear
When I wake at night and you're not there
You've grown tired, and now you say we're through
Born to lose, and now I'm losing you",Born To Lose,The Greatest Hits Of Johnny Rodriguez,1975,14,2:36,Track 'A6',Single,False
459,N/A,Johnny Rodriguez,"Never before has a woman ever haunted me
But her magic spell keeps workin' overtime
Somebody please put her out of my misery
'Cause I just can't get her out of my mind

Never again will a woman ever conquer me
It's happened once and just once is one too many times
All I don't need is a woman's memory haunting me
But I just can't get her out of my mind

Never before has woman ever haunted me
But her magic spell keeps workin' overtime
Somebody please put her out of my misery
'Cause I just can't get her out of my mind

No, I just can't get her out of my mind",I Just Can't Get Her Out Of My Mind,The Greatest Hits Of Johnny Rodriguez,1975,14,2:32,Track 'A7',Single,False
460,N/A,Johnny Rodriguez,"Yes your love put a song, put a song, put a song, in my heart
Never have I had this beautiful feeling before
Yes your love put a song, put a song, put a song, in my

A beautiful song of two people in love evermore

It wasn't too long ago
I thought I would never know
What reason has anyone
To sing a happy song

I knew only loneliness
But then I found happiness
And now I just want to hold
This time and sing along

'Cause your love put a song, put a song, put a song, in my heart
Never have I heard this beautiful music before
Yes your love put a song, put a song, put a song, in my heart
A beautiful song of two people in love evermore

Never have I heard this beautiful music before
A beautiful song of two people in love evermore

Yes your love put a song, put a song, put a song, in my heart
Never have I heard this beautiful music before... fades
Yes your love put a song, put a song, put a song, in my heart",Love Put A Song In My Heart,The Greatest Hits Of Johnny Rodriguez,1975,14,2:45,Track 'B1',Single,False
461,N/A,Johnny Rodriguez,"Here I am once again asking
You to dance with me tonight
Sadly pretending I'm happy
And God above only knows why

Dance with me once again darlin'
Though you no longer be mine
Soften the pains that are starting
Dance with me just one more time

I know I made my mistakes dear
By telling you things that weren't true
Don't worry about being too near
When I have this last dance with you

Dance with me once again darlin'
Though you no longer be mine
Soften the pains that are starting
Dance with me just one more time

Dance with me once again darlin'
Though you no longer be mine
Soften the pains that are starting
Dance with me just one more time

Dance with me just one more time",Dance With Me (Just One More Time),The Greatest Hits Of Johnny Rodriguez,1975,14,2:30,Track 'B2',Single,False
