,Rank,Artist,Lyrics,Title,album_name,release_date,total_tracks,duration,track_number,album_single,chart
135,N/A,Jim Reeves,"HOME (Jim Reeves)
Written by Roger Miller

Well, I've been a traveler most of my life
Never took a home, never took a wife
Ran away young and decided to roam
Wanna see my mama and my daddy back home

Home, where the river runs cold
The water tastes good, the winters ain't cold
Home, where the trees grow tall
The home fires burn, the whippoorwills call

I remember stories that my daddy used to tell
My eyes would get big, and his chest would swell
I could sit for hours and listen with glee
As he'd tell of how he lived when he's a boy like me

Well, mama dear, mama do you still love your boy
After all my roamin' can I still bring you joy
Mom sent a letter, got it not long ago
She said ""come home, I'm missin' you so",Home,The Best Of Jim Reeves Vol. II,1966,12,1:57,Track 'A1',Single,False
136,N/A,Jim Reeves,"I won't forget you.

I know that I won't forget you
For I've loved you too much for too long
Though you don't want me now
I'll still love you
Till the breath in my body has gone

That's how it is with me
And you'll always be
The only love I ever knew
I'll forget many things in my life time
But my darling I won't forget you

That's how it is with me
And you'll always be
The only love I ever knew
I'll forget many things in my life time
But my darling I won't forget you.",I Won't Forget You,The Best Of Jim Reeves Vol. II,1966,12,2:34,Track 'A3',Single,False
137,N/A,Jim Reeves,"If there's water in the desert
Sand out in the sea
If you were not an angel
Sweet as you can be.

You can turn the night to day
Make all your dreams come true
Say how far it is to heaven
Then I'll stop loving you.

If the earth is up above us
Stars are down below
If there are daisies in the desert
Roses in the snow.

If today can be tomorrow
If old things can be new
If you can live without a heartbeat
Then I'll stop loving you.

There's no daisies in the desert
No roses in the snow
The earth is not above us
The stars are not below.

Today can't be tomorrow
Old things can't be new
I can't live without a heartbeat
And I can't stop loving you.

There's no daisies in the desert
No roses in the snow
The earth is not above us
The stars are not below.

Today can't be tomorrow
Old things can't be new
I can't live without a heartbeat
And I can't stop loving you...",Then I'll Stop Loving You,The Best Of Jim Reeves Vol. II,1966,12,1:59,Track 'A4',Single,False
138,N/A,Jim Reeves,"Is this me, is it really me
Sittin' here crying
Well, it shouldn't be, it just can't be me
My eyes are lying.

'Cause that's not you, it just can't be you
You wouldn't be cheatin'
It's someone else, yes, it's someone else
Whose darling's leavin'.

I just can't believe my eyes
You took me by surprise
Oh, how I wish I'd just stayed home
I'd still be thinking you're all my own.

This isn't me, it just can't be me,
Sittin' here crying
Is it just a dream, I know it's just a dream
Our love can't be dying...",Is This Me?,The Best Of Jim Reeves Vol. II,1966,12,2:20,Track 'A5',Single,False
139,N/A,Jim Reeves,"I guess I'm crazy for loving you
You tell me many ways that I won't do.
My heart keeps sayin' that I'm a fool
I guess I'm crazy for loving you.

I don't dare let you go it's unfair this I know
I don't care if it's so, it has to be
My heart keeps sayin' that I'm a fool
I guess I'm crazy for loving you.

I don't dare let you go it's unfair this I know
I don't care if it's so, it has to be
My heart keeps sayin' that I'm a fool
I guess I'm crazy for loving you...",I Guess I'm Crazy,The Best Of Jim Reeves Vol. II,1966,12,2:07,Track 'A6',Single,False
140,N/A,Jim Reeves,"I'm just gettin' back from Juarez Mexico
And I'll tell you something I want you to know
My poor head is aching it throbs and it twirls
From drinking tequila and teasing the girls.

Don't get me wrong because I'm not complaining
I have no regrets I am only explaining
For all of you fellows that ain't had the thrill
A drinking tequila and teasing the girls.

Heeee ha
Happy tonight the maidens
Are dancing out in the moonlight
Heee ha
On top of the world
Drinking tequila and teasing the girls.

Moonlight and flowers make night so appealing
The breete from the garden comes tenderly stealing
A beautiful maiden then whispers your name
And suddenly both of your hearts are aflame.

Her dark eyes are gleamin' her raven hair shining
You pull her up closer your hearts are entwinning
Her warm lips are thrilling you're out of this world
From drinking tequila and teasing the girls.

If down in Juarez you should happen to be
The Cafe El Gusto's the place you should see
They claim that they have and I know it's so 
The prettiest Dancers in old Mexico.

When Spanish maidens start squirmin' and dancin'
It's sure to set any young heart to romancin'
Your troubles get lighter your worries unfurl
While drinking tequila and teasing the girls.

Heeee ha
So happy tonight the maidens
Are dancing out in the moonlight
Heee ha
On top of the world
Drinking tequila and teasing the girls...",Drinking Tequila,The Best Of Jim Reeves Vol. II,1966,12,2:22,Track 'B1',Single,False
141,N/A,Jim Reeves,"There's a little girl lives on our street
She's awful sweet and pretty
The boys stand on their heads for her
But she thinks they're all silly.

She's got freckles on her nose
Her hair is light and sandy
Penelope Candance is her name
But we call her Penny Candy.

She doesn't know what a nickel is
She's got no use for dollars
There's always a penny in her hand
And a licorice on her collar.

She's the sweetest girl in town
The little boys think she's a dandy
But the monkey shines don't bother her
When she's eatin' Penny Candy.

Penny Candy
She eats that messy kind
Penny Candy
She eats it all the time.

--- Instrumental ---

She brightens up the neighborhood
Her little face is always glowing
And when she's in a hurry
We all know where she's a going.

It's to the little corner store
That's awful close and handy
Then once again her happy face
Is black with Penny Candy.

Penny Candy
She eats that messy kind
Penny Candy
She eats it all the time.

--- Instrumental ---

She's always got a smile for you
If you should ever meet her
And with Candy on her face
Her smile is a little sweeter.

Penelope Candance is her name
And she likes that fine and dandy
But if you want to see her dimples show
Just call her Penny Candy.

Penny Candy
She eats that messy kind
Penny Candy
She eats it all the time...",Penny Candy,The Best Of Jim Reeves Vol. II,1966,12,2:42,Track 'B2',Single,False
142,N/A,Jim Reeves,"South of the border, hey, I know a lad,
He's got more fun than anybody's had,
Don't got no worry, don't got no dough,
Everybody's wondering 'bout Mexican Joe.
In old Mexico, they call him the Rhumba King,
Leads all the women around on a string,
When they go out, they get a million thrills,
But the lovely senoritas wind up with the bills.

Dancin', romancin',
Always on the go,
Sun shinin' down on Mexican Joe

He makes the night spots all along the bay,
People want to see him when he comes their way,
He spreads so much joy everywhere he goes,
Everyone shouts ""Viva la Mexican Joe.""
He likes to gamble, at poker he's an ace,
He's always lucky with the cards that got a face,
At winning the money, he is sure a whiz,
But when they win they don't collect
'Cause they don't know where he is.

Dancin', romancin',
Always on the go,
Sun shinin' down on Mexican Joe

He don't no income tax 'cause he don't got no dough,
Still he gets along just fine, how we'll never know,
He's got everything he wants, a girl, a drink, a song,
If we use his formula, we surely can't go wrong.
His favorite playground is anywhere there's girls,
He's got that somethin' that sets their hearts a-whirl,
It couldn't be his money 'cause he ain't got a peso,
But when he wants a kiss all he's got to do is say so

Dancin', romancin',
Always on the go,
Sun shinin' down on Mexican Joe",Mexican Joe,The Best Of Jim Reeves Vol. II,1966,12,2:32,Track 'B3',Single,False
143,N/A,Jim Reeves,"Railroad, Steamboat, River and Canal
Yonder comes a sucker and he's got my gal
And she's gone, gone, gone
And she's gone, gone, gone
And I bid her my last farewell

I fell in love with A pretty little thing
I thought that wedding bells would ring
She was sweet as sweet could be
Till I found out what she did to me

Railroad, Steamboat, River and Canal
Yonder comes a sucker and he's got my gal
And she's gone, gone, gone
And she's gone, gone, gone
And I bid her my last farewell

I ask her mother to let her go
She whispered mother please tell him, no!
Tho' he may think that I am true
There are plenty more, who'll think so too

Railroad, Steamboat, River and Canal
Yonder comes a sucker and he's got my gal
And she's gone, gone, gone
And she's gone, gone, gone
And I bid her my last farewell

Now I won't cry my life away
Some other sucker will have to pay
And when he finds that she is gone
I guess I'll hear him sing this song

Railroad, Steamboat, River and Canal
Yonder comes a sucker and he's got my gal
And she's gone, gone, gone
And she's gone, gone, gone
And I bid her my last farewell",Yonder Comes A Sucker,The Best Of Jim Reeves Vol. II,1966,12,2:35,Track 'B4',Single,False
144,N/A,Jim Reeves,"I promise you he'll never know
That once we loved each other so
The past we knew I'll not reveal
My lips are sealed.

My heart may cry with every beat
Without your love I'm not complete
It doesn't matter how I feel
My lips are sealed.

Let there be laughter,
Not one single tear
And ever after
Let your fears disappear.

If you love him as I love you
Forget the past I led you through
Just don't look back it's all concealed
My lips are sealed.

--- Instrumental ---

Let there be laughter,
Not one single tear
And ever after
Let your fears disappear.

If you love him as I love you
Forget the past I led you through
Just don't look back it's all concealed
My lips are sealed...",My Lips Are Sealed,The Best Of Jim Reeves Vol. II,1966,12,2:30,Track 'B5',Single,False
145,N/A,Jim Reeves,"Accordin' to my heart
You're the one for me
The one love of my life is here
When you're with me
If someone stole your love
My heart would beat no more
For you're the one 
My heart is always longin' for.

Well I don't know the reason why
My dreams don't turn out right
But I'll keep listenin' to my heart
Who knows, someday they might
For accordin' to my heart 
The future will be bright
And everyday I pray
That my heart knows what's right.

Accordin' to my heart
You're the one for me
The one love of my life is here
When you're with me
If someone stole your love
My heart would beat no more
For you're the one
My heart is always longin' for.

Though I don't know the reason why
My dreams don't turn out right
But I'll keep listenin' to my heart
Who knows, someday they might
For according to my heart 
The future will be bright
And everyday I pray 
That my heart knows what's right...",According To My Heart,The Best Of Jim Reeves Vol. II,1966,12,2:22,Track 'B6',Single,False
146,N/A,Marty Robbins,"I know that I've took much more than I gave
But now I confess, what more can I do
What more can I say
I know we could live
If you would forgive

I'm so sorry, dear, for things I have done
But if you leave me now, then who'll be to blame
You'll be the one
It's all up to you
Please won't you forgive

You've so much to lose if you leave me
I still love ya so, please believe me

I've done all I can, I'm down on my knees
One little chance is all that I ask
I've even said, please
It's all up to you
Please won't you forgive",Won't You Forgive,Ruby Ann,1962,2,,Track 'B',"7""",False
147,N/A,Buck Owens,"Getting used to losing you is not an easy thing to do
For anyone can see I'm missing you
I still hurt the same old way and it grows worse day by day
For I lie each time I say I'm getting used to losing you.

I walk down the same old street meeting friends we used to meet
Trying not to let them know that I'm so blue
But I'm afraid my heartaches show yes I'm afraid they know
But I lie each time I say I'm getting used to losing you.

Getting used to losing you is not an easy thing to do
For anyone can see I'm missing you
I still hurt the same old way and it grows worse day by day
For I lie each time I say I'm getting used to losing you...",Getting Used To Losing You,Love's Gonna Live Here / Getting Used To Losing You,1963,2,2:00,Track 'B',Single,False
148,N/A,Ned Miller,,Parade Of Broken Hearts,From A Jack To A King,1963,2,,Track 'B',Single,False
149,N/A,Hawkshaw Hawkins,,Everything Has Changed,Lonesome 7-7203,1963,2,2:38,Track 'B',Single,False
150,N/A,Buck Owens,,The Key's In The Mailbox,Act Naturally,1989,2,2:59,Track 'B',Single,False
151,N/A,Johnny Cash,"To love you so and still not have you will destroy me in time 
So I'm goin' away where nobody knows me and get you off of my mind 
I've packed my things a dozen times but unpack is all I do 
Yes I'm still in town still around and still in love with you 
I made it to the edge of town and turned around 
I made it to the bridge downtown byt my nerve let me down 
I tried to go but how can I leave when all roads lead to you 
Yes I'm still in town still around and still in love with you 

I made it to the edge of town...",Still In Town,The Matador,1963,2,2:45,Track 'B',Single,False
152,N/A,Dave Dudley,"Oh she just walked out the door and I know she won't be back anymore
The echo of her footsteps have gone and now I feel a cry coming on
Her picture on the table smiles at me the sweet tender love is there to see
Yesterday that sweet love was my own but now I feel a cry coming on
Yes I feel a cry coming on and for the first time in my life I'm all alone
Everything I love is gone and now I feel a cry coming on

Yes I feel a cry coming on...",I Feel A Cry Coming On,Dave Dudley Sings Six Days On The Road,1963,12,,Track 'A2',Album,False
153,N/A,Dave Dudley,,Boo On You,Dave Dudley Sings Six Days On The Road,1963,12,,Track 'A3',Album,False
154,N/A,Dave Dudley,,Then I Can Go To Bed,Dave Dudley Sings Six Days On The Road,1963,12,,Track 'A4',Album,False
155,N/A,Dave Dudley,"For as long as I can remember I've worked down in this pit
But today it's all over for this is the day I quit
I'm gonna take my sweet little Ginny and make her my own
We gonna move down in the valley and built ourselves a home
This is the last day in the mines

Well I swing that pick move that shovel and time goes so slow
I can hardly wait for my boss to tell me that it's time to go
Up at the top I know my Ginny is waiting patiently
In just a few minutes I'll be there with her and from the mines be free
This is the last day in the mines

But wait a minute what's that rumble way back in the ground
Good Lord it's a cave in and the rocks are a fallin' all around
Now the timbers are breakin' and the rats are runnin' and I can hardly see
Inside my chest there's a mighty burnin' and my strength is leavin' me
This is the last day in the mines

Beneath these rocks and timbers and with my strength all gone
My thoughts turn to Ginny I must leave her all alone
I know they'll try to save me but they gonna be too late
For over that river through that valley I see heaven's gates
This is the last day in the mines
Oh this is the last day in the mines this is the last day in the mines",Last Day In The Mines,Dave Dudley Sings Six Days On The Road,1963,12,,Track 'A5',Album,False
156,N/A,Dave Dudley,"Yes I know that I'm about to lose you cause someone else is always on your mind
Why must I have to give you up and give my heart up too
For a love that came along before my time
You say with me you think you've made a big mistake
Well good luck I hope your ending turns out fine
It's gonna hurt a long long time that's the price I'll pay
For a love that came along before my time
Well please don't blame me if I stay in love with you
And while I'm alone if I pretend that you're still mine
I can stand my loneliness if I know you're not blue
With a love that came along before my time
With a love that came along before my time",Before My Time,Dave Dudley Sings Six Days On The Road,1963,12,,Track 'A6',Album,False
157,N/A,Dave Dudley,,Taxi Cab Driver,Dave Dudley Sings Six Days On The Road,1963,12,,Track 'B1',Album,False
158,N/A,Dave Dudley,,That's Pretty Good For Me,Dave Dudley Sings Six Days On The Road,1963,12,,Track 'B2',Album,False
159,N/A,Dave Dudley,,Above And Beyond,Dave Dudley Sings Six Days On The Road,1963,12,,Track 'B3',Album,False
160,N/A,Dave Dudley,,Yesterdays Lover,Dave Dudley Sings Six Days On The Road,1963,12,,Track 'B4',Album,False
161,N/A,Dave Dudley,,Lonely Corner,Dave Dudley Sings Six Days On The Road,1963,12,,Track 'B5',Album,False
162,N/A,Dave Dudley,,Barbara Allen,Dave Dudley Sings Six Days On The Road,1963,12,,Track 'B6',Album,False
163,N/A,Ernest Ashworth,, That's How Much I Care ,Talk Back Trembling Lips,1963,2,2:33,Track 'B',Single,False
164,N/A,Bill Anderson,,One Mile Over - Two Miles Back,8 X 10,1963,2,2:48,Track 'B',Single,False
165,N/A,Jim Reeves,"Auf wiederseh'n, auf wiederseh'n
We'll meet again sweetheart
This lovely day has flown away
The time has come to part.

We'll kiss again like this, again
Don't let a teardrop start
With love that's true I'll wait for you
Auf wiederseh'n sweetheart.

--- Instrumental ---

(We'll kiss again like this again
Don't let a teardrop start)
With love that's true I'll wait for you
Auf wiederseh'n sweetheart...",Auf Wiederseh'n Sweetheart,The International Jim Reeves,1963,12,3:01,Track 'A1',Album,False
166,N/A,Jim Reeves,"Ver in die Ou Kalahari daar sing die Boere so
Gee ons die Ou Kalahari die Ou Kalahari bo
In misty plains all around me the burning sun and sand
Lovely and peacful surroundings my old Kalahari land.

Sonbesies sing in jou bosse die hittige son te versmaai
Rooi Afrikaner-osse sien jy om elke draai
Ver in die Ou Kalahari tot daar in die Molopo
Gee ons die Ou Kalahari die Ou Kalahari bo.

--- Instrumental ---

When I am called on safari
By him whom I cannot deny
I pray that the old Kalahari
Will be part of that land in the sky...",The Old Kalahari,The International Jim Reeves,1963,12,2:07,Track 'A2',Album,False
167,N/A,Jim Reeves,,(There'll Be Blue Birds Over) The White Cliffs Of Dover,The International Jim Reeves,1963,12,2:57,Track 'A3',Album,False
168,N/A,Jim Reeves,"It's true, I know it's true, I'm losing you
And it's breaking my heart
It's true, I know we're through
There's someone new, it just tears me apart.

I don't know what I'll do without you
I've loved you for so long
I've built my whole world around you
And I just can't believe that you're gone.

But it's true, I know it's true, my dreams are through
And they'll never come true.

--- Instrumental ---

I've built my whole world around you
And I just can't believe that you're gone
But it's true, I know it's true, my dreams are through
And they'll never come true...",True,The International Jim Reeves,1963,12,2:31,Track 'A4',Album,False
169,N/A,Jim Reeves,"Ja ek verlang na jou my liefling
En ek droom van jou oe so blou
Ja ek dink net aan jou my liefling
En my hart is'n mantel van rou.

I gaze at the stars
With a prayer in my heart
I ask for bitter strength
Just to hate and depart.

Ja kom nou terug na my my liefling
Ek verlang na my liefling vanaand.

--- Instrumental ---

Toe jy my verlaat het
Is my wereld verskeur
Die son het ophou skyn
En die maan het verkleur.

So please come back to me my darling
Can't you see that I'm crying again...",I'm Crying Again,The International Jim Reeves,1963,12,1:58,Track 'A5',Album,False
170,N/A,Jim Reeves,"In the blue Canadian Rockies
Spring is silent through the trees
And the gold poppies are blooming
Round the banks of Lake Louise.

Across the sea they call me
And on and on a love so true
For the Blue Canadian Rockies
And the one I love to see 

--- Instrumental ---

Spring is silent through the trees
Round the banks of Lake Louise.

Across the sea they call me
And on and on a love so true
For the Blue Canadian Rockies
And the one I love to see...",Blue Canadian Rockies,The International Jim Reeves,1963,12,3:09,Track 'B1',Album,False
171,N/A,Jim Reeves,"This is the moment, I've waited for
I can hear my heart singing, soon bells will be ringing
This is the moment of sweet Aloha
I will love you longer than forever
Promise me that you will leave me never.

Here and now dear all my love I vow dear.
Promise me that you will leave me never 
I will love you longer than forever
Now that we are one clouds won't hide the sun.

Blue skies of Hawaiian smile
On this our wedding day.
I do (I do), love you (love you),
With all my heart...",The Hawaiian Wedding Song,The International Jim Reeves,1963,12,2:36,Track 'B2',Album,False
172,N/A,Jim Reeves,"You are my darlin'
There's no one but you
And to you I'll be true
Our whole life through.

Heaven in smilin' 
Because you love me
It' as plain as can be
You're my love.

Ask the stars that shine
There above you
Who loves you
And needs you tonight.
They'll tell you it's
I who love you
And I'm lonely when
You're out of my sight.

You are my darlin'
There's no one but you
And to you I'll be true
Our whole life through.

Heaven in smilin' 
Because you love me
It' as plain as can be
You're my love...",You Are My Love,The International Jim Reeves,1963,12,2:05,Track 'B3',Album,False
173,N/A,Jim Reeves,"I listened to an old friend
Describe the girl he'd met
In memory I could see her
Heartbreak in silhouette.

He said her hair was golden
Her eyes were violet
It surely had to be her
Hearbreak in silhouette.

He said, that when he kissed her
Her kisses were like wine
And suddenly I wondered
If she'd break his heart like mine?

But I sat there in silence
And smoked my cigarette
His heart would soon discover
Heartbreak in silhouette.

With shining eyes he told me
About the night they'd met
My own heart kept remembering
Heartbreak in silhouette.

Outside the rain kept falling
Recalling old regrets
Then she stood in the doorway
Heartbreak in silhouette.

At first she didn't see us
Because the lights were dim
As she chetted with her new love
She had eyes for only him.

My friend sat that there in silence
And not one word was said
Two broken hearts were sharing
Heartbreak in silhouette.
Heartbreak in silhouette...",Heartbreak In Silhouette,The International Jim Reeves,1963,12,1:39,Track 'B4',Album,False
174,N/A,Jim Reeves,"Tahiti, land of love, oh sweetest paradise
Where palms whisper softly to me

My hart verlang terug geluk wag op my
Daar aan haar wil ek my liefde openbaar

I remember, oh so well when first we met
The song of the palms I can't forget

Tahiti verre land o soetste paradys
Daar waar die palmbome saggies suis...",Tahiti,The International Jim Reeves,1963,12,3:04,Track 'B5',Album,False
175,N/A,Jim Reeves,"I dream of a golden moon and silver stars
When first we met and danced to sweet guitars
Music that breaks my heart bringing me dear
Golden memories and silver tears

Golden memories and silver tears
Are my lonely heart's souvenirs
All that you've left me are memories dear
Golden memories and silver tears

And now dear my golden moon pass and turn to blue
And all those silver stars are gone with you
Old memory of love bringing me pain
Oh, how sad to love and love all in vain

Golden memories and silver tears
Are my lonely heart's souvenirs
All that you've left me are memories dear
Golden memories and silver tears...",Golden Memories And Silver Tears,The International Jim Reeves,1963,12,2:26,Track 'B6',Album,False
176,N/A,Hank Snow,,Blue Roses,Ninety Miles An Hour (Down A Dead End Street) / Blue Roses,1963,2,2:34,Track 'B',Single,False
177,N/A,Marty Robbins,"Over high mountains not too far away
Is a valley I'm longin' to see
There lives a maiden who wants be mine
But her family cares nothin' for me

Her Mother knows that her daughter found love
In the arms of a poor mountain man
Her Father tells her, have nothin' to do
With the boy from the high mountain clan

Those in the valley have castles and wealth
Does that make them better than I
My dreams are my wealth and I've plenty of them
And my castles reach up to the sky

'Cause I am poor have I no right to love
Even though I am loved in return
True love can never be measured in riches
And money cannot make it burn

Her wealthy Father believes that a man
Should be judged on the ground that he owns
Since I have only the price of an acre
He wants me to leave her alone

But I'm determined, I'm young and I'm strong
It's true love that I'm workin' for
I'll buy me an acre down there in the valley
And soon have a hundred or more

Nola and I will be married and Heaven
Will bless with a boy and a girl
And we'll teach them true love can never be measured
By riches they've gained in this world",Over High Mountain,Begging To You / Over High Mountain,1963,2,,Track 'B',Single,False
178,N/A,Ray Price,"When the evening sun goes down you will find me hanging round
Oh the night life ain't no good life but it's my life
Many people just like me dreaming of old used-to-be
Oh the night life ain't no good life but it's my life
Well listen to the blues they're playin' yeah listen to what the blues are sayin'
Mine is just another scene from the world of broken dreams
Oh the night life ain't no good life but it's my life

Yeah when the evening sun goes down...",Night Life,Make The World Go Away / Night Life,1963,2,,Track 'B',Single,False
179,N/A,David Houston,,Angeline,Mountain Of Love / Angeline,1963,2,,Track 'B',Single,False
