,Rank,Artist,Lyrics,Title,album_name,release_date,total_tracks,duration,track_number,album_single,chart
258,N/A,Patsy Cline,"I've got my life in such a mess
And I don't know what to do
How can I live in this ol' world
And be in love with two
If I said goodbye to my first true love
My heart would break in two
For I'm halfway still in love with him
And half in love with you

Tra le la le la le la triangle
Tra le la le la le la triangle
Tra le la le la le la triangle
My life's in such a tangle
Tra le la le la le la ~ triangle
Tra le la le la le la ~ triangle
Tra le la le la le la ~ triangle
What'll I do about you

I saw you at the movie show
Just the other day
But I was with my other love
So I looked the other way
I didn't want to hurt him
Couldn't bear for him to see
The way that I would look at you
And the way you look at me

Tra le la le la le la triangle
Tra le la le la le la triangle
Tra le la le la le la triangle
My life's in such a tangle
Tra le la le la le la ~ triangle
Tra le la le la le la ~ triangle
Tra le la le la le la ~ triangle
What'll I do about you

Tra le la le la le la triangle
Tra le la le la le la triangle
Tra le la le la le la triangle
My life's in such a tangle
Tra le la le la le la ~ triangle
Tra le la le la le la ~ triangle
Tra le la le la le la ~ triangle
What'll I do about you

What'll I do about you...",Tra Le La Le La Triangle,The Patsy Cline Story,1963,24,,Track 'B4',Single,False
259,N/A,Patsy Cline,"Written by Cole Porter 
(As recorded by Patsy Cline 8/17/61) 

While I give to you
And you give to me
True love, true love
So on and on
It will always be
True love, true love.

For you and I have a guardian angel
On high with nothing to do
But to give to you
And to give to me
Love forever true.

--- Instrumental while Patsy hums ---

But to give to you
And to give to me
Love forever true
Love forever true...",True Love,The Patsy Cline Story,1963,24,,Track 'B5',Single,False
260,N/A,Patsy Cline,"Imagine me still lovin' you
After all you've put me through
Well I can't help it, I just do
Imagine that
And that's not the half

Imagine this if you can
I've stood more, more than I should stand
But I'd still take you, back again
Imagine that
Ain't that a laugh

Can you believe, I'd swallow my pride
Well yes, yes, I guess you can
'Cause you know you've always had my foolish heart
Right in the palm of your hand, oh

So for what it's worth it to you
It just don't matter what you might do
'Cause I'm still waitin' and lovin' you
Imagine that
Ain't that a laugh

So for what it's worth, to you
It just don't matter what you might do
'Cause I'll still be waitin' and lovin' you
Imagine that
Ha A... Ain't that a laugh...",Imagine That,The Patsy Cline Story,1963,24,,Track 'B6',Single,False
261,N/A,Patsy Cline,"I'm back in baby's arms
How I missed those lovin' arms
I'm back where I belong
Back in baby's arms

Don't know why we quarreled
We never did before
Since we found out how it hurt
I bet we never quarrel anymore

I'm back in baby's arms
How I missed those lovin' arms
I'm back where I belong
Back in baby's arms

Thought I didn't need his love
Till he took it away
Now I'm back where I belong
And in my baby's arms I'm gonna stay

I'm back in baby's arms
How I missed those lovin' arms
I'm back where I belong
Back in baby's arms
Back in baby's arms
Back in baby's arms
Back in baby's arms",Back In Baby's Arms,The Patsy Cline Story,1963,24,,Track 'C1',Single,False
262,N/A,Patsy Cline,"Crazy
I'm crazy for feeling so lonely
I'm crazy
Crazy for feeling so blue

I knew
You'd love me as long as you wanted
And then some day
You'd leave me for somebody new

Worry
Why do I let myself worry?
Wondering
What in the world did I do?

Oh, crazy
For thinking that my love could hold you
I'm crazy for trying
And crazy for crying
And I'm crazy for loving you

Crazy
For thinking that my love could hold you
I'm crazy for trying
And crazy for crying
And I'm crazy for loving you",Crazy,The Patsy Cline Story,1963,24,,Track 'C2',Single,False
263,N/A,Patsy Cline,"If you are sincere
When you say you don't care
That our love is just a memory.
If the love that we knew
Won't bother you
Darlin', you're stronger than me.

For if still lovin' you means I'm weak
Then I'm weak
For I still, fall apart when we speak
Or we meet.
If the love that we knew
Won't bother you
Darlin', you're stronger than me.

If you can have fun
With some other one
With no thought of what used to be.
If it's easy to say
That it's better this way
Darlin', you're stronger than me.

For if still lovin' you means I'm weak
Then I'm weak
For I still fall apart when we speak
Or we meet.
If the love that we knew
Won't bother you
Darlin', you're stronger than me...",You're Stronger Than Me,The Patsy Cline Story,1963,24,,Track 'C3',Single,False
264,N/A,Patsy Cline,"Seven lonely days make one lonely week
Seven lonely nights make one lonely me
Ever since the time you told me we were through
Seven lonely days I cried and I cried for you

Oh, my darlin' I'm cryin', boo-hoo-hoo-hoo
There's no use in denyin' I cried for you
It was your favorite pastime, makin' me blue
Last week was the last time I cried for you

Seven hankies blue I filled with my tears
Seven letters true I filled with my fears
Guess it never pays to make your lover blue
Seven lonely days I cried and I cried for you

Oh, my darlin' I'm cryin', boo-hoo-hoo-hoo
Now, there's no use in denyin' I cried for you
It's all your favorite pastime, makin' me blue
Last week was the last time I cried for you
Last week was the last time I cried for you...",Seven Lonely Days,The Patsy Cline Story,1963,24,,Track 'C4',Single,False
265,N/A,Patsy Cline,"Sweet dreams of you
Every night I go through
Why can't I forget you and start my life anew
Instead of having sweet dreams about you

You don't love me its plain
I should know I'll never wear your ring
I should hate you the whole night through
Instead of having sweet dreams about you

Sweet dreams of you
Things I know can't come true
Why can't I forget the past
Start loving someone new
Instead of having sweet dreams about you",Sweet Dreams (Of You),The Patsy Cline Story,1963,24,,Track 'C5',Single,False
266,N/A,Patsy Cline,"Your cheatin' heart
Will make you weep
You'll cry and cry
And try to sleep.

But sleep won't come
The whole night through
Your cheatin' heart
Will tell on you.

When tears come down
Like fallin' rain
You'll toss around
And call my name.

You'll walk the floor
The way I do
Your cheatin' heart
Will tell on you.

When tears come down
Like fallin' rain
You'll toss around
And call my name.

You're gonna walk the floor
The very way I do
Your cheatin' heart
Is gonna tell on you...",Your Cheatin' Heart,The Patsy Cline Story,1963,24,,Track 'C6',Single,False
267,N/A,Patsy Cline,"Deep within my heart
Lies a melody,
A song of old San Antone,
Where in dreams I live
With a memory,
Beneath the stars all alone.

Well, it was there I found
Beside the Alamo
Enchantment strange as the
Blue up above,
For that moonlit pass
That only he would know
Still hears my broken song of love.

Moon in all your splendor,
Known only to my heart,
Call back my rose,
Rose of San Antone!
Lips so sweet and tender,
Like petals fallin' apart,
Speak once again of my love, my own
Broken song,
Empty words I know
Still live in my heart all alone,
For that moonlit pass by the Alamo,
And rose my rose of San Antone!

Well the, Moon in all your splendor,
Known only to my heart,
Call back my rose,
Rose of San Antone!
Lips so sweet and tender,
Like petals fallin' apart,
Speak once again of my love, my own
Broken song,
Empty words I know
Still live in my heart all alone,
Well that moonlit pass by the Alamo,
And rose my rose of San Antone.
Heh...",San Antonio Rose,The Patsy Cline Story,1963,24,,Track 'D1',Single,False
268,N/A,Patsy Cline,"He takes me to the places you and I used to go
He tells me over and over that he loves me so
He gives me love that I never got from you
He loves me too
His love is true
Why can't he be you?

He never fails to call and tell me I'm on his mind
And I'm lucky to have such a guy, I hear it all the time
And he does all the things that you would never do
He loves me too
His love is true
Why can't he be you?

He's not the one who dominates my mind and soul
And I should love him so, 'cause he loves me I know
But his kisses leave me cold

He sends me flowers, calls on the hour, just to prove his love
And my friends say when he's around, I'm all he speaks of
And he does all the things that you would never do
He loves me too
His love is true
Why can't he be you?",Why Can't He Be You,The Patsy Cline Story,1963,24,,Track 'D2',Single,False
269,N/A,Patsy Cline,"Oh, the wayward wind is a restless wind
A restless wind that yearns to wander
And he was born the next of kin
The next of kin to the wayward wind

In a lonely shack by a railroad track
He spent his younger days
And I guess the sound of the outward bound
Made him a slave to his wand'rin' ways

Oh, the wayward wind is a restless wind
A restless wind that yearns to wander
And he was born the next of kin
The next of kin to the wayward wind

Oh, I met him there in a border town
He vowed we'd never part
Tho' he tried his best to settle down
Now I'm alone with a broken heart

Oh, the wayward wind is a restless wind
A restless wind that yearns to wander
And he was born the next of kin
The next of kin to the wayward wind

The next of kin to the wayward wind...",The Wayward Wind,The Patsy Cline Story,1963,24,,Track 'D3',Single,False
270,N/A,Patsy Cline,"I've been so wrong
For so long
Thought I could live 
Without the love that you give
I was wrong oh, so wrong

I've been so wrong
For so long
I didn't know that I loved you so
I was wrong

Well I never knew 
I could want you 
Darling, oh, so much
Now that you're gone 
I dream of you 
And your sweet touch

I was so wrong
For so long
But I've seen the light 
Darling, I'll make it right
I was wrong

Well, I never knew 
I could want you 
Darling, oh, so much
Now that you're gone, 
I dream of you 
And your sweet touch

I, was so wrong
For so long
But I've seen the light 
Darling, I'll make it right
I was wrong...",So Wrong,The Patsy Cline Story,1963,24,,Track 'D4',Single,False
271,N/A,Patsy Cline,"I love you so much, it hurts me
Darlin', that's why I'm so blue
I'm so afraid to go to bed at night
Afraid of losing you

I love you so much, it hurts me
And there's nothing I can do
I want to hold you my dear, forever and ever
I love you so much, it hurts me so

I love you so much, it hurts me
And there's nothing I can do
I want to hold you my dear, forever and ever
I love you so much, it hurts me so...",I Love You So Much It Hurts,The Patsy Cline Story,1963,24,,Track 'D5',Single,False
272,N/A,Patsy Cline,"See the pyramids along the Nile
Watch the sunrise from a tropic isle
Just remember darling all the while
You belong to me

See the market place in old Algier
Send me photographs and souvenirs
Just remember when a dream appears
You belong to me
I'd be so alone without you
Maybe you'd be lonesome too and blue

Fly the ocean in a silver plane
See the jungle when it's wet with rain
Just remember till you're home again
You belong to me

I'd be so alone without you
Maybe you'd be lonesome too and blue

Fly the ocean in a silver plane
See the jungle when it's wet with rain
Just remember till you're home again
You belong to me",You Belong To Me,The Patsy Cline Story,1963,24,,Track 'D6',Single,False
273,N/A,Ernest Ashworth,,King Of The Blues,I Take The Chance / King Of The Blues,1962,2,2:31,Track 'B',Single,False
274,N/A,Roy Clark,,Spooky Movies,Tips Of My Fingers / Spooky Movies,1963,2,2:40,Track 'B',Single,False
275,N/A,Dave Dudley,"Well I pulled out of Pittsburgh, a-rollin' down that Eastern Seaboard
I got my diesel wound up and she's a-runnin' like a-never before
There's a speed zone ahead, but all right 
I don't see a cop in sight
Six days on the road and I'm a-gonna make it home tonight

I got me ten forward gears and a Georgia overdrive
I'm taking little white pills and my eyes are open wide
I just passed a Jimmy in a white 
I been a passing everything in sight
Six days on the road and I'm a-gonna make it home tonight

Well it seems like a month since I kissed my baby goodbye
I could have a lot of women but I'm not a-like a-some other guys
I could find one to hold me tight 
But I could never make believe it's all right
Six days on the road and I'm a-gonna make it home tonight

ICC is a checking on down the line
Well I'm a little overweight and my log book's way behind
But nothin' bothers me tonight 
I can dodge all the scales all right
Six days on the road and I'm a-gonna make it home tonight

Well my rig's a little old but that don't mean she's slow
There's a flame from her stack and that smoke's a-blowing black as coal
My hometown's a-comin' in sight 
If you think I'm a-happy, you're right
Six days on the road and I'm a-gonna make it home tonight
Six days on the road and I'm a-gonna make it home tonight
Six days on the road and I'm a-gonna make it home tonight",Six Days On The Road,Last Day In The Mines,1967,10,2:21,Track 'A1',Album,False
276,N/A,Dave Dudley,"Oh she just walked out the door and I know she won't be back anymore
The echo of her footsteps have gone and now I feel a cry coming on
Her picture on the table smiles at me the sweet tender love is there to see
Yesterday that sweet love was my own but now I feel a cry coming on
Yes I feel a cry coming on and for the first time in my life I'm all alone
Everything I love is gone and now I feel a cry coming on

Yes I feel a cry coming on...",I Feel A Cry Coming On,Last Day In The Mines,1967,10,2:50,Track 'A2',Album,False
277,N/A,Dave Dudley,,Boo On You,Last Day In The Mines,1967,10,2:09,Track 'A3',Album,False
278,N/A,Dave Dudley,,Then I Can Go To Bed,Last Day In The Mines,1967,10,2:23,Track 'A4',Album,False
279,N/A,Dave Dudley,"Yes I know that I'm about to lose you cause someone else is always on your mind
Why must I have to give you up and give my heart up too
For a love that came along before my time
You say with me you think you've made a big mistake
Well good luck I hope your ending turns out fine
It's gonna hurt a long long time that's the price I'll pay
For a love that came along before my time
Well please don't blame me if I stay in love with you
And while I'm alone if I pretend that you're still mine
I can stand my loneliness if I know you're not blue
With a love that came along before my time
With a love that came along before my time",Before My Time,Last Day In The Mines,1967,10,2:12,Track 'A5',Album,False
280,N/A,Dave Dudley,,Taxi Cab Driver,Last Day In The Mines,1967,10,2:08,Track 'B2',Album,False
281,N/A,Dave Dudley,,Above And Beyond,Last Day In The Mines,1967,10,2:05,Track 'B3',Album,False
282,N/A,Dave Dudley,,Lonely Corner,Last Day In The Mines,1967,10,1:44,Track 'B4',Album,False
283,N/A,Dave Dudley,,Barbara Allen,Last Day In The Mines,1967,10,1:59,Track 'B5',Album,False
284,N/A,Justin Tubb,,What's Wrong With The Way That We're Doing It Now,Justin Tubb,1981,10,3:24,Track 'A1',Album,False
285,N/A,Justin Tubb,,You'd Never Be Happy With Me,Justin Tubb,1981,10,3:00,Track 'A2',Album,False
286,N/A,Justin Tubb,,Pull The Covers Over Me,Justin Tubb,1981,10,2:43,Track 'A3',Album,False
287,N/A,Justin Tubb,,2 Out Of 3 Ain't Bad,Justin Tubb,1981,10,3:11,Track 'A4',Album,False
288,N/A,Justin Tubb,,My Ex-Wife Is Gonna Be My Next Wife,Justin Tubb,1981,10,2:51,Track 'A5',Album,False
289,N/A,Justin Tubb,,Lonesome 7-7203,Justin Tubb,1981,10,2:24,Track 'B1',Album,False
290,N/A,Justin Tubb,,I Gotta Go Get My Baby,Justin Tubb,1981,10,2:20,Track 'B3',Album,False
291,N/A,Justin Tubb,,As Long As There's A Sunday,Justin Tubb,1981,10,3:54,Track 'B4',Album,False
292,N/A,Justin Tubb,,Lookin' Back To See,Justin Tubb,1981,10,2:39,Track 'B5',Album,False
293,N/A,Webb Pierce,,"Please Help Me, I'm Falling",Sands Of Gold,1964,12,,Track 'A1',Album,False
294,N/A,Webb Pierce,"I'm in a blue mood and you've caused it all
The night life is calling again it's plain to see the blues are stepping in
So long now I've waited for your call I'm in a blue mood and you've caused it all
Now I know you're seeing someone else but I love you inspite of my soul
Just couldn't resist I have to fall I'm in a blue mood and you've caused it all
The night lights to you again are lureing and darling you're the reason for my fall
Your kind of love was my undoing I'm in a blue mood and you've caused it all
(Fiddle - steel)
The night lights to you...",Blue Mood,Sands Of Gold,1964,12,,Track 'A3',Album,False
295,N/A,Webb Pierce,"Don't let me cross over love's cheating line
I'm tempted my darling to steal you away
Don't let me cross over stay out of my way
You know that I love you and I'm not the stealing kind
But I'm forced with heartaches at love's cheating line
Don't let me cross over love's cheating line
You belong to another and you'll never be mine
I know one step closer would be heaven divine
Don't let me cross over love's cheating line
(Steel)
I've tried to forget you but what else can I do
When your eyes keep saying that you love me too
I know if I lose you not a dream will I have left
I don't want to cheat dear but I can't help myself
Don't let me cross over...",Don't Let Me Cross Over,Sands Of Gold,1964,12,,Track 'A4',Album,False
296,N/A,Webb Pierce,"(Roses are red my love)
A long long time ago on graduation day
You handed me your book I signed this way
Roses are red my love violets are blue
Sugar is sweet my love but not as sweet as you

We dated through school and when the big day came
I wrote into your book next to my name
Roses are red my love...

Is that your little girl she looks a lot like you
Some day some boy will write in her book too
Roses are red my love...

Then I went far away and you found someone new
I read your letter dear and I wrote back to you
Roses are red my love violets are blue
Sugar is sweet my love good luck may God bless you",Roses Are Red (My Love),Sands Of Gold,1964,12,,Track 'A5',Album,False
297,N/A,Webb Pierce,"Castles are made high and mighty and oceans were made deep and wide
We were made for each other that's how I feel about my love for you
Up in the sky there is a rainbow that some people say has no end
Well this I don't know if true but there's no end of my love for you
Living each moment waiting for your touch
Praying each night you want me half as much
Vows that are made sometimes are broken and someone you trust can prove untrue
But I'll never be unfaithful for you can trust in my love for you
But you trust in my love for you",My Love For You,Sands Of Gold,1964,12,,Track 'A6',Album,False
298,N/A,Webb Pierce,"I wanna go home I wanna go home oh Lord I wanna go home
Last night I went to sleep in Detroit City
And I dreamed about those cottonfields and home
I dreamed about my mother dear old papa sister and brother
I dreamed about that girl who's been waiting for so long
I wanna go home I wanna go home oh Lord I wanna go home
(Guitar)
Homefolks think I'm big in Detroit City
From the letters that I write they think I'm fine
But by day I make the cars by night I make the bars
If only they could read between the lines
Now you know I rode the freight train north to Detroit City
And after all these years I find I've just been wastin' my time
So I just think I'll take my foolish pride and put it on a Southbound freight and ride
Go on back to the loved ones the ones I left waiting so far behind
I wanna go home I wanna go home oh Lord I wanna go home",Detroit City,Sands Of Gold,1964,12,,Track 'B1',Album,False
299,N/A,Webb Pierce,"Anytime you need me I'll come running back to you
Even though you left me I'll hide my cry to be with you
I throw back my head just to hold back my tears
For I'll never forget those wonderful years
I'll never forget those wonderful years

(Should you meet someone to tell you you were right for leaving me
Tears don't keep me waiting I'll tell you to our eternity)
Yes I throw back my head...
(I throw back my head just to hold back my tears)
I'll never forget those wonderful years
I'll never forget those wonderful years",Those Wonderful Years,Sands Of Gold,1964,12,,Track 'B2',Album,False
300,N/A,Webb Pierce,,Nobody's Darling But Mine,Sands Of Gold,1964,12,,Track 'B3',Album,False
301,N/A,Webb Pierce,"If the back door could talk just long enough to tell me
Who goes out just when I come in
Well she says I must be dreaming yet I know that she's been scheming
And I wonder who goes out when I come in
If I could see inside those wall without goin' in
And believe the one who's with her now is just another friend
I don't care I know his name after all he's not to blame
Still I wonder who goes out when I come in
(Piano)
If I could see inside...",If The Back Door Could Talk,Sands Of Gold,1964,12,,Track 'B4',Album,False
302,N/A,Webb Pierce,"I've heard the sayin' all my life that true love never dies
I never could see how this could be
Since I left you my wounded heart keep telling me I'm wrong
Go back and try true lover never dies
My foolish pride won't let my heart overpass my stubborn mind
My heart keeps saying please go back don't run away and hide
For you'll face so many bitter years alone and then you'll cry
Can't you be alive true love never dies
(Steel - fiddle - piano)
My foolish pride...",True Love Never Dies,Sands Of Gold,1964,12,,Track 'B5',Album,False
303,N/A,Webb Pierce,,The Smile Of A Clown,Sands Of Gold,1964,12,,Track 'B6',Album,False
304,N/A,George Jones,,I Saw Me,Not What I Had In Mind,1963,2,2:40,Track 'B',Single,False
305,N/A,Ray Price,"(Burning mem'ries burning mem'ries memories of you that I can't lose)
Tonight I'm burning old love letters photographs and memories of you
Hoping somehow I'll feel better and when the smoke is gone I won't want you
Burning mem'ries teardrops fall while I am
Burning mem'ry burning all the memories of you that I can't lose
My heart to you no longer matters and I can't live alone with memories
Into the fire those dreams you've shattered
And when the smoke is gone then I'll be free
Burning mem'ries teardrops fall while I am
Burning mem'ry burning all the memories of you that I can't lose",Burning Memories,Burning Memories,1964,12,,Track 'A1',Album,False
306,N/A,Ray Price,"Here comes more tears to cry here comes more heartaches by
Here comes my baby back again
Here comes more misery here comes old memory here comes my baby back again
My arms are open wide to let more hurt inside here comes my baby back again
She's sorry once again once more I'll understand here comes my baby back again
(Strings)
My arms are open wide...
Here comes my baby back again",Here Comes My Baby Back Again,Burning Memories,1964,12,,Track 'A2',Album,False
307,N/A,Ray Price,"Oh make the world go away and get it off my shoulder
It goes bigger day by day please make the world go away
I was wrong the day I left you and let the world leave me astray
If you'll say that you forgive me you'll make the world go away
Oh make the world go away and get it off my shoulder
I go weaker day by day please make the world go away
I'm sorry that I hurt you I'll make it up day by day
Can you love me like you used to and make the world go away
Make the world go away and get it off my shoulder
Can you love me like you used to and make the world go away
Say the things you used to say and make the world go away
I can't stand another day please make the world go away
Say you'll take me back to stay and make the world go away",Make The World Go Away,Burning Memories,1964,12,,Track 'A3',Album,False
308,N/A,Ray Price,"Oh look around you look down the barroom the lonely faces that you see
Are you sure that this is where you want to be
These are your friends but are they real friends do they love you the same as me
Are you sure that this is where you want to be
You seem in such a hurry to live this kind of life you caused so many tears and misery
Look around you take a good look and tell me what you see
Are you sure that this is where you want to be
Don't let my tears persuade you I had hoped I wouldn't cry
But lately teardrops seem a part of me
So look around you and take a good look at all the lonely used to be
Are you sure that this is where you want to be",Are You Sure,Burning Memories,1964,12,,Track 'A4',Album,False
309,N/A,Ray Price,"Soft rain was falling when you told me goodbye
Thunder and lightning filled my heart inside
The love born in heaven had suddenly died
And the soft rain was teardrops for the angels all cried
If love can be perfect ours must have been
But perfection is always destroyed by men
The rain whispered softly a true love just died
And the soft rain was teardrops for the angels all cried
The rain started falling when you told me goodbye
And lightning came crashing from out of the sky
The sky that was bright blue turned slowly to grey
And the angels cried with me as you walked away
If love can be perfect ours must have been...",Soft Rain,Burning Memories,1964,12,,Track 'A5',Album,False
310,N/A,Ray Price,"Please release me, let me go

For I don't love you anymore

To waste our lives would be a sin

Release me and let me love again

I have found a new love din

And I will always want her near

Her lips are warm, while yours are cold

Release me, my darling, let me go

(Please release me, let me go)

For I don't love you anymore

(To waste our life would be a sin)

So release me and let me love again

Please release me, can't you see?

You'd be a fool to cling to me

To live our life would bring us pain

So release me and let me love again

(Let me love, let me go)",Release Me,Burning Memories,1964,12,,Track 'A6',Album,False
