,Rank,Artist,Lyrics,Title,album_name,release_date,total_tracks,duration,track_number,album_single,chart
199,N/A,Paul Overstreet,"Daddy's come around to mama's way of thinking
No more staying out all night a-drinking
Every things better on the home front now
They're meeting in the middle working it out
Finally figured out he's got something worth keeping
Daddy's come around to mama's way of thinking

Daddy used to go out every night with his friends
And mama stay home taking care of the of the kids
Daddy didn't mind the way it was arranged
To his way of thinking it didn't seem strange
Then one night mama met him at the door
Cause the key in his hand didn't work anymore
Mama said more than the locks have changed
There's a new set of rules to this old game

Daddy's come around to mama's way of thinking
No more staying out all night a-drinking
Every things better on the home front now
They're meeting in the middle working it out
Finally figured out he's got something worth keeping
Daddy's come around to mama's way of thinking

Now it's been some time since she laid down the law
But daddy doesn't seem to mind much at all
Come straight home when the work day is through
He's even done the dishes a time or two
And late last night when the lights were low
Daddy told mama I love you so
Early this morning mama said to him
You just might get to be a daddy again

Daddy's come around to mama's way of thinking
No more staying out all night a-drinking
Every things better on the home front now
They're meeting in the middle working it out
Finally figured out he's got something worth keeping
Daddy's come around to mama's way of thinking

Every things better on the home front now
They're meeting in the middle working it out
Finally figured out he's got something worth keeping
Daddy's come around to mama's way of thinking
Daddy's come around to mama's way of thinking
Daddy's come around to mama's way of thinking",Daddy's Come Around,The Best Of Paul Overstreet,1993,10,3:08,Track '5',Compilation,False
200,N/A,Paul Overstreet,"He drives into the city
Works extra hard all day
He finishes up early
So he can get away
'Cause there's a blue-eyed kid on second base
Wants Dad to watch him play
And Daddy knows he's waiting
So he hurries on his way

'Cause you know heroes come in every shape and size
Makin' special sacrifices for others in their lives
No one gives them medals
The world don't know their names
But in someone's eyes, they're heroes just the same

She rocks her crying baby
In the hours before dawn
She whispers words of hope to help her
husband to hold on
She takes time with the children
Makin' sure they know she cares
She's more then just a Momma
She's the answer to their prayers

'Cause you know heroes come in every shape and size
Makin' special sacrifices for others in their lives
No one gives 'em medals
The world don't know their names
But in someone's eyes, they're heroes just the same

Now, I don't pretend to know you 
But I bet it's safe to say 
There's someone out there somewhere lookin' up to you today
And they see everything you do
Except for your mistakes 
You may not think you measure up
But you got all it takes

You know heroes come in every shape and size
Makin' special sacrifices for others in their lives
No one gives 'em medals
The world don't know their names
But in someone's eyes, they're heroes just the same

No one gives 'em medals
The world don't know their names 
But in someone's eyes
They're heroes just the same
Yeah, in someone's eyes
They're heroes just the same

Talkin' 'bout a hero (hero)
A special kind o' hero (hero)
No ordinary heroes
(Talkin' 'bout a hero)
Special kind o' hero",Heroes,The Best Of Paul Overstreet,1993,10,3:31,Track '6',Compilation,False
201,N/A,Paul Overstreet,,Ball & Chain,The Best Of Paul Overstreet,1993,10,4:32,Track '7',Compilation,False
202,N/A,Paul Overstreet,"If I could bottle this up,
I could make a million.
I could sell everybody around
On what I've been feeling.
It's guaranteed to put a smile on your face
A song in your heart after one little taste
Folks couldn't get enough
If I could bottle this up.

If I could take you kiss
And twist it into liquid form
Melt it with the way I felt
Here in your arms
Sprinkle in a twinkle or two
From your eyes
A dab of this fabulous feeling inside
I could really rake in the bucks

If I could bottle this up,
I could make a million.
I could sell everybody around
On what I've been feeling.
'Cause it's guaranteed to put a smile on your face
A song in your heart after one little taste
Folks couldn't get enough
If I could bottle this up.

I can see it now
People knocking down my door
If I could get it on the shelf
Of my local department store
Nothing they could sell
Would sell as fast
Even if they threw in a tie or a glass
Folks would just eat it up
If I could bottle this up

If I could bottle this up,
I could make a million.
I could sell everybody in town
On what I've been feeling.
It's guaranteed to put a smile on your face
A song in your heart after one little taste
Folks couldn't get enough
If I could bottle this up.

Folks just couldn't get enough
Man, they would just eat it up
It really would be too much
If I could bottle this up.",If I Could Bottle This Up,The Best Of Paul Overstreet,1993,10,3:30,Track '8',Compilation,False
203,N/A,Paul Overstreet,"His mama and daddy were very poor, and they never went to school billy followed in their footsteps like alot of children do.He had to get a job to help pay the bills, so his younger brother Ben might go to school and learn to read and write and maybe he could teach all of them... But billy can't read no billy can't read but he gives 200% for the minium wages that he receives sometimes he pretends like he can as he look laughs at the pictures in the funny books but it really ain't funny you see that billy can't read. Then the boss man came around talked to billy one day.He said now billy you're the hardest worker I've got and you surely deserve more pay.But the boss at the top says I've got to give every foreman a written test .Billy hung his head 'cause he knew right then he would always have to settle for less. but billy can't read no billy can't read but he gives 200% of the minium wages he receives sometimes he pretends like can as he looks laughs at the pictures the pictures in the funny book but it really ain't funny you see that illy can't read. little ben never took for granted all his brother billy's sacrifice.every night while the family slept they would sit up late by that old lamp light sounding out all the A's and the E's and the I's O's and U's. now he is reading everything from the cereal box to the bible three times though. cause billy can read yes billy can read now the rest of his life will be different you see because of the the rest of this life will be different because of the special gift he received now he doesn't haveto act like he's laughing as he looks at the silly pictures in the funny books they're as as they can benow that billy can read yeah his life id much better you see now that billy can read.",Billy Can't Read,The Best Of Paul Overstreet,1993,10,3:49,Track '9',Compilation,False
204,N/A,Paul Overstreet,"We started out to walk through life hand-in-hand together
We ran into some trouble on the highway to forever
Took a turn that turned out wrong, woke to find the feeling gone
But I know that we'll recover if we hold onto each other

Let's take another run at it, baby, take another run at our love
Let's have a little fun with it, darling, it don't have to be so serious
Don't tell me that it's over, and we can pick the pieces up
Let's take another run, take another run at our love

Sometimes the mountain looks so high when you're standing at the bottom
But once we've made it to the top, we can't see the problem
Right now it hurts a little bit, but we've never been the kind to quit
And I know we'll make it over, and we'll be rolling in the clover

Let's take another run at it, baby, take another run at our love
Let's have a little fun with it, darling, it don't have to be so serious
Don't tell me that it's over, and we can pick the pieces up
Let's take another run, take another run at our love

Now if we walk away and say we tried
We'll never know what's on the other side

Let's take another run at it, baby, take another run at our love
Let's have a little fun with it, darling, it don't have to be so serious
Don't tell me that it's over, and we can pick the pieces up
Let's take another run, take another run at our love

Let's take another run at it, baby, take another run at our love
Let's have a little fun with it, darling, it don't have to be so serious
Don't tell me that it's over, and we can pick the pieces up
Let's take another run, take another run at our love

Let's take another run at it, baby, take another run at our love
Let's have a little fun with it, darling, it don't have to be so serious
Don't tell me that it's over, and we can pick the pieces up
Let's take another run, take another run at our love

Let's take another run at it, baby, take another run at our love
Let's have a little fun with it, darling, it don't have to be so serious
Don't tell me that it's over, and we can pick the pieces up
Let's take another run, take another run at our love",Take Another Run,The Best Of Paul Overstreet,1993,10,3:44,Track '10',Compilation,False
205,N/A,Conway Twitty,"Hush, hush
Everyone who had a great big crush
Just hit the ground
Yeah, that's the sound
Of hearts breakin' all over town

Hey, hey, guys, I see you've heard the news
Sooner or later she had to choose
Yeah, we all thought we might be the one
Now, she's gone and tied the knot
And everybody looks so stunned

Hush, hush
Everyone who had a great big crush
Just hit the ground
Yeah, that's the sound
Of hearts breakin' all over town

She had looks and such a charming way
You know, girls like her don't come along every day
She cast a spell you could not resist
Now, all of us are moping around
Crying 'bout the chance we missed

Hush, hush
Everyone who had a great big crush
Just hit the ground
Yeah, that's the sound
Of hearts breakin' all over town

Hush, hush [unverified]",Heart's Breakin' All Over Town,Crazy In Love,1990,2,3:45,Track 'B',Single,False
206,N/A,Billy Joe Royal,"At first it seemed as if his dreams had all come true
And losing his heart was such an easy thing to do
He fell in love so deep with magic that they had
But when he realized he couldn't hold her

It finally drove him mad
Now he don't know when he lost her
He don't know that she's not there
And he don't know that it's over
Best of all he don't know that she don't care
Now he shows her old photograph to each new friend he finds
The writing on the back has long since faded out with time
But his heart remembers every word and his eyes still see the love
And in his mind he's still the one that she is dreaming of
Now he don't know when he lost her
He don't know that she's not there
And he don't know that it's over
Best of all he don't know that she don't care
Best of all he don't know that she don't care",He Don't Know,Till I Can't Take It Anymore,1989,2,3:56,Track 'B',Single,False
207,N/A,Don Williams,"Love is a question that few understand
It runs like a river between a woman and a man
But it's course can get twisted, its bed can run dry
And a heart become desert in the wink of an eye.

Once there was loving, once there was trust
Once it was honest and open and just
Our love was a diamond that grew between us
But time can turn even diamonds to dust.

Diamond to dust, oh diamonds to dust
Time can turn even diamonds to dust.

--- Instrumental ---

Time is a teacher it's kind and it's cruel
It gives you the wisdom to see you're a fool
And it gives love and takes love, it hurts and it heals
And it never parts easy with the truth it reveals.

Diamond to dust, oh diamonds to dust
Time can turn even diamonds to dust.

Diamond to dust, oh diamonds to dust
Time can turn even diamonds to dust.",Diamonds To Dust,Back In My Younger Days,1990,2,3:15,Track 'B',Single,False
208,N/A,Kathy Mattea,"By the way you watch the sunset, I can tell
Soon you'll saddle up that ol' strawberry roan
Bid goodbye to the goodnight lovin' trail
And set off to blaze a new trail of your own

I know you'll travel light, like you always do
But you'll always take a part of me with you

Here's hopin' there's an open road before you
Here's hopin' that your aim is always true
And when you're tryin' to outrun that setting sun
Here's hopin' that you do

I know you'll try to hold to higher ground
And stay one day ahead of the storm
But when another blows and the rain keeps pouring down
May you find a place to keep you safe and warm

They say, every cowboy finds a home, somewhere
But friend, until your travels take you there

Here's hopin' there's an open road before you
Here's hopin' that your aim is always true
And when you're tryin' to outrun that setting sun
Here's hopin' that you do

If the trail looks bad and you need to double back
Here's hopin' that you do",Here's Hopin',She Came From Fort Worth,1989,2,3:31,Track 'B',Single,False
209,N/A,Travis Tritt,"Full moon risin' over Atlanta
And I'm fourteen stories high
Lookin' down on a street full of people
Just like bees in a hive.

Lord, sometimes I feel just like a number
Like somebody lost my name
I just couldn't wait to get here to the city
Now I can't remember why I came.

And the road home keeps on gettin' longer
Old friends and yesterday's are further away
And that old home grown felling's gettin' stronger
Sayin' I'm gonna be a goner if I don't go back someday.

Cattails growin' down by the river
So crystal clear in my mind
And there's a song that I still remember
Sung by the wind in the pines.

Lord, the people ain't never in a hurry
Ain't never bothered by time
They just take their troubles and all of their worries
And hang 'em on the end of a fishin' line.

And the road home keeps on gettin' longer
Old friends and yesterday's are further away
And that old home grown felling's gettin' stronger
Sayin' I'm gonna be a goner if I don't go back someday.

--- Instrumental ---

And the road home keeps on gettin' longer
Old friends and yesterday's are further away
And that old home grown felling's gettin' stronger
Sayin' I'm gonna be a goner if I don't go back someday.

And the road home keeps on gettin' longer
Old friends and yesterday's are further away
And that old home grown felling's gettin' stronger
Sayin' I'm gonna be a goner if I don't go back someday.

Sayin' I'm gonna be a goner if I don't go back someday...",The Road Home (Album Version),I'm Gonna Be Somebody / The Road Home,1990,2,4:05,Track 'B',Single,False
210,N/A,Lee Greenwood,,We've Got It Made,Holdin' A Good Hand,1990,10,3:22,Track '1',Album,False
211,N/A,Lee Greenwood,,I Still Look For You,Holdin' A Good Hand,1990,10,3:49,Track '2',Album,False
212,N/A,Lee Greenwood,,Enough Already,Holdin' A Good Hand,1990,10,3:21,Track '3',Album,False
213,N/A,Lee Greenwood,,Love Lying Next To Me,Holdin' A Good Hand,1990,10,3:11,Track '4',Album,False
214,N/A,Lee Greenwood,,Whose Fool I Wanna Be,Holdin' A Good Hand,1990,10,3:45,Track '5',Album,False
215,N/A,Lee Greenwood,"It's just like me
To say to you
Love me do
And I'll be true
And what I'd like
For you to say
Is you'll come home
To me each day

Hiku be my girl
That's what I want
Just you sweet thing
And not a thing
It's just like me
To feel so good
And fall so much
In love with you

It's just like me
It's just like me
I'm actin' the fool
That's how I'll be
But it's just like you
To say goodbye
And leave me all
Alone at night, waah!

It's just like me",Just Like Me,Holdin' A Good Hand,1990,10,2:47,Track '7',Album,False
216,N/A,Lee Greenwood,,Giving Up The Ghost (That's Haunting Me),Holdin' A Good Hand,1990,10,3:31,Track '8',Album,False
217,N/A,Lee Greenwood,,The Moment You Were Mine,Holdin' A Good Hand,1990,10,3:09,Track '9',Album,False
218,N/A,Lee Greenwood,,Another Year Of Love,Holdin' A Good Hand,1990,10,3:47,Track '10',Album,False
219,N/A,Carlene Carter,"(Carlene Carter/Keith Christopher/Tom Gray)

Hey baby there's two sides to every story
I've heard them one too many times
Just stop callin' I'm not falling anymore
I've had enough of all your charms

Once and for all that's enough for a life time
Love's lost at long last it's over
Close the door and walk away
On the leavin' side

You can cry all night and I won't listen
I can't hear you anymore
You can lie your lies and I won't miss 'em
Hey just walk out that door

Once and for all that's enough for a life time
Love's lost at long last it's over
Close the door and walk away
On the leavin' side

Hey baby love may come and love may go
But now it's gone for good
Just stop tryin' I'm not buyin' anymore
I've taken all I could

Once and for all that's enough for a life time
Love's lost at long last it's over
Close the door and walk away
On the leavin' side

Oh it's over close the door
And walk away on the leavin' side",The Leavin' Side,Come On Back,1990,2,2:56,Track 'B',Single,False
220,N/A,Alabama,"Here we are, once again
Stronger now than we have ever been
Hand in hand, heart to heart
Now we're made it through the hardest part

We had to break it all down
To build it back up
Lean on each other when the times got rough
How'd we survive going through so much
Baby you and me could write a book about love

Here we are, one to one
Looking back to see how far we've come

We've shared it all, you and I
Still together after all this time

We had to break it all down
To build it back up
Lean on each other when the times got rough
How'd we survive going through so much
Baby you and me could write a book about love

Here we are, once again
Stronger now than we have ever been
Hand in hand, heart to heart, here we are

Here we are, once again
Stronger now than we have ever been
Hand in hand, heart to heart
Now we've made it through the hardest part

Here we are, one to one
Looking back to see how far we've come

We've shared it all, you and I
Still together after all this time
Here we are",Here We Are,Pass It On Down,1990,12,4:53,Track '2',Album,False
221,N/A,Alabama,"Just off of the beaten path
A little dot on the state road map
That's where I was born and where I'll die

Things move at a slower pace
Nobody's in a rat race
And these days that's a special way of life

Down Home
Where they know you by name and treat you like family
Down Home
A man's good word and a hand shake are all you need
Folks know
If they're fallin' on hard times they can fall back home
Those of us raised up down home

In the corner of the hardware store
Gathered round on a checkered board
Old men telling lies and crownin' kings

Kids drivin' round the old town square
Cops roll down int he cool night air
Go and see what's shakin' at the Dairy Queen

Down Home
Where they know you by name and treat you like family
Down Home
A man's good word and a hand shake are all you need
Folks know
If they're fallin' on hard times they can fall back home
Those of us raised up down home

When I was a boy I couldn't wait to leave this place
But now I wanna see my children raised

Down Home

Down Home

Folks know
If there fallin' on hard times they can fall back home
Those of us raised up
Down Home
Where they know you by name and treat you like family
Down Home
A man's good word and a handshake are all you need
Folks know
If they're fallin' on hard times they can fall back home
Those of us raised up
Down Home

Down Home
Way down home
Down home
Down Home
Way down home",Down Home,Pass It On Down,1990,12,2:51,Track '3',Album,False
222,N/A,Alabama,"I'll admit I could feel it 
The first time that we touched
The look in your eyes
Said you felt as much
But I'm not a man
Who falls so easily 
It's best that you know
Where you stand with me

I will give you my heart
Faithful and true
And all the love it can hold
That's all I can do 
But I've thought about 
How long I'll love you
And it's only fair that you know
Forever's as far as I'll go

When there's age around my eyes
And gray in your hair
And it only takes a touch to recall
The love we've shared
I won't take for granted
That you know my love is true
Each night in your arms
I will whisper to you

I will give you my heart
Faithful and true
And all the love it can hold
That's all I can do
But I've thought about
How long I'll love you
And it's only fair that you know
Forever's as far as I'll go",Forever's As Far As I'll Go,Pass It On Down,1990,12,3:27,Track '4',Album,False
223,N/A,Alabama,"In the corner of my mind stands a jukebox
It's playin' all my favorite mem-o-ries
One by one, they take me back
To the days when you were mine
And I can't stop this jukebox in my mind.

I don't need no quarters, don't need any dime
You filled it up forever
When you said good-bye
Heaven knows I love old melodies
They were meant to ease the pain
But the kind that's playin' on my mind
Are drivin' me insane.

In the corner of my mind stands a jukebox
It's playin' all my favorite mem-o-ries
One by one, they take me back
To the days when you were mine
And I can't stop this jukebox in my mind.

Song by song, those melodies
Were meant to ease the pain
But the kind that's playin' on my mind
Are drivin' me insane;

In the corner of my mind stands a jukebox
It's playin' all my favorite mem-o-ries
One by one, they take me back
To the days when you were mine
And I can't stop this jukebox in my mind.",Jukebox In My Mind,Pass It On Down,1990,12,3:36,Track '5',Album,False
224,N/A,Alabama,"Flattop guitar
Down around the campfire
You can smell that hickory burnin'
Catfish fryin'
Onions got us cryin'
Hush puppies they're a turnin'
Friends and kin comin' down the hill
Trippin' in the ole starlight
Cookin' and kickin' do a little pickin'
Party tonight

Come on down to the Moonlight Lounge
Where the ceilin' is so blue
Where there ain't no door and our dance floor
Is covered with mountain dew
Where there ain't no walls and the waterfall
Is the only sound around
Yeah, we're havin' us a party down in the holler
We call it the Moonlight Lounge

Me and my lady rode in on Sadie
A fourteen hand chestnut mare
A midnight hoot owl, he's screechin' so loud
Kind of puts a chill in the summer air
The bushes are wigglin', somebody's gigglin'
Buck couldn't wait to get a kiss
Jimmy's got the four wheel hooked to the wagon
A hay ride you don't wanna miss

Come on down to the Moonlight Lounge
Where the ceilin' is so blue
Where there ain't no door and our dance floor
Is covered with mountain dew
Where there ain't no walls and the waterfall
Is the only sound around
Yeah, we're havin' us a party down in the holler
We call it the Moonlight Lounge

Won't you come on down to the Moonlight Lounge
Where the ceilin' is so blue
Where there ain't no door and our dance floor
Is covered with mountain dew
Where there ain't no walls and the waterfall
Is the only sound around
Yeah, we're havin' us a party down in the holler
Call it the Moonlight Lounge

Yeah, we're havin' us a party everybody holler
Down at the Moonlight Lounge...",Moonlight Lounge,Pass It On Down,1990,12,3:39,Track '6',Album,False
225,N/A,Alabama,"Before I fly and wave goodbye
I say to you ""days with you are the best years of my life""
But if I don't see you anymore
Keep my words safely stored
And I'll be back I promise once more

Goodbye, goodbye
Till I see you again

Goodbye, goodbye
I'll love and I'll miss you till then

Remember me 'cause I care
Where you are and how you fare
Get in touch if the wind blows in your face
I guess it's been too much fun

We've shared and we've won
Yes the best is yet to come

Goodbye, goodbye
Till I see you again

Goodbye, goodbye
I'll love and I'll miss you till then

That one word hurts so bad
You leave the best you've had
But you keep the faith and pray to return

Goodbye, goodbye
I'll love and I'll miss you till then
Goodbye, goodbye
Goodbye, goodbye",Goodbye (Kelly's Song),Pass It On Down,1990,12,3:08,Track '7',Album,False
226,N/A,Alabama,"He was a stranger in a little town
She was sittin' alone in a crowd
Listening to the old jukebox playin' a song
From the moment we walked through the diner door
She felt something like never before
A feelin' so strong right from the start
It wouldn't stop - it was more than a spark

Fire on fire they were burnin' up
Over a coffee cup, under the table they touched
Fire on fire, in each others eyes they just had to try
'Cause fire on fire just won't die

It was gettin' late but they had all night
They sat there talkin' 'bout their lives
He was sellin', she was gettin' ready to buy
That ole neon light was glowin' dim
But he could see by the way she was lookin' at him
Tonight would be different, somethin' had changed
His lonely heart was feelin' a flame

Fire on fire they were burnin' up
Over a coffee cup, under the table they touched
Fire on fire, in each others eyes they just had to try
'Cause fire on fire just won't die

She needed him, he needed her
And they both knew, without a word
There was no question, there was no doubt
There was no way they could put it out

Fire on fire they were burnin' up
Over a coffee cup, under the table they touched
Fire on fire, in each other's eyes they just had to try
'Cause fire on fire, fire on fire
Fire on fire just won't die

Oh, no
Fire on fire
Just won't die
Fire on fire...",Fire On Fire,Pass It On Down,1990,12,4:00,Track '8',Album,False
