,Rank,Artist,Lyrics,Title,album_name,release_date,total_tracks,duration,track_number,album_single,chart
349,N/A,Oak Ridge Boys,"We catch our memories wandering through the past from time to time
As a mountain families' music fills again inside our mind
We dream about Euganean Hills and West Virginian land
And an old time family blue grass band.

Our God fearing mum and daddy raised us young 'uns on a song
By the banks where old new river gently sways and rolled along
Where once upon a time there dwelled a close knit mountain clan
An old time family blue grass band.

You never heard the like of melodies our family played
The guitar kept the rhythm as the fiddle sawed away
We recall a banjo ringing and a singing mandolin
In an old time family blue grass band.

Daddy slapped the upright, mamma strummed the other part
We couldn't read the music we just played it all by heart
Lord how those songs just flowed across that fertile mountain land
In an old time family blue grass band.

I see us sitting round the porch on starry summer nights
I remember how the music made my world seem good and right
When all the folks would raise their happy voices and join in
With the old time family blue grass band.

You never heard the like of melodies our family played
The guitar kept the rhythm as the fiddle sawed away
We recall a banjo ringing and a singing mandolin
In an old time family blue grass band.
Yes an old time family blue grass band.",An Old Time Family Bluegrass Band,Y'All Come Back Saloon,1977,10,3:36,Track 'A3',Album,False
350,N/A,Oak Ridge Boys,"She sits there on her front porch every day at 4 o'clock
Waving at the traffic that runs up and down the block
Her face and hands are wrinkled and her grey hair almost shines
Over 50 years have come and gone since she was in her prime.

A high school girl in blue jeans stops each Thursday afternoon
They talk about life and love and phases of the moon
She lets the girl try on her gown she's kept for all these years
She talks about when she was young, her old eyes filled with tears.

Didn't she really thrill them back in 1924
Young men fell in love with her
When she came through the door
Every dance was taken
Still they'd ask for just one more
Oh she stole their hearts away in 1924

She holds a photo album as she rocks there in her chair
Here's the men she almost married - they all look so debonair
She remembers all the faces and the night each one proposed
It makes her feel so young again as her old eyes slowly close.

The papers never said much when the old maid passed away
For the man who drove the moving-van it was just another day
The florist never understood when the young girl left the store
Just why she sent a wreath that said from the class of '24.

Didn't she really thrill them back in 1924
Young men fell in love with her
When she came through the door
Every dance was taken
Still they'd ask for just one more
Oh she stole their hearts away in 1924.

Didn't she really thrill them back in 1924
Young men fell in love with her
When she came through the door
Every dance was taken
Still they'd ask for just one more
Oh she stole their hearts away in 1924.",Didn't She Really Thrill Them (Back In 1924),Y'All Come Back Saloon,1977,10,2:44,Track 'A4',Album,False
351,N/A,Oak Ridge Boys,"Give me that old time lovin'
Like we was in love again-in
Yes that old time lovin'
Make it never ending
Give me that old time, good time lovin' we once knew
I want that old time love again with you.

Love was sweet, love was ripe
We'd rush home every night
Life was like a flower in full bloom
Little house, no one cared
There were good times to be shared
Even though the place just had three rooms
And there was hardly a whole night that we slept through
How I want that old time love again with you.

Give me that old time lovin'
Like we was in love again-in
Yes that old time lovin'
Make it never ending
Give me that old time, good time lovin' we once knew
I want that old time love again with you.

Times were hard but we had fun
When the old car wouldn't run
We thought of better things to do
Love was sweet, love was ripe
Let's bring it back tonight
Let's make that old time lovin' seem brand new
It's the only kind of lovin' that will do
How I want that old time love again with you.

Give me that old time lovin'
Like we was in love again-in
Yes that old time lovin'
Make it never ending
Give me that old time, good time lovin' we once knew
I want that old time love again with you.

Give me that old time lovin'
Like we was in love again-in
Yes that old time lovin'
Make it never ending
Give me that old time, good time lovin' we once knew
I want that old time love again with you.

Give me that old time lovin'
Like we was in love again-in
Yes that old time lovin'
Make it never ending
Give me that old time, good time lovin' we once knew
I want that old time love again with you.",Old Time Lovin',Y'All Come Back Saloon,1977,10,3:23,Track 'A5',Album,False
352,N/A,Oak Ridge Boys,"They'd all called her Freckles when summer was coming around
All the kids that were running and laughing and some turned to brown.
And I'd find her crying and hurt by the words that they said
And follow her home just trying to be her friend.

And I'd say Freckles you're pretty,
There's a rainbow on your face.
Do you want to know a secret?
None of them could take your place
Cause your different and special
And she'd hold my hand and sigh
And say I always want to see me through your eyes.

But summers just turned into winters and then into years
And slowly the smile of a woman replaced all her tears,
And some how I knew in a while that my friend would be gone
As I watched a sad ugly duckling turn into a swan.

And I said Freckles you're special
And she'd hold my hold and sigh
And say I always want to see me through your eyes.

But soon she was flying, dancing laughing and proud
And I took my place, a face alone in a crowd.
Knowing her lovers can't see past her smooth golden skin
And that's how I know that Freckles will come back again.

And I'll say Freckles I love you
There's a rainbow on your face.
'Cause she'll be smiling through her teardrops
As she runs to my embrace.
Freckles you're special
And she'll take my hand and sigh
And say I only want to see me through your eyes.
And I'll say Freckles I love you
There's a rainbow on your face
'Cause she'll be smiling through",Freckles,Y'All Come Back Saloon,1977,10,2:45,Track 'B1',Album,False
353,N/A,Oak Ridge Boys,"There is a time I have looked in the water
And had no reflection to show
And there is a time I have stood at the crossroads
Not knowing which way to go

There is a time someone laid close beside me
And I don't remember her name
The'll say that I'm just a smile and a moment
But that was before you came

You're the one in a million
You're the one, you're the one
You're the one in a million I see
You're the one in a million
You're the one, you're the one
You're the one in a million for me

Now all of the others were places to go to
When I had no where to sleep
Well, I never made any promises to them
None they'd expect me to keep

You're the one in a million
You're the one, you're the one
You're the one in a million I see
You're the one in a million
You're the one, you're the one
You're the one in a million for me

Well, You're the one in a million
You're the one, you're the one
You're the one in a million I see
You're the one in a million
You're the one, you're the one
You're the one in a million for me

You're the one in a million
You're the one, you're the one
You're the one in a million I see
You're the one in a million
You're the one, you're the one
You're the one in a million for me",You're The One,Y'All Come Back Saloon,1977,10,3:27,Track 'B2',Album,False
354,N/A,Oak Ridge Boys,"Let me be the one you come to
When you need someone to run to
When you're tired I'll try to undo
Everything the world has done to you.
And let me be the one you call on
When your good time friends are all gone
When you need someone to fall on
Won't you let me be the one?

Right now you long to roam
All I can say is girl be gone
'Cause I ain't gonna hold you to
Nothing you don't want me to
But should you awake some morning
Find yourself alone and longing
Reach out for that telephone
And let me be the one.

Let me be the one you come to
When you need someone to run to
When you're tired I'll try to undo
Everything the world has done to you.
And let me be the one you call on
When your good time friends are all gone
When you need someone to fall on honey
Let me be the one.

World's right there at your reach
You want it all and not just me
So your over, keep in mind
That I'll be here come harvest time.
Standing at the end of your warrow
With a heart full of love and a welcome home
You'll never have to be alone
If you'll let me be the one.

Baby won't you let me be the one you come to
When you need someone to run to
Ah when you're tired I'll try to undo
Everything the world has done to you.
And let me be the one you call on
When your good time friends are all gone
Oh when you need someone to fall on
Won't you let me be the one?
Baby when you need someone to fall on
Won't you let me be the one?",Let Me Be The One,Y'All Come Back Saloon,1977,10,2:54,Track 'B3',Album,False
355,N/A,Oak Ridge Boys,"All the boys called her Easy
Took her to drive-in movies
And bragged about the good times they had
The girls talked about her
And had parties without her
And wondered why a girl would let herself go so bad

They called her Easy, Easy
And laughed about how easy she was
They called her Easy, Easy
They said she was easy to love

They didn't care if she was lonely
They didn't care if she was only reaching out
The only way she could
They didn't try to understand her
And this small town talk branded her
With names that said she wasn't any good

They called her Easy, Easy
And laughed about how easy she was
They called her Easy, Easy
They said she was easy to love

Easy's child came early
It seemed in such a hurry
For one who'd go through life without a name
Easy's eyes were brighter
Than the moonlight on the water
When they handed her the child no one would claim

My friends thought I was crazy
To love Easy and her baby
They said I was a fool, but I just smiled
'Cause love is what you make it
Any way you finally take it
It's the only thing that makes life worthwhile

Now she's Easy, she's Easy
And life is not as lonely as it was
Because she's Easy, she's Easy
She's so easy to love
Now she's Easy, she's Easy
And life is not as lonely as it was",Easy,Y'All Come Back Saloon,1977,10,3:27,Track 'B4',Album,False
356,N/A,Oak Ridge Boys,"Oh ho, Emmylou. Emmylou,
What in the world can I do?
Spend my life just trying to get close to you
Heaven is a girl named Emmylou.

Trailed you out to Houston
To a hotel downtown,
Followed you down the corridor
But you never turned around.
But one of your big old bodyguards
Suggested that I leave
He didn't seem to appreciate
The patch upon my sleeve.
That read
Oh. ho, Emmylou. Emmylou,
Just a fan who's in love with you.
Spend most of my time trying to talk to you
Heaven is a girl named Emmylou.

I heard you went to LA
So I hitched myself a ride
California dreaming of me
Right there by your side.
Out at the Palomino Club
I watched you all night long
Until you looked right at me
In the words of your last song.
I asked you for your guitar pick
That's all that I could say
Then the limo did appear
And took the queen away.

Oh ho, Emmylou. Emmylou,
What in the world can I do?
Spend my life just trying to get close to you
Heaven is a girl named Emmylou.
Well I love Olivia's eyes
And Ronstadt's really nice
But heaven is a girl named Emmylou.",Emmylou,Y'All Come Back Saloon,1977,10,3:46,Track 'B5',Album,False
357,N/A,Larry Gatlin,"Tomorrow, I might be just a memory
But you'll still be the rest of my life
Through all the good and bad
Through all we've had, and have never had
You have been my lighthouse in the storm
Sometimes we've had some rain
But always, the flowers came
And we've always had more roses than thorns

Tomorrow, I might be just a memory
If you decide to leave me in the night
Tomorrow, I might be just a memory
But you'll still be the rest of my life",Tomorrow,Love Is Just A Game,1977,11,3:30,Track 'A2',Album,False
358,N/A,Larry Gatlin,"Anything but leavin', Anything but leavin'
Anything but leavin', lovin' man

Let me be your be your pillow
When your head is filled with pain
Let me your umbrella
When your life is filled with rain
Let me be the one you turn to, when the world turns on you
And no one understands
Let me be your any time, any place, anythin' you need
You anything but leavin', lovin' man

When you're right, and everybody points at you and says you're wrong
They tell you that you're wrong
And in the night, when you search your soul for melodies
And find that your soul has lost its song
And when the hounds of the whole wide world are biting at your heart
And there's no one to help fight them away
Remember me,'cause all I've got to say

I will be your pillow
When your head is filled with pain
I'll be your umbrella
When your life is filled with rain
I will be be the one you turn to, when the world turns on you
And no one understands
I will be your any time, any place, anythin' you need
Anythin' but leavin', lovin' man",Anything But Leavin',Love Is Just A Game,1977,11,2:32,Track 'A3',Album,False
359,N/A,Larry Gatlin,"How do I look leaving
It must be welded into your mind
And If practice makes perfect
Then I'm leaving you perfect this time

Over and over and over again
I have tried to do right by you
But over and over the things I do
Just prove to be over and over untrue

But I'll take blame and I'll bear the shame
It's not your fault, no darling, it's mine
And if practice makes perfect
Then I'm leaving you perfect this time

So how do I look leaving
It must be welded into your mind
And If practice makes perfect
Then I'm leaving you perfect this time

And If practice makes perfect
Then I'm leaving you perfect this time",If Practice Makes Perfect,Love Is Just A Game,1977,11,2:44,Track 'A4',Album,False
360,N/A,Larry Gatlin,"Everytime a plane flies over our house
Daddy's baby starts to cry
Cause airplanes, and fast movin' trains
Mean that I'm sayin' goodbye

This mornin' my lady and my baby
Took me to the airport, to catch flight 109
And daddy's baby started cryin'
Long before I ever even reached the ticket line
And tonight when I'm standin' in that spotlight in Chicago
There ain't gonna be much light at home
Cause the lover of the lady, and the daddy of the baby
Has left them back in Nashville all alone

And every time a plane flies over our house
Daddy's baby starts to cry
Cause airplanes, and fast movin' trains
Mean that I'm sayin' goodbye

She's just now old enough to understand the things she's seein'
With her baby blue eyes
And every time a plane flies over our house
Daddy's baby starts to cry

Yeah every time a plane flies over our house
Daddy's baby starts to cry",Everytime A Plane Flies Over Our House,Love Is Just A Game,1977,11,3:27,Track 'A5',Album,False
361,N/A,Larry Gatlin,"I did (I did, I did) not mean to mislead you
And I never intended, that push come to shove
And I don't (I don't, I don't) have one against you
I just wish you were someone I love

I thought I had fallen forever in love
The minute your red gingham dress hit the floor
But after Id taken of all of your favors
The hungry inside of me cried out there's more

And don't misunderstand me, it's not that you're lacking
The fact is your beauty's what dreams are made of
I do not have one thing against you, sweet lady
I just wish you were someone I love

I did (I did, I did) not mean to mislead you
And I never intended, that push come to shove
And I don't (I don't, I don't) have one against you
I just wish you were someone I love

I did (I did, I did) not mean to mislead you
And I never intended, that push come to shove",I Just Wish You Were Someone I Love,Love Is Just A Game,1977,11,2:59,Track 'B1',Album,False
362,N/A,Larry Gatlin,,Kiss It All Goodbye,Love Is Just A Game,1977,11,3:10,Track 'B2',Album,False
363,N/A,Larry Gatlin,"I don't wanna cry
This early, this morning
But cry I will if you go through
With leaving me alone
I don't wanna cry
This early, this morning
So lay back down and love me
And leave the leavin' till later on

I don't want to think about tomorrow
Lord knows, I've got my hands full
Just worrying about today
And if it's true that God sees
Every sparrow when it falls
Then I hope you'll see me falling
If you up and walk away

'Cause I don't wanna cry
This early, this morning
But cry I will, if you go through
With leaving me alone
I don't wanna cry
This early, this morning
So lay back down and love me
And leave the leavin' till later on

So lay back down and love me
And leave the leavin' till later on

I don't wanna cry...",I Don't Wanna Cry,Love Is Just A Game,1977,11,2:41,Track 'B3',Album,False
364,N/A,Larry Gatlin,,It's Love At Last,Love Is Just A Game,1977,11,2:46,Track 'B4',Album,False
365,N/A,Larry Gatlin,,Steps,Love Is Just A Game,1977,11,2:56,Track 'B5',Album,False
366,N/A,Larry Gatlin,,Alleluia,Love Is Just A Game,1977,11,3:03,Track 'B6',Album,False
367,N/A,Donna Fargo,"Shine on me sunshine
Walk with me world
It's a skip-a-dee-doo-dah day
I'm the happiest girl in the whole U.S.A.

Good morning, morning
Hello, sunshine
Wake up, sleepy head
Why'd we move that bojangle clock so far away from the bed
Just one more minute
That's why we moved it
One more hug will do
Do you love waking up next to me
As much as I love waking up next to you?

You make the coffee
I'll make the bed
I'll fix your lunch
And you fix mine
Now tell me the truth
Do these old shoes look funny
Honey it's almost nine
Now you be careful
Gotta go I love you
You have a beautiful day
And kiss the happiest girl in the whole U.S.A.

Skip-a-dee-doo-dah
Thank you, oh Lord, for making him for me
And thank you for letting life turn out the way
That I always thought it could be
There once was a time when I could not imagine
How it would feel to say
I'm happiest girl in the whole U.S.A.

Now shine on me, sunshine
Walk with me world
It's a skip-a-dee-doo-dah day
I'm the happiest girl in the whole U.S.A.

Shine on me, sunshine
Walk with me world
It's a skip-a-dee-doo-dah day
I'm the happiest girl in the whole U.S.A.

Shine on me sunshine
Walk with me world
It's a skip-a-dee-doo-dah day
I'm the happiest girl in the whole U.S.A.",The Happiest Girl In The Whole U.S.A.,The Best Of Donna Fargo,1977,12,3:06,Track 'A2',Single,False
368,N/A,Donna Fargo,,You Can't Be A Beacon (If Your Light Don't Shine),The Best Of Donna Fargo,1977,12,2:29,Track 'A3',Single,False
369,N/A,Donna Fargo,"Funny Face, I love you
Funny Face, I need you
My whole worlds wrapped up in you

When the road I walk seems all up hill
And the colors in my rainbow turn blue
You kiss the tears away
You smile at me and say
Funny Face, Funny face I love you

Funny Face, I love you
Funny Face, I need you
These are the sweetest words I've ever heard
Funny Face, don't leave me
Funny Face, believe me
My whole worlds wrapped up in you.

And when I hurt your feelings as I sometimes do
And I say those mean things that we know are not true
You forgive my childish ways
You hold me close and say
Funny Face, Funny Face I love you

Funny Face, I love you
Funny Face, I need you
These are the sweetest words I've ever heard
Funny Face, don't leave me
Funny Face, believe me
My whole worlds wrapped up in you

Funny Face, I love you
Funny Face, I need you
These are the sweetest words I've ever heard
Funny Face, don't leave me
Funny Face, believe me
My whole worlds wrapped up in you",Funny Face,The Best Of Donna Fargo,1977,12,3:15,Track 'A4',Single,False
370,N/A,Donna Fargo,,How Close You Come (To Being Gone),The Best Of Donna Fargo,1977,12,2:46,Track 'A5',Single,False
371,N/A,Donna Fargo,"I'm kickin' my heel together free again I feel like me again
I know without a doubt I'm in love love love
And I don't have to make believe or feed a guilty conscience
Love set me free and it do feel good

I just went through this painful thing of questions without answers
Kept comin' back with nothin' for the longest time
My heart kept racing with my conscience and claiming all my daydreames
Wait out in front of my mind
And that awful gnawing feeling like you're gonna die from hunger
You don't find out where you're going and how to get there
But now it's worth all that confusion 'cause I found me an answer
And I know love is alive again within me
I'm kickin' my heel together...

I've finally figured out how yesterdays fit into tomorrows
And I've learned that little doubts are just unfinished dreams
And I guess I'll keep on learning the same lessens all over
And nothing is as bad as it seems
And I've just got to accept the fact that I have to accept the fact
That love goes through changes just like we do
And an occasional distraction a little quiet a little action
And a whole lot of patience will make it grow
I'm kickin' my heel together...
I'm kickin' my heel together...
I'm kickin' my heel together...",It Do Feel Good,The Best Of Donna Fargo,1977,12,3:12,Track 'A6',Single,False
372,N/A,Donna Fargo,,A Song I Can Sing,The Best Of Donna Fargo,1977,12,2:35,Track 'B1',Single,False
373,N/A,Donna Fargo,"Superman, Superman, Superman

And there you go pickin' on me again
Pushin me to the very end
Tellin' me to move another mountain
Well just cause you can walk on water
That ain't no sign I can
You know your mama should have named you Superman

Superman, Superman, Superman

Now lets go through this one more time
You do your thing and I'll do mine
Well honey baby we got to draw the line
Cause your hangup is a messin with mine
All I can do is the best I can to change the way
That you can't stand
And if it ain't good enough for superman
He ain't good enough for me...

Superman, Superman, Superman

So you don't have to rub it in
Just cause your right and I'm wrong again
Sometimes right is just as wrong as wrong is
And I ain't never gonna learn to make it rain
And I wouldn't if I could for all the wool in Spain
So you go right ahead and do it, do it Superman

Superman, Superman, Superman

Now lets go through this one more time
You do your thing and I'll do mine
Well honey baby we got to draw the line
Cause your hangup is a messin with mine
All I can do is the best I can to change the way
That you can't stand
And if it ain't good enough for superman
He ain't good enough for me...",Superman,The Best Of Donna Fargo,1977,12,3:06,Track 'B2',Single,False
374,N/A,Donna Fargo,"Can't remember my first mem'ry of you you were always there
And now I know I never knew you well
But I was just a kid and you were always there to pick me up every time I fell
And you always warmed a blanket to wrap around my feet
When you tucked me into bed to say my prayers
And I'll bet I never thanked you among all the other things
That I took for granted cause you were always there
Yes you were always there so we never took the time
For you to tell me your dreams and me to tell you mine
And we never took the time to talk of love and happiness
And life and death and heartache and pain and loneliness

Why I don't even know if you were happy or if you could have been
Or if you could have one wish what would it be
Or what would you do differently if you could live again
And were you glad that you gave life to me
And I'd give anything to tell you am I glad that you were born
But you'll never hear the words I've learned to say
Cause before I got to know you died of loneliness
And they tell me I grew up and moved away
Yes you were always there so we never took the time
For you to tell me your dreams and me to tell you mine
There were so many things that could have been but now we'll never share
Cause kids don't know much and you were always there
No kids don't know much and you were always there",You Were Always There,The Best Of Donna Fargo,1977,12,2:25,Track 'B3',Single,False
375,N/A,Donna Fargo,"When I saw you standing there I bout fell out of my chair
And when you moved your mouth to speak I felt the blood go to my feet
Now it took time for me to know what you tried so not to show
Something in my soul just cries I see the want in your blue eyes
Baby I'd love you to want me the way that I want you the way that it should be
Baby you'd love me to want you the way that I want to if you'd only let it be

You told yourself years ago you'd never let your feelings show
The obligation that you made for the title that they gave
Baby I'd love you to want me...
Baby I'd love you to want me...",I'd Love You To Want Me,The Best Of Donna Fargo,1977,12,3:16,Track 'B4',Single,False
