,Rank,Artist,Lyrics,Title,album_name,release_date,total_tracks,duration,track_number,album_single,chart
277,N/A,Restless Heart,"When somebody loves you
The whole world just disappears
You don't have to hid the pain
You don't have to count the tears
There is a reason for everything you do
When somebody loves you
When somebody loves you

When somebody needs you
More than you need yourself
If you get that feelin'
You don't need nothin' else
And if I could hold you
I know you'd feel it too
When somebody needs you
When somebody needs you

I hope that I have a real good chance
I wanna be there when you fall in love

When somebody wants you
You can see it in their eyes
So how can you look at me
And not even realize
Baby, there's nothing my poor heart wouldn't do
Somebody loves you, baby
Somebody loves you

And if I could hold you
I know you'd feel it too
Somebody loves you, baby
Somebody loves you...",When Somebody Loves You,Fast Movin' Train,1990,9,3:07,Track 'B2',Album,False
278,N/A,Restless Heart,"High-heel shoes and a short, tight skirt
All eyes are glued on her
She's throwin' boxcar numbers
All night long
They're buyin' her drinks, shakin' the dice
Just tryin' to catch her eye
Her smile is magic
But it don't last long

Oh Lady Luck
Casting fortune to the wind
Come stand beside me
While that wheel turns 'round again
Yeah, Lady Luck
Let the chips fall where they may
Oh, Lady Luck, so glad you passed my way

If you never give up and never give in
She might just let you win
But don't try to keep her
From her next appointed round
'Cause if you try to hold on just a little too long
She may just do you wrong
Pray she stays long enough
To lay your money down

Shine on me
I'm gonna let it ride
Roll up the numbers
Takin' one more chance, snake eyes",Lady Luck,Fast Movin' Train,1990,9,3:37,Track 'B3',Album,False
279,N/A,Restless Heart,"There's a highway that runs right through this town
Just a stream of light when the sun goes down
She'd look out the window to the west
One day this note was all she left
Right now you don't see, but you're just like me

River of stone, wild and lonely
Can you show me what lies beyond
Take me where they don't know me
By tomorrow morning I'll be gone

This old town is way too small
You've seen one face, you've seen 'em all
The only way things will ever change
Is to set your feet on the outbound lane
Oh how did she know one day I would follow?

Some got to move, some just stand still
Some take their chances, some never will",River Of Stone,Fast Movin' Train,1990,9,2:56,Track 'B4',Album,False
280,N/A,Lorrie Morgan,"I can't believe it's really me telling you goodbye
I've run out of reasons to defend your alibis
I can't go on pretending everything is still ok
Now I know the truth behind all the games you played
It wouldn't be so hard for me to turn my heart away
If I didn't love you

Looking back it's easy now for me to understand
Why you got so angry when I asked you where you'd been
You told me my suspicions were only jealousy
And you used the way I trusted you to make a fool of me
You closed my eyes to lies that I could never have believed
If I didn't love you

'Cause if I didn't love you
I'd walked away a long, long time ago
And if I didn't love you
I never would have let you hurt me so

Now the time has come for me to tell you that we're through
Leave this broken dream behind and go find someone new
And I could see that it would be an easy thing to do
If I didn't love you

'Cause if I didn't love you
I'd walked away a long, long time ago
And if I didn't love you
I never would have let you hurt me so

If I didn't love you (x3)",If I Didn't Love You,He Talks To Me,1990,2,3:27,Track 'B',Single,False
281,N/A,Patty Loveless,"Score is tied between us
In this lovin' game
I hear you say you're leavin'
But I think you will stay
I'm doing everything I can
To try and change your mind
'Cause baby we can leave it here
We're going on overtime

Going on overtime
Going on overtime
Going on overtime
Going on overtime
Going on overtime
Baby take leaving off your mind
We're going on overtime

Now both of us are winners
Our love just can't lose
Don't look for your hat
Don't look for your coat
And don't worry 'bout your shoes
Lay back here in my lovin' arms
Get leaving off your mind
Love just crossed the 50 yard line
We're going on overtime

Going on overtime
Going on overtime
Going on overtime
Going on overtime
Going on overtime
Baby take leaving off your mind
We're going on overtime

Stay with me baby
Stay with me a while
Stay with me baby
Say it with your smile

Going on overtime
Going on overtime
Going on overtime
Going on overtime
I'm gonna love you
Out of your mind
We're going on overtime

Oh baby take leaving off your mind
We're going on overtime",Overtime,On Down The Line,1990,10,2:48,Track 'A1',Album,False
282,N/A,Patty Loveless,"Sylvia was workin' as a waitress in Beaumont
She said I'm movin' away, I'm gonna get what I want
I'm tired of these small-town boys that don't move fast enough
I'm gonna find me one who wears a leather jacket and likes his livin' rough

So she saved her tips and overtime and bought an old rusty car
She sold most everything she had to make a brand new start
She said I won't be needing these silly dresses and nylon hose
'Cause when I get to where I'm goin' I'm gonna buy me all new clothes

The night's too long; It just drags on and on
And then there's never enough;
That's when the sun starts comin' up
Don't let go of her hand;
You just might be the right man
She loves the night; She loves the night
She doesn't want the night; don't want it to end
Don't want it to end.

She works in an office now and she guesses the pays all right
She can buy a few new things to wear and still go out at night
And as soon as she gets home from work she wants to be out with the crowd
Where she can dance and toss her hair back and laugh out loud

Well the music's playin' fast and they just met
He presses up against her and his shirt's all soaked with sweat
And with her back against the bar she can listen to the band
And she's holdin' a Corona and it's cold against her hand

The night's too long; It just drags on and on
And then there's never enough;
That's when the sun starts comin' up
Don't let go of her hand;
You just might be the right man
She loves the night; She loves the night
She doesn't want the night; don't want it to end
Don't want it to end.",The Night's Too Long,On Down The Line,1990,10,3:56,Track 'A2',Album,False
283,N/A,Patty Loveless,"When I close my eyes
I almost see
The way you look
When you were standing next to me
And I still feel you holdin' me tight
Oh I can hear the laughter
And all the words you whispered in the night

Picture this and paint it blue
A photograph of me and you
Smile has faded with the years
Washed away by all the tears
And when I look
All I see are blue memories

Oh how I remember the time
There was love in your heart
And that love was mine
If I could turn it all 'round again
We'd be lying side by side
And things would be the way
They were back then

Picture this and paint it blue
A photograph of me and you
Smile has faded with the years
Washed away by all the tears
And when I look
All I see are blue memories

Picture this and paint it blue
A photograph of me and you
Smile has faded with the years
Washed away by all the tears
And when I look
All I see are blue memories
Blue memories
Blue memories",Blue Memories,On Down The Line,1990,10,2:51,Track 'A3',Album,False
284,N/A,Patty Loveless,"The wind is cold,
I walk alone
My head is hanging low
The friend I find* within myself
Is the only one I know

The blossoms of the dogwood tree
Have fallen all away
And like our love they lay to rest
Beneath the red, red clay

Some morning soon before the dawn
I'll wake to find you gone
I'm learning how to lose you now
And how to carry on

Your love, your love has known no* fear*
Your heart can feel no pain
I know, I know you'll soon be gone
To ride that midnight train  

Some morning soon before the dawn
I'll wake to find* you gone
I'm learning how to lose* you now
And how to carry on

I'm learning how to lose* you now
And how to carry on.",Some Morning Soon,On Down The Line,1990,10,3:34,Track 'A4',Album,False
285,N/A,Patty Loveless,"When you said you love me
I believed it was true
It was true
And now you say you're leaving
Now you got me needing you
You go and say we're through
You say nothing last forever
That's so easy
You can walk away
But you won't be free

You can run every time we touch
You can run when you feel to much
You can lie all alone in the dark
You can run from the one you need
You can run from the memories
But you can't run away from your heart

Said our love was real
More than any love you knew
It was good to you
But when I held you near me
I could feel all the fear in you
Runnin' through and through
You think tears are all that lie in true loves shadow
There's no place that you can run
Our love won't follow

You can run every time we touch
You can run when you feel to much
You can lie all alone in the dark
You can run from the one you need
You can run from the memories
But you can't run away from your heart

You can run every time we touch
You can run when you feel to much
You can lie all alone in the dark
You can run from the one you need
You can run from the memories
But you can't run away from your heart

No you can't run away
From your heart",You Can't Run Away From Your Heart,On Down The Line,1990,10,3:54,Track 'A5',Album,False
286,N/A,Patty Loveless,"The bright lights don't thrill me like they used to do
They only remind me of times spent with you
And every old mem'ry rekindles the flame
I've got to stop loving you and start living again
The people all tell me with time I'll forget
The sweet love you gave me and they'll be no regrets
But each time I see you it's always the same
Oh I've got to stop loving you and start living again
I've got to stop dreaming about all the times
When you told me you loved me and would always be mine
And maybe one day find somebody new and start living over and stop loving you

The rain on my window flows down like tears
It seems to know that I'm lonesome in here
Oh I guess I should step out and see some old friends
I've got to stop loving you and start living again
Oh I've got to stop loving you and start living again",I've Got To Stop Loving You (And Start Living Again),On Down The Line,1990,10,3:08,Track 'B2',Album,False
287,N/A,Patty Loveless,"I wonder should I tell you
About all the crazy things
I've ever done
I've been a rebel all my life
And when I should have stayed
I tried to run
I was searching for an answer
In this world full of strangers
But what I found was never enough
Now that I found you
Looking in the eyes of love

Darlin' you've been good to me
You are so much more than I deserve
I never thought that I would find
Someone who's so sweet and kind
Like you
Please believe me
When I say
This time I won't run away
I swear by all of heavens stars above
Now that I found you
I'm looking in the eyes of love

Looking in the eyes of love
I can see forever
I can see you and me
Walking through this old world together
Oh my hearts found a home
I've been dreaming of
Now that I found you
I'm looking in the eyes of love

Oh my hearts found a home
I've been dreaming of
Now that I found you
I'm looking in the eyes of love

Now that I found you
Looking in the eyes of love",Looking In The Eyes Of Love,On Down The Line,1990,10,3:18,Track 'B3',Album,False
288,N/A,Patty Loveless,"There's a man in a Stetson hat, howlin' like an alley cat
Outside my window tonight
Sayin', ""Baby, put on something hot, meet me in the parking lot
About a quarter to nine""

I get the feelin' that he's never read Romeo and Juliet
I'm gettin' tired of these one night stands
But if you wanna make a real romance

I'm that kind of girl, I'm that kind of girl
I ain't the woman in red, I ain't the girl next door
But if somewhere in the middle's what you're lookin' for
I'm that kind of girl, I'm that kind of girl

Let me tell you that I like my lovin' just as much as any woman
But I'm drawin' the line
A little sensitivity always seems to get to me every time
I'm a sucker for a love-sick fool
The kind that carries all your books in school
I'm getting tired of these one night stands
But if you're lookin' for a real romance

I'm that kind of girl, I'm that kind of girl
I ain't the woman in red, I ain't the girl next door
But if somewhere in the middle's what you're lookin' for
I'm that kind of girl, I'm that kind of girl

I'm that kind of girl, I'm that kind of girl
I ain't the woman in red, I ain't the girl next door
But if somewhere in the middle's what you're lookin' for
I'm that kind of girl, I'm that kind of girl

I'm that kind of girl, oh whoa
I'm that kind of girl, oh whoa",I'm That Kind Of Girl,On Down The Line,1990,10,4:03,Track 'B4',Album,False
289,N/A,Patty Loveless,"I leave you with something
You can't understand
You can't buy or sell it
Or hold it in your hands
It's greater than this world of ours
Or the heavens above
I leave you with feelings of love

It's as free as the wild wind
As gentle as a lamb
It fills the angels with envy
It's givin' free to man
Gives courage to the lion
Peace to the dove
I leave you with feelings of love

Feelings of love
Are what make my love real
Feelings of love
Are the best things to feel
You gave it to me freely
Now I leave it with you
I leave you my feelings of love

It gives man to a woman
Gives a woman to her man
It makes friends out of enemy's
It makes our hearts join hands
You gave it to me freely
Now I leave it with you
I leave you my feelings of love",Feelings Of Love,On Down The Line,1990,10,3:05,Track 'B5',Album,False
290,N/A,Shenandoah,,She's Still Here,Ghost In This House / She's Still Here,1990,2,3:36,Track 'B',Single,False
291,N/A,Steve Wariner,"Every time I thought love was a friend
Something made me back away
Before I'd get myself in trouble like that
I'd always just played it safe

But tonight there is something different
I'm gonna take the dare
Come right out and say it's love
So you can know how much I care

Do you want to make something of it
Do you want to cross that line
Both of us could all our long and lonely nights behind
I believe a love like this can stand the test of time
If you wanna make something of it
Well, so do I

I'm finding out that it's true what they say
Confession is good for the soul
I bet my heart would find it hell to pay
If I ever let you go

I believe that the future holds
Life we were meant to share
I can't go this dream alone
It takes two to make it there

Do you want to make something of it
Do you want to cross that line
Both of us could all our long and lonely nights behind
I believe a love like this can stand the test of time
If you wanna make something of it
Well, so do I
If you wanna make something of it
Well, so do I",Do You Want To Make Something Of It,When I Could Come Home To You,1989,2,3:45,Track 'B',Single,False
292,N/A,Waylon Jennings,"When I noticed her the first time
I was outside running barefoot in the rain
She lived in the house next door
And her nose was pressed against the window pane

When she looked at me
She smiled and showed a place where two teeth used to be
And I heard her ask her mom
If she could come outside and play with me

We became as one and
Had a love without beginning or an end
And every day she lived with me
Was like a new day dawning once again

And I've loved her since
Every doll was Shirley Temple
Soda pop was still a nickel
Jam was on her fingertips
Milk was circled on her lips

After many years our love grew silent
And at night I heard her cry
When she left me in the fall
I knew that it would be our last goodbye

I was man enough to give her everything
She needed for a while
But in searching for a perfect love
I found that I could not give her a child",The Days Of Sand And Shovels,The Best Of Waylon Jennings,1970,10,2:16,Track 'A1',Single,False
293,N/A,Waylon Jennings,,MacArthur Park,The Best Of Waylon Jennings,1970,10,5:04,Track 'A2',Single,False
294,N/A,Waylon Jennings,"Delia wo oh oh oh Delia
Where have you been so long
Everybody's talking about Delia
They say she's done me wrong

They took my Delia to the graveyard
Took her in a long black hearse
If I hadn't a shot my poor Delia
I believe she'd a got me first

Delia's gone

I went down to the graveyard
To look at my Delias face
I said Delia girl how I loved you
How I wish I could take your place

Jailer oh Jailer
Tell me how can I sleep
When all around my bed side
I hear little Delias feet

Delia's gone

Some gave Delia a dollar
Some gave her two or three
But I didn't give Delia a penny
'Cause she belonged to me

Delia's gone Delia's gone",Delia's Gone,The Best Of Waylon Jennings,1970,10,3:20,Track 'A3',Single,False
295,N/A,Waylon Jennings,"I hear the echo of your footsteps
They're right in step with marching time
Since you've walked out of my life and out of my world Please walk on out of my mind.

I know you're hidin' there in the darkness
And it's got me running scared and blind
Since you've walked out of my life out of my world
Please walk on out of my mind.

You've got footprints all over my mem'ries
I must erase them if I can
You keep stumbling through my hopes and dreams
Kickin' around my future plans.

You've got me walking round in circles
Looking for something I'll never find
Since you've walked out of my life and out of my world Please walk on out of my mind...",Walk On Out Of My Mind,The Best Of Waylon Jennings,1970,10,2:19,Track 'A4',Single,False
296,N/A,Waylon Jennings,"Anita, come closer
Stop crying and listen to me
I guess it's too late now
But somehow I must make you see.
What we thought was our world
Was only a dream world
And we just can't go on like this
Anita, you're dreaming
Of a world that can never exist.

Anita, it's over
There's nothing that's left now to say
Anita, you're dreaming
And I know it's better this way.

Anita, come closer
And close your pretty blue eyes
Your young dreams just can't be
And somehow you must realize.
And each time you're with me
My conscience reminds me
Of someone who's waiting alone
Anita, you're dreaming
And when you awake, I'll be gone.

Anita it's over
There's nothing that's left now to say
Anita, you're dreaming
And I know it's better this way...","Anita, You're Dreaming",The Best Of Waylon Jennings,1970,10,2:25,Track 'A5',Single,False
297,N/A,Waylon Jennings,"Everybody knows you've been steppin' on my toes
And I'm gettin' pretty tired of it
You keep a steppin' out of line 
You're messin' with my mind
If you had any sense you'd quit

'Cause ever since you were a little bitty teeny girl
You said I was the only man in this whole world
Now you better do some thinkin' then you'll find
You got the only daddy that'll walk the line

I keep a workin' every day all you want to is play
I'm tired of stayin' out all night
I'm comin' unglued 
From your funny little moods
Now Honey baby that ain't right

'Cause ever since you were a little bitty teeny girl
You said I was the only man in this whole world
Now you better do some thinkin' then you'll find
You got the only daddy that'll walk the line

You keep a packin' up my clothes nearly everybody knows
That you're still just a puttin' me on
But when I start a walkin' 
Gonna hear you start a squawkin'
And beggin' me to come back home

'Cause ever since you were a little bitty teeny girl
You said I was the only man in this whole world
Now you better do some thinkin' then you'll find
You got the only daddy that'll walk the line

You got the only daddy that'll walk the line",Only Daddy That'll Walk The Line,The Best Of Waylon Jennings,1970,10,2:19,Track 'B1',Single,False
298,N/A,Waylon Jennings,"Someone's gonna get hurt before you're through
Someone's gonna pay for the things you do
How many hearts must break how many it's gonna take
To satisfy you just to satisfy you.

Another love another fool to play your game
Another love another fool they're all the same
Someone's gonna get hurt before you're through
Someone's gonna pay for the things you do.

You're gonna find when it's too late
Heart that just won't break
Just to satisfy you
Just to satisfy you.

How many hearts must break
How many will it take
To satisfy you
Just to satisfy you.

Just to satisfy you
Satisfy you
Just to satisfy you.

Someone's gonna get hurt before you're through
Someone's gonna pay for the things you do
You're gonna find when it's too late
Heart that just won't break.

Just to satisfy you.
Just to satisfy you.
Just to satisfy you.
Satisfy you.
Just to satisfy you...",Just To Satisfy You,The Best Of Waylon Jennings,1970,10,2:15,Track 'B2',Single,False
299,N/A,Waylon Jennings,"Something's wrong in California, I can tell by the letter she don't write
Gotta get back to California, something's just not right in California
I'm stranded in ole New York City, ain't got a nickel to my name
Make my way to California, just the same to California.

Haven't heard from her since late last December
I'm so afraid she's forgot to remember to love me
Should have left her in California, that's a foolish thing to do
Something wrong in California, is she still true in California?

I said I'm sinned for her when I made it
I ain't made it and deep inside I'm afraid of this is all over
Something's wrong in California, I can tell by the letter she don't write
Gotta get back to California, something's just not right in California...",Something's Wrong In California,The Best Of Waylon Jennings,1970,10,2:36,Track 'B4',Single,False
300,N/A,Waylon Jennings,"You've painted up your lips and rolled and curled your tinted hair
Ruby, are you contemplating going out somewhere
The shadows on the wall tell me the sun is going down
Oh, Ruby don't take your love to town.

It wasn't me that started that old crazy Asian war
But I was proud to go and do my patriotic chores
I know Ruby, that I'm not the man I used to be
But Ruby, I still need your company.

It's hard to love a man whose legs are bent and paralized
And the wants and the needs of a woman your age Ruby I realize
But I've heard them say it won't be long until I'm not around
Oh Ruby, don't take your love to town.

She's leaving now for I just heard the slammin' of the door
The way I know I've heard it slam a hundred times before
If I could move I'd get my gun and put her in the ground
Oh Ruby, don't take your love to town...","Ruby, Don't Take Your Love To Town",The Best Of Waylon Jennings,1970,10,2:30,Track 'B5',Single,False
301,N/A,Baillie and The Boys,,So Strong,Fool Such As I,1990,2,2:59,Track 'B',Single,False
302,N/A,The Judds,"Maybe I'm wrong
Maybe I'm right
Maybe I just don't know
Will I ever fall in love
And never have to worry
That I'm fallin' all alone?
Maybe it's true
I was just born to be blue
Maybe it's true
I was just born to be blue

They say everybody's got a someone
A sweet somebody to love
It might be fate or destiny
May be written in the stars above
But I can't help but wonder
After all that I've been through
Maybe my baby's nowhere to be found
And I was just born to be blue

Was I born to be unhappy?
Just to live on heartache street
Was I born to go to bed each night
And cry myself to sleep?
Can somebody out there help me?
Give me some kind of clue
Tell me I'm wrong, tell me I'm right
But, don't tell me I was born to be blue

They say nobody dies from a heartache
You can't drown in your own tears
But who wants to live in this world alone
Where minutes turn into years?
So I'd rather go down believin'
Suffer a heartache or two
Tell me I'm wrong, tell me I'm right
But, don't tell me I was born to be blue

Was I born to be blue?
Born just to cry?
Born to be alone 'til the day I die?

Somebody tell me

Was I born to be loved?
Born to be kissed?
Born to find the one to show me what I missed?

Was I born to be blue?
Born just to cry?
Born to be alone 'til the day I die?

Tell me, Mama

Was I born to be loved?
Born to be kissed?
Born to find the one to show me what I missed?",Born To Be Blue,Love Can Build A Bridge,1990,9,4:50,Track 'A1',LP,False
303,N/A,The Judds,"Words and Music by Craig Bickhardt, Don Schlitz and Brent Maher

Ooh, ooh, ooh, ooh, ooh, ooh, ooh, ooh
You said I could call on you
If I was ever lonely
You swore you'd always be my friend
And now my heart is tired
And, oh, my soul is hungry
I need to talk to you again

Ooh, ooh, ooh, ooh, ooh, ooh, ooh, ooh
I can hear love callin' in the wind
Ooh, ooh, ooh, ooh, ooh, ooh, ooh, ooh
Open up my heart and let it in
Love's callin' in the wind

You said I may not see you
Standing there beside me
But you would be there just the same
Your hand upon my shoulder
Always there to guide me
All I had to do was call your name

(Repeat Chorus Twice)

I can hear love callin' in the wind
Ooh, ooh, ooh, ooh, ooh, ooh, ooh, ooh
Open up your heart and let it in
Love's callin' in the wind

Ooh, ooh, ooh, ooh, ooh, ooh, ooh, ooh",Calling In The Wind,Love Can Build A Bridge,1990,9,3:57,Track 'A2',LP,False
