,Rank,Artist,Lyrics,Title,album_name,release_date,total_tracks,duration,track_number,album_single,chart
82,83,Johnny Rodriguez,,I Couldn't Be Here Without You,The Greatest Hits Of Johnny Rodriguez,1975,14,2:40,Track 'A1',Single,True
83,84,Sonny James,,When Something Is Wrong With My Baby,Sonny James Sings When Something Is Wrong With My Baby,1976,10,2:59,Track 'A1',Album,True
84,85,John Conlee,,,,,,,,,
85,86,Dave & Sugar,,I'm Gonna Love You,I'm Gonna Love You / I'm Leavin' The Leavin' To You,1976,2,,Track 'A',Single,True
86,87,Mickey Gilley,"Well, lawdy, lawdy, lawdy Miss Clawdy
Gal, you sure are lookin' good to me
Well, now please don't excite me baby
I know it can't be me.

Well, I give you all of my money
But you just won't treat me right
You like to bowl every morning
Don't come home 'til late at night.

I'm gonna tell, tell my momma
Girl what you been doing to me
I'm gonna tell everybody
That I'm down in misery.

Well, lawdy, lawdy, lawdy Miss Clawdy
Gal, you sure are lookin' good to me
Well, now please don't excite me baby
I know it can't be me.

Well, I give you all of my money
But you just won't treat me right
You like to bowl every morning
Don't come home 'til late at night.

Well bye, bye, bye baby
Girl I won't be comin' no more
Goodye little darling
And down the road I go.

Well bye, bye, bye baby
Girl I won't be comin' no more
Goodye little darling
And down the road I go...",Lawdy Miss Clawdy,Lawdy Miss Clawdy,1976,2,2:19,Track 'A',Single,True
87,88,Jerry Lee Lewis,"Let's put it back together again

We had it once
Then watched it go to pieces
Just let it go and neither raised a hand

But I believe that you and I
Should give it one more try
So let's put it back together again

Let's put it back together
One more time
Let's find that love together
That once was yours and mine

We'll make it strong enough this time
That it won't ever end
Let's put it back together again

I know a lot of words were spoken darlin' as we parted
I'm sorry now for what I said back then
But I believe there's still a chance
Let's take it while we can
And let's put it back together again

Let's put it back together
One more time
Let's find that love together
That once was yours and mine

We'll make it strong enough this time
That it won't ever end
So let's put it back together again

Let's put it back together again
Let's try it one more time, baby",Let's Put It Back Together Again,Let's Put It Back Together Again,1976,2,3:16,Track 'A',Single,True
88,89,Dolly Parton,"It's all I can do to keep from falling in love with you 
All I can do to keep from letting it show 
Yeah it's all I can do to keep from falling in love with you 
All I can do to keep from telling you so 
I wasn't looking for love when I found you 
Just someone to be with and have a good time 
But I get these strange funny feelings around you 
When you're not with me, you're still on my mind 

And it's all I can do to keep from falling in love with you 
All I can do to keep from letting it show 
Yeah it's all I can do to keep from falling in love with you 
All I can do to keep from telling you so 

I had intended to wait for a long time 
I thought that love would just mess up my plans 
'Cause I had big plans for a bright shining future 
Could this be my future that's holding my hand 

And it's all I can do to keep from falling in love with you 
All I can do to keep from letting it show 
Yeah it's all I can do to keep from falling in love with you 
All I can do to keep from telling you so 

I need to tell you how I feel about you 
But I'm so afraid that you don't feel the same 
But if I don't tell you how I feel about you 
I just might lose you, can I take that chance 

And it's all I can do to keep from falling in love with you 
All I can do to keep from letting it show 
Yeah it's all I can do to keep from falling in love with you 
All I can do to keep from telling you so",All I Can Do,All I Can Do,1976,10,2:23,Track 'A1',Album,True
89,90,Tom Bresh,,Home Made Love,Home Made Love,1976,2,2:50,Track 'A',Single,True
90,91,Charlie Rich,"When you just give love
And never get love
You'd better let love depart

I know it's so and yet I know
I can't get you out of my heart

You made me leave my happy home
You took my love and now you're gone
Since I fell for you

Love brings such misery and pain
I know I'll never be the same
Since I fell for you

Well, it's too bad
And it's too sad
But I'm in love with you

Oh, oh, oh, you love me
Then you snub me
But what can I do
I'm still in love with you

I, I guess I'll never see the light
I get the blues most every night
Since I fell for you

Since I fell for you",Since I Fell For You,Since I Fell For You,1975,2,3:02,Track 'A',Single,True
91,92,T.G. Sheppard,,Motels And Memories,Motels And Memories,1976,10,,Track 'A1',Album,True
92,93,Mickey Gilley,,Overnight Sensation,Overnight Sensation,1975,10,,Track 'A1',Album,True
93,94,"Billy ""Crash"" Craddock","Walk softly when you walk by me cause my heart is still don't shake it up
Now that I've cried my love to sleep don't wake it up don't wake it up
Now that I've cried my love to sleep don't wake it up don't wake it up

If I seem distant and reserved when you need don't take the time to ask me why
'Cause it's bad enough that I've lost you
Don't make it rough just say hello and goodbye
Walk softly when you walk by me...

I fall apart each time I look in your eyes remembering things I should forget
My love's a spark but it could burst into flames 'cause I'm not over you yet
Walk softly when you walk by me...",Walk Softly,Walk Softly / She\,1976,2,3:02,Track 'A',Single,True
94,95,The Amazing Rhythm Aces,"Guess I knew it all along
I'd have to come back home
'Cause this living on the road
Only makes me tired and sore
Like a bird without a nest
Like a stranger in the night
And my soul cries out for rest
And the end is not in sight
Tastes like sweet magnolia wine
Honey dripping from your mouth
And that sweet little gal of mine
She's the finest in the south
Now the day's are gettin' longer
And the nights are gettin' colder
I just want to come back home
Lay my head down on your shoulder
Guess I knew it all along
I'd have to come back home
'Cause this living on the road
Only makes me tired and sore
Like a bird without a nest
Like a stranger in the night
And my soul cries out for rest
And the end is not in sight",The End Is Not In Sight (The Cowboy Tune),The End Is Not In Sight (The Cowboy Tune),1976,2,3:11,Track 'A',Single,True
95,96,Bill Anderson & Mary Lou Turner,"Two nights in the pourin' rain (in a motel in Dallas)
That's what made me love you (that's what made me love you)
Champagne in a dixie cup (you had a little and I had too much)
That's what made me love you that's what made me love you
There ain't no way that time can make a bad thing out of our love
In a hundred years I'll think back and I'll have the memory of
A box of candy and a wilted rose (wrinkled sheets and wrinkled clothes)
That's what made me love you that's what made me love you
Champagne in a dixie cup (you had a little) yeah you had too much
But that's what made me love you (that's what made me love you)
Two nights in the pourin' rain (in a motel in Dallas)
That's what made me love you that's what made me love you",That's What Made Me Love You,That's What Made Me Love You,1976,2,2:48,Track 'A',Single,True
96,97,Olivia Newton-John,"Unfortunately, we are not licensed to display the full lyrics for this song at the moment. Hopefully we will be able to in the future. Until then... how about a random page?",Don't Stop Believin',Don't Stop Believin',1976,10,3:37,Track 'A1',Album,True
97,98,Margo Smith,,Take My Breath Away,Take My Breath Away / When Where And Why,1976,2,2:49,Track 'A',Single,True
98,99,Crystal Gayle,"It's been a long time since you went away
I stop to think of you most every day
With all my heart I'm hoping you're okay
Guess who loves you, somebody loves you

I couldn't reach you by the U.S. mail
You didn't leave a very easy trail
I tried to telephone to no avail
Guess who loves you, somebody loves you
I do

I know the matter is the game I played
I'll never reach you any other way
So I send this one thought to you every day
Guess who loves you, somebody loves you
I do",Somebody Loves You,Somebody Loves You,1975,10,2:24,Track 'B1',Album,True
99,100,Wynn Stewart,"Heaven knows we've seen the storm clouds gather
And it looked just like our world was gonna end
Yes we've touched the thorns of life now we know better
And we're more in love now that we've ever been

After the storm comes the sunshine
The clouds are gone and the world is tame
Into each life there will be showers
But don't the world look brighter after the rain

The sweetest love is when we're back together
And it looked just like a second honeymoon
Yes we fought the storms of life now we know better
And the rain just helped to make the roses bloom

After the storm comes the sunshine...
Don't the world look brighter after the rain",After The Storm,After The Storm,1976,2,2:37,Track 'A',Single,True
100,N/A,Mary MacGregor,,I Just Want To Love You,Torn Between Two Lovers,1976,2,3:40,Track 'B',Single,False
101,N/A,Eagles,"What kind of love have you got?
You should be home, but you're not
A room full of noise and dangerous boys
Still makes you thirsty and hot
I heard about you and that man
There's just one thing I don't understand
You say he's a liar and he put out
Your fire
How come you still got his gun in your hand?
Victim of love, I see a broken heart
You got your stories to tell
Victim of love, it's such an easy part
And you know how to play it so well

Some people never come clean
I think you know what I mean
You're walkin' the wire, pain and desire
Looking for love in between

Tell me your secrets, I'll tell you mine
This ain't no time to be cool
And tell all your girlfriends
You ""been around the world"" friends
That talk is for losers and fools

Victim of love, I see a broken heart
I could be wrong, but I'm not
Victim of love, we're not so far apart
Show me, what kind of love have you got?

Victim of love, you're just a victim of love
I could be wrong, but I'm not
Victim of love, now you're a victim of love
What kind of love have you got?
What kind of love have you got?
What kind of love have you got?",Victim Of Love,New Kid In Town,1976,2,4:49,Track 'B',Single,False
102,N/A,Engelbert Humperdinck,"You know I can't smile without you
I can't smile without you
I can't laugh and I can't sing
I'm finding it hard to do anything

You see I feel sad when you're sad
I feel glad when you're glad
If you only knew what I'm going through
I just can't smile without you

You came along just like a song
And brighten my day
Who would have believed that
You were part of a dream
Now it all seems light years away

And now you know I can't smile without you
I can't smile without you
I can't laugh and I can't sing
I'm finding it hard to do anything

You see I feel sad when you're sad
I feel glad when you're glad
If you only knew what I'm going through
I just can't smile

Now some people say happiness takes
So very long to find
Well, I'm finding it hard
Leaving your love behind me

And you see I can't smile without you
I can't smile without you
I can't laugh and I can't sing
I'm finding it hard to do anything

You see I feel glad when you're glad
I feel sad when you're sad
If you only knew what I'm going through
I just can't smile without you",Can't Smile Without You,After The Lovin',1976,10,3:55,Track 'A2',Album,False
103,N/A,Engelbert Humperdinck,,Let's Remember The Good Times,After The Lovin',1976,10,3:26,Track 'A3',Album,False
104,N/A,Engelbert Humperdinck,,I Love Making Love To You,After The Lovin',1976,10,3:18,Track 'A4',Album,False
105,N/A,Engelbert Humperdinck,,This I Find Is Beautiful,After The Lovin',1976,10,3:54,Track 'A5',Album,False
106,N/A,Engelbert Humperdinck,"The day you walked into my life, I had nothing
But a cold, lonely feelin' inside
Now I've got love forgiving and a reason for living
And I've pushed all my sadness aside
Now a day without you is like a day without sunshine
A song without a melody
This is what you mean to me, oh baby
This is what you mean to me, I love you
This is what you mean to me
I'm so glad you're mine, you're mine, you're mine

Since you came, there's no problems
Cause your love's helped me solve them
The dark clouds have all disappeared
Where there used to be sadness
There's nothing but gladness
And a smile has replaced all my tears
Without you, I'd be just like
A child without Christmas
A bird without a song to sing
This is what you mean to me, oh baby
This is what you mean to me, I said I need you
This is what you mean to me
I'm so glad you're mine, you're mine, you're mine

Now a day without you
Is like a day without sunshine
A song without a melody
This is what you mean to me, oh baby
This is what you mean to me, I need you
This is what you mean to me, I've got love forgiving
(This is what you mean to me) and a reason for living
(This is what you mean to me) where there used to be sadness
(This is what you mean to me) there's nothing but gladness
(This is what you mean to me) yes, I'm so glad you're mine
All mine, all mine, all mine, all mine, mine, mine, baby
This is what you mean to me",This Is What You Mean To Me,After The Lovin',1976,10,3:02,Track 'B1',Album,False
107,N/A,Engelbert Humperdinck,,World Without Music,After The Lovin',1976,10,3:34,Track 'B2',Album,False
108,N/A,Engelbert Humperdinck,,Let Me Happen To You,After The Lovin',1976,10,3:52,Track 'B3',Album,False
109,N/A,Engelbert Humperdinck,"The day that you moved away
Life was so empty
All I had left was your memory
Memory, memory

Livin', it seems
What was left was a dream
A dream of the way
It used to be

But I can't live a dream
Anymore than I can live forever
Anymore than I can climb a mountain
To the sun
To the sun
To the sun

No I can't live a dream
Anymore than I can move a mountain
Anymore than I can live my life
Without you
Can't live, no
No I can't live

No, no
No, no
All of the things I done
Leaving me lonely
All of the nights
Of missing you only
Only!
Lonely!

I spend my time
With your face
On my mind
Just closing my eyes
Dreaming of you

But I can't live a dream
Anymore than I can live forever
Anymore than I can climb a mountain
To the sun
To the sun
To the sun
I can't live a dream
Anymore than I can live forever
Anymore than I can climb a mountain
To the sun
To the sun
To the sun

No I can't live a dream
Anymore than I can move a mountain
Anymore than I can live my life
Without you
Without you
Without you

No I can't live a dream
Anymore than I can live forever",I Can't Live A Dream,After The Lovin',1976,10,4:06,Track 'B4',Album,False
110,N/A,Engelbert Humperdinck,"Girl we made it to the top
We went so high we couldn't stop
We climbed the ladder leading us nowhere
Two of us together, building castles in the air-air-air

We spun so fast we couldn't tell
The gold ring from the carousel
How could we know the ride would turn out bad
Everything we wanted, was everything we had

I miss the hungry years, The once upon a time
The lovely long ago, We didn't have a dime
Those days of me and you, We lost along the way-ay-ay

How could I be so blind, Not to see the door-oor-oor
Closing on the world, I now hunger for
Looking through my tears-ears, I miss the hungry years

We shared our daydreams one by one
Making plans was so much fun
We set our goals and reached the highest star
Things that we were after, were much better from afar-ar-ar-ar

Here we stand just me and you
With everything and nothing too
It wasn't worth the price we had to pay
Honey, take me ho-ome, let's go back to yesterday-ay-ay

I miss the hungry years, The once upon a ti-ime
The lovely long ago, We didn't have a dime
Those days of me and you, We lost along the way-ay-ay

How could I be so bli-ind, Not to see the door
Closing on the world, I now hunger for
Looking through my tears-ears, I miss the hungry years
I miss the hungry years",The Hungry Years,After The Lovin',1976,10,4:27,Track 'B5',Album,False
111,N/A,Elvis Presley,"Oh just because I asked a friend about her
Just because I spoke her name somewhere
Just because I rang her number by mistake today
You know she thinks I, I still care

And just because I haunt the same old places
With a memory I will linger everywhere
Just because I'm not the happy guy I used to be
Lord, you know, she thinks I still care

Well, if she's happy thinking I still need her
Yeh, let that silly notion bring her cheer
Oh how could she ever be so foolish
Tell me where did she get, lord such an idea

Yeh, oh lord

Just because I asked a friend about her
And you know, just because I spoke her name somewhere
Just because, lord I saw her and went to pieces
Lord, you know, she thinks I, lord, still care
You know, she thinks I, I still care

Lord, she thinks I still care
Oh no she thinks I still care",She Thinks I Still Care,Moody Blue,1976,2,2:48,Track 'B',Single,False
112,N/A,Waylon,,The Same Old Lover Man,Good Hearted Woman,1972,10,3:00,Track 'A2',Album,False
113,N/A,Waylon,,One Of My Bad Habits,Good Hearted Woman,1972,10,2:46,Track 'A3',Album,False
114,N/A,Waylon,,Willie And Laura Mae Jones,Good Hearted Woman,1972,10,2:12,Track 'A4',Album,False
115,N/A,Waylon,,It Should Be Easier Now,Good Hearted Woman,1972,10,2:55,Track 'A5',Album,False
116,N/A,Waylon,,Do No Good Woman,Good Hearted Woman,1972,10,3:03,Track 'B1',Album,False
117,N/A,Waylon,,Unsatisfied,Good Hearted Woman,1972,10,2:10,Track 'B2',Album,False
118,N/A,Waylon,,I Knew You'd Be Leavin',Good Hearted Woman,1972,10,2:49,Track 'B3',Album,False
119,N/A,Waylon,,Sweet Dream Woman,Good Hearted Woman,1972,10,2:40,Track 'B4',Album,False
120,N/A,Waylon,,To Beat The Devil,Good Hearted Woman,1972,10,2:56,Track 'B5',Album,False
121,N/A,Johnny Cash,"Tom T Hall is forty now and so is Bobby Bare
Willie Nelson's gettin' grey and Faron Young don't care
But the young ones keep on coming on the old are slow to go
Let there be country and let the country grow
Let there be country let the music roll along
Let there be country and let me share the song

No one picks like Bill Monroe and don't George Jones sing great
I can tell that the people care by the people at my gate
Webb Pierce invites the tourists in and Ray keeps them away
Let there be country and let the country play
Let there be country

Ernest Tubb's got all of the soul he's had for all these years
Porter Wagoner's recitation still bring me to tears
And when they do play Kitty Wells you know she's still the Queen
Let there be country and keep the country green
Let there be country

Little Jimmy Dickens still sends shivers through the crowd
Mother Maybelle whispers now but the heart comes through real loud
Gene Autry don't sing no more good old Tex Ritter's gone
And somewhere downtown Nashville a young man just got off the bus
With a guitar in his hands a pocket full of songs
A lot of talent and a heart full of hope
And he's gonna be the next big country star and the country wheels roll on
Let there be country
Let there be country",Let There Be Country,One Piece At A Time,1976,10,2:58,Track 'A1',Album,False
122,N/A,Johnny Cash,"Hand me my guitar there's a song that I was singing
Back when I was young and I had a good time
Looking for love in the misty waters of the seas that roll in a young girl's mind

Only in shadows and lonely at night she turns to you softly you turn on the light
You use her abuse her and you know it ain't right to treat one who loves you so badly
When she's doing the best that she can you know she's doing the best that she can

Do you believe in dreams do you believe in dreamers
Hoping that you'll find what you're looking for
You don't have to worry cause there's a bright tomorrow
In the dreams that roll in a young girl's mind
Only in shadows
So hand me my guitar
Of the seas that roll in a young girl's mind",In A Young Girl's Mind,One Piece At A Time,1976,10,4:00,Track 'A3',Album,False
123,N/A,Johnny Cash,"Mountain lady do you sit on your front porch in the cool of the day
Mountain lady did you think your kids would ever come back to stay
Mountain lady does the columbine still twine around your door
And did you ever get a rug
To cover the cracks where my diaper drug on your wooden floor
Oh you Appalachian lady once I was your little baby
And you rocked me in your homemade rockin' chair
Since I heard the wild goose callin' I have done a lot of fallin'
Mountain lady someday I'll come to you there

Mountain lady does the country church bell ring on Sunday morn
Mountain lady do you still wear that old apron ragged and torn
Mountain lady on winter nights before our old fireplace
As you look into the flame do you ever call my name and do you see my face
Oh you Appalachian lad.
Mountain lady",Mountain Lady,One Piece At A Time,1976,10,3:09,Track 'A4',Album,False
124,N/A,Johnny Cash,"Well Johnson Van Dyke Grigsby was paroled in '89
He never walked on a carpet never tasted dinner wine
His old eyes were slowly fadin' as he walked out of the gate
And he breathed the first free air he'd breathed since 19-0-8
Howdy do Michigan City you're sure pretty sight
But I know there's bigger citties and more excitin' nights
But I think your girls're pretty and I love your children too
Michigan City Indiana howdy do Michigan City Indiana howdy do
Michigan City Indiana howdy do

Filled with the joy of freedom he didn't know that he was old
'Cause time don't really matter when it's bubblin' in your soul
Well I don't think he was bitter 'cause he sure had a smile
And down the streets of Michigan City he walked his first free miles
Howdy do Michigan City",Michigan City Howdy Do,One Piece At A Time,1976,10,2:43,Track 'A5',Album,False
125,N/A,Johnny Cash,,Sold Out Of Flagpoles,One Piece At A Time,1976,10,2:26,Track 'B1',Album,False
126,N/A,Johnny Cash,"There's a man across the hall who sits staring at the floor
He thinks he's Hank Williamshear him singing through the door
There's a girl in 203, who stops by to visit me
And she talks about her songs and the star that she should be
There are lots of special people staying in or passing through
And for one thing or another, committed to Parkview

There's a girl in 307, coming down on Thorazine
And a superstar's ex-drummer trying to kick Benzedrine
There's a boy just down below me, who's the son of some well-known
He was brought in by his mother, 'cause his daddy's always gone
There's a bum from down on Broadway and then a few quite well-to-do's
Who have withdrawn from the rat race and committed to Parkview

There's a girl who cries above me, loud enough to wake the dead
They don't know what she has taken that has scrambled up her head
There's a writer and a singer who has tried and tried and tried
They just brought him in this morning, an attempted suicide
There are those that never made it, those that did but now are through
Some came of their own good choosing some committed to Parkview

They wake us about 6 30, just before the morning meal
While they're taking blood pressure, they ask us how we feel
And I always say ""Fantastic! There ain't nothing wrong with me.""
And then they give me my injection and I go right back to sleep
And my days are kind of foggy and my nights are dreamy too
But they're taking good care of me committed to Parkview",Committed To Parkview,One Piece At A Time,1976,10,2:45,Track 'B2',Album,False
127,N/A,Johnny Cash,"Leaving in a cloud of burning cinders cinders from a fire of love gone out
Never looking back when she's highbolling
She's the daughter of a railroam man no doubt

Waking in a new bed every morning breaking in a new heart every night
Up and running while the world is sleeping
She's the daughter of a railroam man alright

She is long and sleek and made for moving she's outward bound at any time she can
She won't be staying long in any station she's the daughter of a railroam man

Cries out in the night when she gets lonely you can bet she won't be lonely long
On down the line someone waits her arrival and the daughter of a railroad man is gone

She is long and sleek and made for moving she's outward bound at any time she can
She won't be staying long in any station she's the daughter of a railroam man",Daughter Of A Railroad Man,One Piece At A Time,1976,10,3:14,Track 'B3',Album,False
128,N/A,Johnny Cash,"I guess we're over and it's all been said before
But I still want you though there's no reason anymore
I can't remember when you and I began
It makes no difference cause love has lost again

If there's a reason we forgot it long ago
And if there's an answer it's one I'll never know
The price of giving I just don't understand but it's collected and love has lost again

All that's left now is the closing of the door
It sounds so final but I don't listen anymore
It's not the last time that I'll break instead of bend
But for the moment love has lost again
It's not the last time.",Love Has Lost Again,One Piece At A Time,1976,10,3:12,Track 'B4',Album,False
129,N/A,Johnny Cash,"Go on blues go on lonesome get your dark clouds off of me
Go on blues go on troubles turn loose of me set me free
I've been down through that valley with you
Now I've found me somebody who loves me too
Go on blues go away from me go on by me go on blues

I've been down through
Yeah go on blues go on by me get away from me go on blues",Go On Blues,One Piece At A Time,1976,10,2:24,Track 'B5',Album,False
