,Rank,Artist,Lyrics,Title,album_name,release_date,total_tracks,duration,track_number,album_single,chart
325,N/A,Moe Bandy,"Darlin' I finally got myself together
God only knows you've waited long enough
And I just want to say that I love you
And honey this phone ain't all I'm hangin' up.

Darlin' you've got a lovin' comin', you deserve it woman
That's one thing I never gave before
You've got a lovin' comin' one that's been a long time comin'
You won't have to wonder what love is anymore.

Do do do do
You don't have to ask if I'm lonely
Honey you know I wouldn't be making this call
You won't have to wonder if I'm missing you
Woman you'll know it the minute I get home.

Darlin' you've got a lovin' comin', you deserve it woman
That's one thing I never gave before
You've got a lovin' comin' one that's been a long time comin'
You won't have to wonder what love is anymore.",You've Got A Lovin' Comin',"Hank Williams, You Wrote My Life",1976,10,2:05,Track 'A5',Album,False
326,N/A,Moe Bandy,,The Biggest Airport In The World,"Hank Williams, You Wrote My Life",1976,10,2:54,Track 'B1',Album,False
327,N/A,Moe Bandy,"Hello Mary hello Mary yeah this is me
Yeah I know I told you I'd be home by three
But you gotta believe me this is real
I got caught up in a business deal
And it's gonna be a little while before I get back

I've been sitting here sipping on a beer
And time slipped by man it sure does fly
I think I oughta go find me a telephone
And don't go messing with my ten dollar stack
Just start a round and I'll be right back
Gotta put in the call see if I still got a home

All right you guys I made my call
Let me lean back here up against the wall
Just deal them cards and make sure they're off the top
I don't know why but when I get in the game
Ain't nothing on the outside looks the same
I guess I'm a gambling man that just can't stop

Hello Mary (hello Mary) yeah this is Moe
Yeah I know I told you I'd be home a long time ago
But you gotta believe me this is real
I got caught up in a business deal
And it's gonna be a little while before I get back",Hello Mary,"Hank Williams, You Wrote My Life",1976,10,2:21,Track 'B2',Album,False
328,N/A,Moe Bandy,,The Hard Times,"Hank Williams, You Wrote My Life",1976,10,1:47,Track 'B3',Album,False
329,N/A,Moe Bandy,"What in this world has come and slipped up on me
What is this crazy thing I feel
I can't believe that love is callin' my name
I can't believe it but it's real.

I think I've got a love on for you
I think my dreams are finally comin' true
Think I've took a liken to the things you say and do
I think I've got a love on for you.

Where did I find this wild and wonderful dream
Where did I find someone like you
What makes me love this crazy song that I sing
What makes me laugh away my blues.

I think I've got a love on for you
I think my dreams are finally comin' true
Think I've took a liken to the things you say and do
I think I've got a love on for you.
I think I've got a love on for you...",I Think I've Got A Love On For You,"Hank Williams, You Wrote My Life",1976,10,2:51,Track 'B4',Album,False
330,N/A,Moe Bandy,,I'm Not As Strong As I Used To Be,"Hank Williams, You Wrote My Life",1976,10,2:24,Track 'B5',Album,False
331,N/A,Johnny Duncan,,"Flashing, Screaming, Silent Neon Sign",Stranger,1976,2,3:10,Track 'B',Single,False
332,N/A,Johnny Rodriguez,,Louisiana,I Wonder If I Ever Said Goodbye,1976,2,2:51,Track 'B',Single,False
333,N/A,Waylon Jennings,,I Ain't The One,Suspicious Minds,1976,2,3:57,Track 'B',Single,False
334,N/A,Freddy Fender,,My Happiness,Vaya Con Dios / My Happiness,1976,2,2:29,Track 'B',Single,False
335,N/A,Billie Jo Spears,,Midnight Blue,Misty Blue: The Best Of Billie Jo Spears,1992,10,3:16,Track '1',Compilation,False
336,N/A,Billie Jo Spears,"It was Friday night
And both of us were lonely
We seemed to meet as lonely people do
I filled that empty space till Monday morning

I never meant ton fall in love with you
Came right out and told me
About your wife back home in Houston
You were just in town on business
You never tried to lead me on

Time had seemed just fine
Simply love you for the moment
Heaven help me, time ran out
Now the moment's gone

Silver wings and golden rings
Are taking you today
And I'll be dying on the ground
While you are flying away

Silver wings and golden rings
Are shinning on and on
While the only love
I've ever known is gone

You made me feel like
I was something special
The way no other man ever done
And I knew last night
Would have to last forever

It's just no way of holding back the sun
And now I guess it's time for me
To drive you to the airport
Hold back all my tears
Tell you it's been nice

If you come back to town again
Know I love to see you
Remember I'm not strong enough
To let go of you twice

Silver wings and golden rings
Are taking you today
And I'll be dying on the ground
While you are flying away

Silver wings and golden rings
Are shinning on and on
While the only love
I've ever known is gone

Silver wings and golden rings
Are taking you today
And I'll be dying on the ground
While you are flying away

Silver wings and golden rings
Are shinning on and on
While the only love
I've ever known is gone",Silver Wings And Golden Rings,Misty Blue: The Best Of Billie Jo Spears,1992,10,3:28,Track '2',Compilation,False
337,N/A,Billie Jo Spears,"There's a million things that we could do this evenin'
With all the night life and the silver screen
Oh, we've got time and we could take the town in
Or take a fast jet, baby, down to New Orleans

But what I've got in mind is a small cafe
Out of the way
Oh, baby, let's don't stay
No and be too late

What I've got in mind is to disappear
Or maybe just stay right here
Oh, to tell the truth what I've got in mind
Is makin' love to you

Well, I confess and you can find me guilty
I'm a selfish lover I can't deny
But I love you and I don't want to share you
With any night lights or darlin', in another's eyes

But what I've got in mind is a small cafe
Out of the way
Oh, baby, let's don't stay
No and be too late

What I've got in mind is to disappear
Or maybe just stay right here
Oh, to tell the truth what I've got in mind
Is makin' love to you

Oh, to tell the truth what I've got in mind
Is makin' love to you",What I've Got In Mind,Misty Blue: The Best Of Billie Jo Spears,1992,10,2:21,Track '3',Compilation,False
338,N/A,Billie Jo Spears,"In the beginning God made the world
And something wasn't right
He reached down His hand and He made man
Then He smiled, 'cause it was right

But it didn't take long for Him to see
This man was so alone
So He gave him a woman
To love and call his own

Now, the devil had an apple tree
The fruit, it looked so fine
Man took a bite, it tasted sweet
So he stepped out of line

Now today it's still the same
And I know she's tempting you
So with all my love and all my heart
I am begging you

Stay away, stay away from the apple tree
Don't you know that all she wants to do
Is hurt you and me?
Stay away, stay away from the apple tree
And spend all your time loving me",Stay Away From The Apple Tree,Misty Blue: The Best Of Billie Jo Spears,1992,10,2:41,Track '5',Compilation,False
339,N/A,Billie Jo Spears,,Lonely Heart Club,Misty Blue: The Best Of Billie Jo Spears,1992,10,2:43,Track '6',Compilation,False
340,N/A,Billie Jo Spears,"I left Garden City Kansas with a ticket and a yen to see New York
I typed eigty words a minute so your corporation let me go to work
I fetch paper clips and coffee even help you dodge your domineering wife
Mr Walker it's all over I don't like the New York secretary's life

In this building there's a crowd of guys with old familiar thoughts upon their minds
That's a lot of hands a reaching out you grab the things that I consider mine
And the president persues me even though he's old and hair a turnin' white
Mr Walker it's all over I don't like the New York secretary's life

There's a flat in Greenwich Village that I took because the subway wasn't far
But a trumpet player's upstairs and below me ther's a jumping all night bar
And to frost a bitter cake I have to share the place with bugs and big ol' mice
Mr Walker it's all over I don't like the New York secretary's life

Your sweetheart in personnel said I should give her written notice like the rest
So I wrote goodbye with my brightest lipstick right across her big expensive desk
You'd better call the Times and tell 'em put your wanted ad right back in classified
Mr Walker it's all over I don't like the New York secretary's life

There's a Greyhound at the station and a mom at home with open arms for me
Garden City's looking better every minute now since I have learned to see
And the boy next door don't know it but come June he's gonna gain himself a wife
Mr Walker it's all over I don't like the New York secretary's life
Mr Walker it's all over I don't like the New York secretary's life
Mr Walker it's all over I don't like the New York secretary's life",Mr. Walker It's All Over,Misty Blue: The Best Of Billie Jo Spears,1992,10,2:29,Track '7',Compilation,False
341,N/A,Billie Jo Spears,,Never Did Like Whiskey,Misty Blue: The Best Of Billie Jo Spears,1992,10,3:13,Track '8',Compilation,False
342,N/A,Billie Jo Spears,"Big Jimmy Baker and Marty Gray met at a teenage party
Jimmy took Marty to school the next day both of them were tardy
Sittin' in the parking lot talking over things waitin' for the morning bell to ring
Two little love birds loose on wing Jimmy Baker and Marty
Kids in love now what can you do but listen to the cooing
Pretty little blonde haired Marty Gray does your mama know what you're doing
Bet your mama don't know what you're doing

Big Jimmy Baker's on the football team Marty's wearin' his sweater
Listen to them talking in the locker room man he's a real go getter
Telling Marty 'bout the facts of life says there'll never be another
Someday she's gonna be his wife he learned that line from his brother
Kids in love now what can you do...

Down at the drive-in Friday night didn't come to see the movie
Parked in back and away from the light Jimmy says isn't this groovy
Under the seat a bottle in a bag made to affect the senses
Poured out a drink for Marty Gray broke down her defense
Kids in love now what can you do...

Big Jimmy Baker and Marty Gray no longer goin' together
Fire of love burned out they say Marty's feelin' under the weather
Town turns out to have a big day the football hero's goin' away
But Marty's got the price to pay and Jimmy's gonna let her
Kids in love now what can you do...
Bet your mama don't know what you're doing",Marty Gray,Misty Blue: The Best Of Billie Jo Spears,1992,10,2:02,Track '9',Compilation,False
343,N/A,Billie Jo Spears,,Wishing Won't Make It So,Misty Blue: The Best Of Billie Jo Spears,1992,10,2:36,Track '10',Compilation,False
344,N/A,Jimmy Dean,"You know most people look through their wallets or their pocketbooks
And way down at the bottom Past the credit cards and baby pictures, greenstamps, you usually find a little old dog eared piece poetry.

I was cleaning out my wallet the other day and I ran across a whole bunch of I.O.U.'s some of them thirty years overdue. Funny thing is that all these I.O.U.'s are owed to one person, and I kinda feel like right now might be a pretty good time for an accounting.

Mom, you listenin?

Mom, I owe you for so many things, a lot of services, like night watchman for instance, for lying awake nights listening for coughs, cries, creaking floorboards and me coming in too late. You had the eye of an eagle, the roar of a lion, but you always had a heart as big as a house.

I owe you for services as a short order cook, chef, baker, for making sirloin out of hamburger, turkey out of tuna fish and two big ol' strapping boys out of leftovers.

I owe you for cleaning services, for the daily scrubbing of face and ears all work done by hand and for the frequent dusting of a small boys pants to try to make sure that he led a spotless life and for washing and ironing, no laundry could ever do. For drying the tears of childhood and for Ironing out the problems of growing up.

I owe you for servics as a bodyguard, for protecting me from the terrors of thunderstorms and nightmares ha, and too many green apples.

And Lord knows I owe you for medical attention, for nursing me through measles, mumps, bruises, bumps, splinters and spring fever.
And let's not forget medical advise either, Oh, no.
Important things like ha ha, don't scratching it or it won't get well,
If you cross your eyes they're gonna stick like that And probably ah, most Important of all was, be sure you got on clean underwear boy, in case you're in an accident.

And I owe you for veterinarian services, for feeding every lost dog that I dragged home at the end of the rope and for healing the pains of puppy love.

And I owe you for entertainment, entertainment that kept the household going during some pretty tough times, for wonderful productions at Christmas, 4th of July and birthdays, and for making make believe come true on a very limited budget.

I owe you for construction work, for building kites, confidence, hopes and dreams and somehow you made 'em all touch the sky.

And for cementing a family together so it would stand the worst kinds of shocks and blows and for laying down a good strong foundation to build a life on.

I owe you for carrying charges, for carrying me on your books for the necessities of life that a growing boy just gotta have. Things like, a oh, a pair of high top boots with a little pocket on the side for a jackknife.

And one thing, Mom, I will never ever forget when there were two pieces of apple pie left and three hungry people I noticed that you were the one who suddenly decided that you really didn't like apple pie in the 1st place.

These are just a very few of the things for which payment is long overdue, the person I owe 'em to worked very cheap.
She managed by simply doing without a whole lotta things that she needed herself.

My I.O.U.'s add up to much more than I could ever hope to repay.
But you know the nicest thing about it all is that, I know that she'll mark the entire bill paid in full for just one kiss and four little words.

Mom, I love you",I.O.U.,I.O.U.,1976,2,,Track 'B',Single,False
345,N/A,Tanya Tucker,"Well you made me cry when you said goodbye
Ain't that a shame my tears fell like rain
Ain't that a shame yeah you're the one to blame oh

Well you broke my heart when you said we'd apart
Ain't that a shame...

Oh well goodbye although I cry
Ain't that a shame...
You made me cry when you said goodbye
Ain't that a shame...
Oh well goodbye although I cry...",Ain't That A Shame,Ain't That A Shame / You've Got Me To Hold On To,1976,2,2:29,Track 'A',Single,False
346,N/A,Johnny Rodriguez,,Commonly Known As The Blues,Hillbilly Heart,1976,2,2:55,Track 'B',Single,False
347,N/A,Emmylou Harris,"Together again my tears have stopped falling
The long lonely nights are now at an end
The key to my heart you hold in your hand
And nothing else matters 'cause we're together again

Together again the grey skies are gone
You're back in my arms now where you belong
The love that we knew is living again
And nothing else matters cause we're together again

Together again my tears have stopped falling
The long lonely nights are now at an end
The love that we knew is living again
And nothing else matters now that we're together again

No, nothing else matters because we're together again",Together Again,Together Again / One Of These Days,1975,2,3:56,Track 'A',"7""",False
348,N/A,Olivia Newton-John,"If not for you, babe I couldn't even find the door
I couldn't even see the floor
I'd be sad and blue, if not for you

If not for you, babe, the night would see me wide awake
The day would surely have to break
It would not be new, if not for you

If not for you, my sky would fall, rain would gather too
Without your love I'd be nowhere at all, I'd be lost, if not for you

If not for you, the Winter would hold no Spring
Couldn't hear a Robin sing
I just wouldn't have a clue, if not for you

If not for you, my sky would fall, rain would gather too
Without your love I'd be nowhere at all, I'd be lost, if not for you

If not for you, the Winter would hold no Spring
You couldn't hear a robin sing
I just wouldn't have a clue, if not for you
If not for you",If Not For You,Olivia Newton-John's Greatest Hits,1977,12,2:50,Track 'A1',Single,False
349,N/A,Olivia Newton-John,"We said a million times we'd change
Can't bring myself to say those words again
A piper never changes tune
You can't grow apples on the moon

The hurtful things we say still penetrate
And whispered sorrys always come too late
Then the damage has been done
What are we going to tell our son? 

I want to spare his broken heart
Break it gently that we'll live apart 
Don't know the proper words to say 
He won't be seeing daddy every day

Those weekly outings never work, you know 
Buying gifts and candy, picture shows 
They can't replace the man around 
Your voice, your touch, your manly sound

I guess the trouble is I love you still 
And if it comes to that, I always will 
No, please don't cry, it's just too late
Now hurry on, she's waiting at the gate",Changes,Olivia Newton-John's Greatest Hits,1977,12,2:27,Track 'A2',Single,False
350,N/A,Olivia Newton-John,"Wherever you go
Wherever you may wander in your life
Surely you know
I always wanna be there
Holding you hand
And standing by to catch you when you fall
Seeing you through
In everything you do

Let me be there in your morning
Let me be there in your night
Let me change whatever's wrong and make it right
Let me take you through that wonderland
That only two can share
All I ask you is let me be there
Oh, let me be there

Watching you grow
And going through the changes in your life
That's how I know
I always wanna be there
Whenever you feel you need a friend to lean on, here I am
Whenever you call, you know I'll be there

Let me be there in your morning
Let me be there in your night
Let me change whatever's wrong and make it right
Let me take you through that wonderland
That only two can share
All I ask you is let me be there",Let Me Be There,Olivia Newton-John's Greatest Hits,1977,12,3:00,Track 'A3',Single,False
351,N/A,Olivia Newton-John,"You came when I was happy in your sunshine
I grew to love you more each passing day
Before too long I built my world around you
And I prayed you'd love enough of me to stay

If you love me let me know
If you don't then let me go
I can't take another minute
Of a day without you in it
If you love me let it be
If you don't then set me free
Take the chains away
That keep me loving you

The arms that open wide to hold me closer
The hands that run their fingers through my hair
The smile that says ""hello, it's good to see you"" 
Anytime I turn around to find you there

It's this and so much more that make me love you
What else can I do to make you see
You know you have whatever's mine to give you
But a love affair for one can never be

If you love me let me know
If you don't then let me go
I can't take another minute
Of a day without you in it
If you love me let it be
If you don't then set me free
Take the chains away
That keep me loving you
Take the chains away
That keep me loving you
Loving you",If You Love Me (Let Me Know),Olivia Newton-John's Greatest Hits,1977,12,3:12,Track 'A4',Single,False
352,N/A,Olivia Newton-John,"Maybe I hang around here
A little more than I should
We both know I've got somewhere else to go
But I got something to tell you
That I never thought I would
But I believe you really ought to know

I love you
I honestly love you

You don't have to answer
I see it in your eyes
Maybe it was better left unsaid
But this is pure and simple
And you must realize
That it's coming from my heart and not my head

I love you
I honestly love you

I'm not trying to make you feel uncomfortable
I'm not trying to make you anything at all
But this feeling doesn't come along every day
And you shouldn't blow the chance
When you got the chance to say

I love you
I love you
I honestly love you

If we both were born in another place and time
This moment might be ending in a kiss
But there you are with yours and here I am with mine
So I guess we'll just be leaving it like this

I love you
I honestly love you
I honestly love you",I Honestly Love You,Olivia Newton-John's Greatest Hits,1977,12,3:36,Track 'A5',Single,False
353,N/A,Olivia Newton-John,"There was a time when I was in a hurry as you are
I was like you
There was a day when I just had to tell my point of view
I was like you

Now I don't mean to make you frown
No, I just want you to slow down

Have you never been mellow?
Have you never tried to find a comfort from inside you?
Have you never been happy just to hear your song?
Have you never let someone else be strong?

Running around as you do with your head up in the clouds
I was like you
Never had time to lay back, kick your shoes off, close your eyes
I was like you

Now you're not hard to understand
You need someone to take your hand

Have you never been mellow?
Have you never tried to find a comfort from inside you?
Have you never been happy just to hear your song?
Have you never let someone else be strong?",Have You Never Been Mellow,Olivia Newton-John's Greatest Hits,1977,12,3:28,Track 'A6',Single,False
354,N/A,Olivia Newton-John,"In the corner of the bar there stands a jukebox 
With the best of country music, old and new 
You can hear your five selections for a quarter 
And somebody else's songs when yours are through 

I got good Kentucky whiskey on the counter 
And my friends around to help me ease the pain 
'Til some button-pushing cowboy plays that love song 
And here I am just missing you again 

Please, Mr., please, don't play B-17 
It was our song, it was his song, but it's over 
Please, Mr., please, if you know what I mean 
I don't ever wanna hear that song again 

If I had a dime for every time I held you 
Though you're far away, you've been so close to me 
I could swear I'd be the richest girl in Nashville 
Maybe even in the state of Tennessee 

But I guess I'd better get myself together 
'Cause when you left, you didn't leave too much behind 
Just a note that said ""I'm sorry"" by your picture 
And a song that's weighing heavy on my mind 

Please, Mr., please, don't play B-17 
It was our song, it was his song, but it's over 
Please, Mr., please, if you know what I mean 
I don't ever wanna hear that song again",Please Mr. Please,Olivia Newton-John's Greatest Hits,1977,12,3:24,Track 'B1',Single,False
355,N/A,Olivia Newton-John,"I try to be patient, I try not to moan
But it's driving me crazy, tryin' to live here alone

My conversation gets nowhere
When I talk to myself
I've lost my sense of humour
Somewhere here on the shelf

The moon is wasting its shine, shining on me
Until I see you again,
I won't be out in the moonlight,
Well I'll be sleeping by ten

The birds are wasting their songs, singin' to me
Until I'm wakin' with you,
Until you're back in my arms, dear,
The birds will have to find something better to do

A shoulder to cry on would make me feel fine
But it's not much comfort when I'm cryin' all night
Friends and relations
Are running out of patience with me
I keep myself to myself but I'm no company

The moon is wastin' its shine, shinin' on me
Until I see you again,
I won't be out in the moonlight,
Well I'll be sleepin' by ten

The birds are wastin' their song, singin' to me
Until I'm wakin' with you,
Until you're back in my arms, dear,
The birds will have to find something better to do

The birds will have to find something better to do",Something Better To Do,Olivia Newton-John's Greatest Hits,1977,12,3:16,Track 'B2',Single,False
356,N/A,Olivia Newton-John,"If my life gets like a jigsaw
With the pieces out of place
Come on over
Put a smile back on my face
And if all my bad days came at once
You would know just what to do
Come on over
Baby, you would see me through

And if you think I need you
Come on over
Bring your love around
You can dry away my tears
And if you think I need you
Come on over
Lay your body down
You know I will be here
So bring your love around

When I cannot see in front of me
And I know my darkest day
Come on over
You can take it all away

And if you think I need you
Come on over
Bring your love around
You can wipe away my tears
And if you think I need you
Come on over
Lay your body down
You know I will be here
So bring your love around

If you think
If you think I need you
Come on over",Come On Over,Olivia Newton-John's Greatest Hits,1977,12,2:26,Track 'B4',Single,False
357,N/A,Olivia Newton-John,"Unfortunately, we are not licensed to display the full lyrics for this song at the moment. Hopefully we will be able to in the future. Until then... how about a random page?",Don't Stop Believin',Olivia Newton-John's Greatest Hits,1977,12,3:38,Track 'B5',Single,False
358,N/A,Olivia Newton-John,"I heard that you're on your own now
So am I, I'm living alone now
I was wrong, so were you
What will you do
Are you glad to be free
Are you feeling lost, just like me
Longing for company

Oh Sam, Sam
You know where I am
Come around and talk awhile
I need your smile
You need a shoulder
Oh Sam, Sam
You know where I am
And the door is open wide
Come on inside
Longing to see you
Oh Sam, Sam
You know where I am

I find the days hard to face now
Empty rooms, there's much too much space now
And the nights go so slow
I'm sure you know
Wish I knew what to do
It would be so nice seeing you
And it might help you too

Oh Sam, Sam
You know where I am
Come around and talk awhile
I need your smile
You need a shoulder
Oh Sam, Sam
You know where I am
And the door is open wide
Come on inside
Longing to see you
Oh Sam, Sam
You know where I am

Oh Sam
You know where I am
Oh Sam
Ooh Sam
You know, you know, you know where I am",Sam,Olivia Newton-John's Greatest Hits,1977,12,3:37,Track 'B6',Single,False
359,N/A,Larry Gatlin,,The Heart,Broken Lady / The Heart,1975,2,2:37,Track 'B',Single,False
