,Rank,Artist,Lyrics,Title,album_name,release_date,total_tracks,duration,track_number,album_single,chart
0,1,Alabama,"I'll admit I could feel it 
The first time that we touched
The look in your eyes
Said you felt as much
But I'm not a man
Who falls so easily 
It's best that you know
Where you stand with me

I will give you my heart
Faithful and true
And all the love it can hold
That's all I can do 
But I've thought about 
How long I'll love you
And it's only fair that you know
Forever's as far as I'll go

When there's age around my eyes
And gray in your hair
And it only takes a touch to recall
The love we've shared
I won't take for granted
That you know my love is true
Each night in your arms
I will whisper to you

I will give you my heart
Faithful and true
And all the love it can hold
That's all I can do
But I've thought about
How long I'll love you
And it's only fair that you know
Forever's as far as I'll go",Forever's As Far As I'll Go,Forever's As Far As I'll Go,1990,2,3:36,Track 'A',Single,True
1,2,Garth Brooks,"Just the other night
At a hometown football game
My wife and I ran into
My old highschool flame
And as I introduced them
The past came back to me
And I couldn't help but think of
The way things used to be

She was the one
That I'd wanted for all times
And each night I'd spend prayin'
That God would make her mine
And if He'd only granted me
This wish I'd wished back then
I'd never ask for anything again

Sometimes I thank God
For unanswered prayers
Remember when you're talkin'
To the man upstairs
That just because He doesn't answer
Doesn't mean He don't care!
Some of God's greatest gifts are
Unanswered prayers...!

She wasn't quite the angel
That I remembered in my dreams
And I could tell that time had changed me,
And her eyes too, it seemed
We tried to talk about the old days
There wasn't much we could recall
I guess the Lord knows
What He's doing after all

And as she walked away
Well I looked at my wife
And then and there I thanked the good Lord
For the gifts in my life

Sometimes I thank God
For unanswered prayers
Remember when you're talkin'
To the man upstairs
And just because He may not answer
Doesn't mean He don't care!
Some of Gods greatest gifts
Are unanswered...
Some of Gods greatest gifts
Are all too often unanswered...
Some of God's greatest gifts are
Unanswered Prayers!",Unanswered Prayers,Unanswered Prayers,1990,2,3:23,Track 'A',Single,True
2,3,Alabama,"In the corner of my mind stands a jukebox
It's playin' all my favorite mem-o-ries
One by one, they take me back
To the days when you were mine
And I can't stop this jukebox in my mind.

I don't need no quarters, don't need any dime
You filled it up forever
When you said good-bye
Heaven knows I love old melodies
They were meant to ease the pain
But the kind that's playin' on my mind
Are drivin' me insane.

In the corner of my mind stands a jukebox
It's playin' all my favorite mem-o-ries
One by one, they take me back
To the days when you were mine
And I can't stop this jukebox in my mind.

Song by song, those melodies
Were meant to ease the pain
But the kind that's playin' on my mind
Are drivin' me insane;

In the corner of my mind stands a jukebox
It's playin' all my favorite mem-o-ries
One by one, they take me back
To the days when you were mine
And I can't stop this jukebox in my mind.",Fire On Fire,Jukebox In My Mind,1990,2,4:27,Track 'B',Single,True
3,4,Garth Brooks,"Blame it all on my roots, I showed up in boots
And ruined your black tie affair
The last one to know, the last one to show
I was the last one you thought you'd see there

And I saw the surprise, and the fear in his eyes
When I took his glass of champagne
And I toasted you, said honey we may be through
But you'll never hear me complain

'Cause I've got friends in low places
Where the whiskey drowns and the beer chases
My blues away
And I'll be OK

And I'm not big on social graces
Think I'll slip on down to the oasis
So I've got friends
In low places

Well I guess I was wrong, I just don't belong
But then, I've been there before
Everything's alright, I'll just say goodnight
And I'll show myself to the door

Hey, I didn't mean, to cause a big scene
Just give me an hour and then
Well I'll be as high as that ivory tower
That you're livin' in

'Cause I've got friends in low places
Where the whiskey drowns and the beer chases
My blues away
And I'll be OK

And I'm not big on social graces
Think I'll slip on down to the oasis
So I've got friends
In low places

I've got friends in low places
Where the whiskey drowns and the beer chases
My blues away
And I'll be OK

I'm not big on social graces
Think I'll slip on down to the oasis
So I've got friends
In low places

I've got friends in low places
Where the whiskey drowns and the beer chases
My blues away
And I'll be OK

I'm not big on social graces
Think I'll slip on down to the oasis
So I've got friends
In low places

I've got friends in low places
Where the whiskey drowns and the beer chases
My blues away, and I'll be OK",Friends In Low Places (Edited),Friends In Low Places (Edited) / Nobody Gets Off In This Town,1990,2,3:45,Track 'A',Single,True
4,5,George Strait,"I got sent home from school one day
With a shiner on my eye
Fightin' was against the rules and it didn't matter why
When Dad got home, I told that story just like I'd rehearsed
Then stood there on those tremblin' knees
And waited for the worst

And he said, ""Let me tell you a secret about a father's love
A secret that my daddy said was just between us""
He said, ""Daddies don't just love their children every now and then
It's a love without end, amen""
It's a love without end, amen

When I became a father in the spring of '81
There was no doubt that stubborn boy
Was just like my father's son
And when I thought my patience
Had been tested to the end
I took my daddy's secret and passed it on to him

I said, ""Let me tell you a secret about a father's love
A secret that my daddy said was just between us""
I said, ""Daddies don't just love their children every now and then
It's a love without end, amen""
It's a love without end, amen

Last night I dreamed I died and stood outside those pearly gates
When suddenly I realized there must be some mistake
If they know half the things I've done
They'll never let me in
Then somewhere from the other side I heard those words again

They said, ""Let me tell you a secret about a father's love
A secret that my daddy said was just between us
You see, daddies don't just love their children every now and then
It's a love without end, amen""
It's a love without end, amen","Love WIthout End, Amen","Love WIthout End, Amen",1990,2,3:06,Track 'A',Single,True
5,6,Garth Brooks,"Lookin' back, on the memory of
The dance we shared, beneath the stars above
For a moment, all the world was right
How could I have known, that you'd ever say goodbye

And now, I'm glad I didn't know
The way it all would end, the way it all would go
Our lives, are better left to chance
I could have missed the pain, but I'da had to miss, the dance

Holding you, I held everything
For a moment, wasn't I a king
But if I'd only known, how the king would fall
Hey, who's to say, you know I might have changed it all

And now, I'm glad I didn't know
The way it all would end, the way it all would go
Our lives, are better left to chance
I could have missed the pain, but I'da had to miss, the dance

Yes, my life, it's better left to chance
I could've missed the pain, but I'da had to miss, the dance",The Dance,Garth Brooks,1989,10,3:37,Track 'B5',Album,True
6,7,George Strait,"So upset
Nervous wreck
I can't believe she said goodbye
Sit and smoke
Cry and joke
About these tears in my eyes

How could you do what you gone and done to me
I wouldn't treat a dog the way you treated me
But that's what I get 
I've come to expect it from you

A million times
A million lines and I bought 'em every one
You don't care
You rip and tear every dream I've counted on
I guess I should thank my unlucky stars
That I'm alive
And you're the way you are
But that's what I get
I've come to expect it from you

How could you do what you gone and done to me
I wouldn't treat a dog the way you treated me
But that's what I get 
I've come to expect it from you

I could raise hell
But what the hell it wouldn't do a bit of good
I can leave
My heart agrees it seems to think that I should
There won't be no more next time doing me wrong
You'll come back this time to find that I'm gone

But that's what you get
You should expect that from me
That's what I get
I've come to expect it from you.",I've Come To Expect It From You,I've Come To Expect It From You,1990,2,3:44,Track 'A',Single,True
7,8,Clint Black,"Unfortunately, we are not licensed to display the full lyrics for this song at the moment. Hopefully we will be able to in the future. Until then... how about a random page?",Walkin' Away,Walkin' Away,1990,2,2:47,Track 'A',Single,True
8,9,Clint Black,"Move slowly to my dresser drawers, put my blue jeans on
Find my cowboy boots, my button down, strap my timepiece on my arm
Grab my billfold, my pocket change, just a mindless old routine
Then it's out the door and down the street, but it's not really me

I still comb my hair the same, still like the same cologne
And I still drive that pickup truck that the same old bank still owns
But since you left, everybody says, I'm not the guy they've known
The lights are on, but nobody's home

Cup of coffee in the mornin', it's just food for the brain 
But I've been numb since our last goodbyes, I haven't felt a thing
But now there's pains in my head and pains in my chest, and I think I'm losing my hair
I'm a half a man with half a mind, to think you didn't care 

I still comb my hair the same, still like the same cologne
And I still drive that pickup truck that the same old bank still owns
But since you left, everybody says, I'm not the guy they've known
The lights are on, but nobody's home

Since you left, everybody says, I'm not the guy they've known
The lights are on, but nobody's home
The lights are on, but nobody's home",Nobody's Home,Nobody's Home,1989,2,3:29,Track 'A',Single,True
9,10,Dan Seals,"I just had to call, cause babe I got your letter
And I understood almost every line
You said T.L.C. is what you miss from me
You want back in my arms P.D.Q.
And ooh I love this game
Them three letters by your name L.O.A. what does that say?

She said ooh baby it's so simple
I did not mean to make it hard to understand
I've been gone so long
Want you to know I miss my man oh yes I do
And that message for you
Tells you what I'm gonna do when I get home oh yeah

L.O.A. (Love on arrival)
For you (Love on arrival)
L.O.A. is what I'm gonna give to you
I've been countin' the days
I've been lonely, I've been blue (Love on arrival)
For you (Love on arrival)
And now after all this time
I've got nothing on my mind but L.O.A. (Love on arrival)
For you

I said ooh baby I do love you
And I'm always amazed the way we fit
And I T.G.I.F.
Thank God I found you when I did, oh yes I do
Them three letters by your name
I will just give you just the same
When you get home, oh yes I will

L.O.A. (Love on arrival)
For you (Love on arrival)
L.O.A. is what I'm gonna give to you
I've been countin' the days
I've been lonely, I've been blue (Love on arrival)
For you (Love on arrival)
And now after all this time
I've got nothing on my mind but L.O.A. (Love on arrival)
For you

I don't need no confirmation
I get it right here in my land
Don't need no translation
You done spelled it out with words
That I can understand L.O.A.
Ooh ooh ooh, L.O.A.

L.O.A. (Love on arrival)
For you (Love on arrival)
L.O.A. is what I'm gonna give to you
I've been countin' the days
I've been lonely, I've been blue (Love on arrival)
For you (Love on arrival)
And now after all this time
I've got nothing on my mind but L.O.A. (Love on arrival)
For you

And now after all this time
I've got nothing on my mind but L.O.A. (Love on arrival)",Love On Arrival,On Arrival,1990,10,3:49,Track 'B2',Album,True
10,11,Shenandoah,"Ridin' down the road in my pick-up truck
Ya' better be ready 'cause I'm pickin' you up
With a full moon a shinin' and a little bit a' luck
We'll run out outta gas and maybe get stuck

We could get lost baby I don't care
I ain't worried as long as you're there
There ain't no place that I'd rather be
Next to you, sittin' next to me
There ain't no place that I'd rather be
Next to you, next to me

Barbecue chicken in aluminum foil
Just enough money for my gas and oil
Who needs your shrimp and your caviar
I'd sooner have you just the way you are

Rich people got their money to hold
Mansion on the hill and diamonds and gold 
It can't compare as far as I can see
Next to you sittin' next to me
There ain't no place that I'd rather be
Next to you, next to me

Radio playin' our favorite song
I'll change the station if the news comes on
When the signal ain't comin' in too strong
We'll make our own music honey all night long

If the Good Lord's willin' when we're old and gray
The kids are grown up and moved away
We'll be rockin' there side by side
With barbeque chicken and the tv guide

Well, there ain't no place that I'd rather be
Next to, sittin' next to me

No, there ain't no place that I'd rather be
Next to you, next to me

There ain't no place that I'd rather be
Next to you, sittin' next to me

Next to you, next to me
Next to you, next to me

Next to you, next to me
Next to you, next to me","Next To You, Next To Me","Next To You, Next To Me/Daddy's Little Man",1990,2,3:16,Track '1',Single,True
11,12,Randy Travis,"Since the day I was led to temptation
And in weakness did let your love down
I have prayed that with time and compassion
You'd come around

I keep waitin' for you to forgive me
And you keep sayin' you can't even start
And I feel like a stone you have picked up and thrown
To the hard rock bottom of your heart
To the hard rock bottom of your heart

Now this home we have built is still standin'
It's foundation is on solid ground
Do we roll up our sleeves and repair it
Or burn it down

I keep waitin' for you to forgive me
And you keep sayin' you can't even start
And I feel like a stone you have picked up and thrown
To the hard rock bottom of your heart
To the hard rock bottom of your heart

We can't just block it out, we've got to talk it out
Until our hearts get back in touch
I need your love I miss it, I can't go on like this is it
Hurts too much

I keep waitin' for you to forgive me
And you keep sayin' you can't even start
And I feel like a stone you have picked up and thrown
To the hard rock bottom of your heart
To the hard rock bottom of your heart

To the hard rock bottom of your heart
To the hard rock bottom of your heart",Hard Rock Bottom Of Your Heart (Remix),Hard Rock Bottom Of Your Heart,1989,2,3:43,Track 'A',Single,True
12,13,Eddie Rabbitt,"Sometimes a man does things without half thinkin'
And what I saw I did not understand
I called you names and said some things that hurt you
And in the heat I started walkin' out that door

But on second thought I'll just turn around in my
Tracks
And walk back into your arms where I belong
I was wrong
On second thought I apologize for what I've done
'Cause you're the only one I'll always be in love with

I know it's not your fault that you're so pretty
And that you turn the head of every man
I understand
But when I saw you dancing with him I just lost it
I started thinkin' I don't love you any more

But on second thought I'll just turn around in my tracks
And walk back into your arms where I belong
I was wrong
On second thought I apologize for what I've done
'Cause you're the only one I'll always be in love with

But when I saw you dancing with him I just lost it
I started thinkin' I don't love you any more

But on second thought I'll just turn around in my tracks
And walk back into your arms where I belong
I was wrong
On second thought I apologize for what I've done
'Cause you're the only one I'll always be in love with

Yes you're the only one I'll always be in love with",On Second Thought,On Second Thought,1989,2,3:36,Track 'A',Single,True
13,14,Oak Ridge Boys,"When I was a young boy I would dream about life
And wonder just how sweet it would be
But baby I got lucky when I met you that night
Now you'll always have this promise from me.

No matter how high I get,
I'll always look up to you,
You'll always be number one,
I'll settle for number two.
You've always been there for me
Baby, I must confess
I'll always look up to you
No matter how high I get.

Up here on the mountain it gets crazy sometimes,
So crazy I don't know what to do.
When I've had it up to here with all of their lies
I can count on you to tell me the truth.

No matter how high I get,
I'll always look up to you,
You'll always be number one,
I'll settle for number two.
You've always been there for me
Baby, I must confess
I'll always look up to you
No matter how high I get.

You are the one that turned me around,
You help me keep my feet on the ground.

No matter how high I get,
I'll always look up to you,
You'll always be number one,
I'll settle for number two
You've always been there for me
Baby, I must confess
I'll always look up to you
No matter how high.

No matter how high I get,
I'll always look up to you,
You'll always be number one,
I'll settle for number two
You've always been there for me
Baby, I must confess
I'll always look up to you
No matter how high.

No matter how high I get,
I'll always look up to you,
You'll always be number one,
I'll settle for number two.
You've always been there for me
Baby, I must confess
I'll always look up to you
No matter how high I get.",No Matter How High,No Matter How High,1989,2,2:52,Track 'A',Single,True
14,15,Ricky Van Shelton,"When you left me lonely here
I thought that I would drown in tears
As one was wiped away
Another one would take its place
Drop by drop, as time went by
I slowly ran that river dry
Until I finally realized today

That I've cried my last tear for you
Wasted my last year on you
There's no trace of the heartache I knew
It's been raining pain since you walked out
But, baby, that's all over now
'Cause I've cried my last tear for you

Well, I used to lay alone in bed
With my pillow soaking wet
And all of those lonely nights
I thought there was no end in sight
I cried my heart out over you
But then I cried the hurt out too
It took a while, but now I'll be alright

But I've cried my last tear for you
Wasted my last year on you
There's no trace of the heartache I knew
Well, it's been raining pain since you walked out
But, baby, that's all over now
'Cause I've cried my last tear for you
Yes, baby, I've cried my last tear for you",I've Cried My Last Tear For You,Ricky Van Shelton III,1990,10,2:28,Track 'A1',Album,True
15,16,Reba McEntire,"We lie in the dark
I know you're awake
The only sounds are the sounds this old house makes
Oh how I long, I long to hear your voice

Desperate to talk
Yearning to touch
Burning inside 'cause I want you so much
So I say I need you
And leave you no choice

You lie
You don't wanna hurt me, so you lie
Buy a little time
And I go along, what else I can do?
Maybe it's wrong
But you know how much I love you
So you lie
Till you can find a way to say goodbye
You lie

How long until
You just can't go on
And the urge to break loose is just too strong
You should let go, if that's what you wanna do
Oh, but you don't know
If it's the right thing to do

You lie
Oh you lie
Oh you lie",You Lie,You Lie,1990,2,3:58,Track 'A',Single,True
16,17,Dan Seals,"C'mon and let the good times roll
We're gonna stay here till we soothe our soul
If it takes all night long
Yeah, c'mon and let the good times roll
We're gonna stay here till we soothe our soul
If it takes all night long

I could tell ya...

The evening sun is sinkin' low
The clock on the wall says it's time to go
I've got my plans, I don't know about you
I tell you exactly what I'm gonna do

Get in the groove and let the good times roll
I'm gonna stay here till I soothe my soul
If it takes all night long
Yeah, everybody let the good times roll
We're gonna stay here till we soothe our soul
If it takes all night long

Yeah, it might be one o'clock, it might be three
Time don't mean that much to me
I ain't felt this good since I don't know when
I might not feel this good again

So everybody let the good times roll
We're gonna stay here till we soothe our soul
If it takes all night long

All night, all night
And all night, and all night long
Somebody said it might take all night long
And all night, all night long

So c'mon and let the good times roll
We're gonna stay here till we soothe our souls
If it takes all night long, yeah.
So everybody let the good times roll
We're gonna stay here till we soothe our souls
If it takes all night long.

And all night, and all night
And all night, all night long
Somebody said it might take all night long
And all night, all night long",Good Times,Good Times,1990,2,3:34,Track 'A',Single,True
17,18,K. T. Oslin,"Come next Monday
I'm goin' to bed early
I won't talk dirty for a week or two
Goin' on a diet
Just like sugar, honey
Come next Monday
I'm gonna give up on you

(Givin' it up) (Givin' it up)

X-rays show some
Excess baggage
Too much work for a little hard to do
Self-denial
Is never easy baggage
But Come next Monday
I'm gonna give up on you

Ain't gonna call you
After a day or two
Ain't gonna miss you honey
An even if I do

I'll never tell you
You'll never ever know
How hard it is
To let you go

Come next Monday
I hope I'm a little bit stronger
Some of the mondays that I've been through
Tempation Tuesday
Might be sorry
But come next Monday
I'm gonna give up on you

Ain't gonna call you
After a day or two
Ain't gonna miss you honey
An even if I do

I'll never tell you
You'll never ever know
How hard it is
To let you go

Come next Monday
I'm goin' to bed early
I won't talk dirty for a week or maybe two
I'm goin' on a diet
Just like sugar, honey
Come next Monday
I'm gonna give up on you

(Givin' it up)
Come next Monday
I'm gonna give up you

(Givin' it up)
I'm givin' it up

(Come next Monday)

Come next Monday

(Come next Monday)

I'm gonna give up on you
(Givin' it up)
I'm givin' it up
(Come next Monday)

I'm gonna give up on you
I'm givin' it up
Come next Monday
I'm givin' it up
I'm givin' up on you",,,,,,,,
18,19,Highway 101,"You walked out on a good love
And you found somebody new
And now the one that turned your head
Is turning her back on you

Who's lonely now, who's heart is hurting
I've had my share of those blues
Who's lonely now, who's head is reelin'
You're finally feelin' it too
Now you need a little sympathy
You never shoulda walked out on me
Who's lonely now

I feel a whole lot better
I got a new attitude
So you can take my crying towel
And carry it home with you

Who's lonely now, who's heart is hurting
I've had my share of those blues
Who's lonely now, who's head is reelin'
You're finally feelin' it too
Now you need a little sympathy
You never shoulda walked out on me
Who's lonely now

When your rejected, you feel neglected, its true
In your condition, you need attention
And you know I'd like to help, but I'm seeing someone else
Who's lonely now

Now you know I'd like to help, but I'm seeing someone else

Who's lonely now, who's heart is hurting
I've had my share of those blues
Who's lonely now, who's head is reelin'
You're finally feelin' it too
Now you need a little sympathy
You never shoulda walked out on me
Who's lonely now",Who's Lonely Now (LP Version),Who's Lonely Now,1989,2,3:24,Track 'A',Single,True
19,20,Holly Dunn,"The way that you touched me made me believe
You never love any other the way that you loved me
When you said forever I thought it was true
We'd be together our whole lives through
Well, I got to hand it to you

You really had me going, stringing me along
You really had me going, baby
And now I'm gone.
You put one over on me said I'm the only one
You really had me going, baby
And now I'm gone

You never thought I'd see you in town
Walking and talking and holding the new love you found
You had the laugh when the joke was on me
But you're going cry when you get to see
The way that I love when I leave

You really had me going, stringing me along
You really had me going, baby
And now I'm gone.
I never saw it coming that you could do me wrong
You really had me going, baby

Oh you proved you're good with a lie
Are you that good with goodbye You really had me

You really had me going, stringing me along
You really had me going, baby
And now I'm gone.
And now I'm gone, and now I'm gone",You Really Had Me Going,You Really Had Me Going,1990,2,2:48,Track 'A',Single,True
20,21,Travis Tritt,"Baby, close that suitcase you've been packin'
Just sit down and talk to me awhile
I know you tried to tell me what was lackin'
But I guess I must have missed it by a mile

Well, this time girl I swear to you I'll listen
Help me understand where I went wrong
It's hard to find myself in this position
Scared that I'll go crazy once you're gone

Help me hold on to what we had
Once our love was strong, it can be again
You said it takes two to make love last
You were right all along, so help me hold on

What have I got to do to make it better
What have I got to do to make you see
That even though I promised you forever
I never knew how hard that would be

I realize I took your love for granted
But I've learned that love worth having don't come free
And I'll pay any price it takes to keep you
Satisfied and staying here with me

Help me hold on to what we had
Once our love was strong, it can be again
You said it takes two to make love last
You were right all along, so help me hold on

Help me hold on to what we had
Once our love was strong, it can be again
You said it takes two to make love last
You were right all along, so help me hold on
You were right all along, so help me hold on",Help Me Hold On,Help Me Hold On,1990,2,3:24,Track 'A',Single,True
