,Rank,Artist,Lyrics,Title,album_name,release_date,total_tracks,duration,track_number,album_single,chart
209,N/A,Emmylou Harris,"(Carlene Carter - Susanna Clark)

There he goes gone again
This same old story's gotta come to an end
Lovin' him was like a one way street
But I'm gettin' off where the crossroads meet.

It's a quarter moon in a ten cent town
It's time for me to lay my heartaches down
Saturday night I'm gonna make myself a name
Take a month of Sundays to try and explain.

It's gonna be easy to fill the heart of a thirsty woman
Harder to kill the ghost of a no good man
And I'll be ridin' high
In a fandangled sky.

It's gonna be easy, it's gonna be easy
It's gonna be easy from now on.

--- Instrumental ---

Raw as a whip but clean as a bone
Soft to the touch when you take me home
When the morning comes and it's time for me to leave
Don't worry 'bout me, I've got a wild card up my sleeve.

It's gonna be easy to fill the heart of a thirsty woman
Harder to kill the ghost of a no good man
And I'll be ridin' high
In a fandangled sky.

It's gonna be easy, it's gonna be easy
It's gonna be easy from now on...",Easy From Now On,Profile / Best Of Emmylou Harris,1978,12,3:07,Track 'A6',Single,False
210,N/A,Emmylou Harris,"(Ira Louvin/Charlie Louvin)

If I could only win your love
I'd make the most of everything
I'd proudly wear your wedding ring
My heart would never stray when you're away.

If I could only win your love
I'd give my all to make it live
You'll never know how much I give
If I could only win your love.

Oh how can I ever say
How I crave your love when you're gone away
Oh how can I ever show
How I burn inside when you hold me tight.

If I could only win your love
I'd give my all to make it live
You'll never know how much I give
If I could only win your love.

Oh how can I ever say
How I crave your love when you're gone away
Oh how can I ever show
How I burn inside when you hold me tight.

If I could only win your love
I'd give my all to make it live
You'll never know how much I give
If I could only win your love...",If I Could Only Win Your Love,Profile / Best Of Emmylou Harris,1978,12,3:51,Track 'B2',Single,False
211,N/A,Emmylou Harris,"(Billy Sherill)

I know that somewhere there's someone you love more than me 
Someone you love more than me
And I hate to say it, but you have a right to be free
I know that's the way it should be.

But I'm too far gone
Too far gone
I've loved you so much for so long
And I'm too far gone.

If ever your new love should hurt you or make you feel blue
Hurt you or make you feel blue
Just remember your old love will still be around loving you
I'll be around loving you.

'Cause I'm too far gone
Too far gone
I love you so much for so long
And I'm too far gone...",Too Far Gone,Profile / Best Of Emmylou Harris,1978,12,2:35,Track 'B3',Single,False
212,N/A,Emmylou Harris,"We came out west together with a common desire
The fever we had might've set the west coast on fire
Two months later got a troublin' mind
Oh, my baby moved out and left me behind
But it's all right 'cause it's midnight
And I got two more bottles of wine

The way he left sure turned my head around
Seemed like overnight he just up and put me down
Well, ain't gonna let it bother me today
I've been a workin' and I'm too tired anyway
But it's all right 'cause it's midnight
And I got two more bottles of wine

Well, I'm sixteen hundred miles from the people I know
I've been doin' all I can but opportunity sure comes slow
Well, I'd be in the sun all day
But I'm sweepin' out a warehouse in West LA
But it's all right 'cause it's midnight
And I got two more bottles of wine

I'm sixteen hundred miles from the people I know
I've been doin' all I can but opportunity sure comes slow
Well, I'd be in the sun all day
But I'm sweepin' out a warehouse in West LA
But it's all right 'cause it's midnight
And I got two more bottles of wine

Yes, it's all right 'cause it's midnight
And I got two more bottles of wine

Yes, it's all right 'cause it's midnight
And I got two more bottles of wine...",Two More Bottles Of Wine,Profile / Best Of Emmylou Harris,1978,12,3:28,Track 'B4',Single,False
213,N/A,Emmylou Harris,"I don't want to hear a love song
I got on this airplane just to fly
And I know there's life below
But all that it can show me
Is the prairie and the sky

And I don't want to hear a sad story
Full of heartbreak and desire
The last time I felt like this
It was in the wilderness and the canyon was on fire
And I stood on the mountain in the night and I watched it burn
I watched it burn, I watched it burn

I would rock my soul in the bosom of Abraham
I would hold my life in his saving grace
I would walk all the way from Boulder to Birmingham
If I thought I could see, I could see your face

Well you really got me this time
And the hardest part is knowing I'll survive
I have come to listen for the sound
Of the trucks as they move down
Out on ninety five
And pretend that it's the ocean
Coming down to wash me clean, to wash me clean
Baby do you know what I mean

I would rock my soul in the bosom of Abraham
I would hold my life in his saving grace
I would walk all the way from Boulder to Birmingham
If I thought I could see, I could see your face
If I thought I could see, I could see your face",Boulder To Birmingham,Profile / Best Of Emmylou Harris,1978,12,3:05,Track 'B5',Single,False
214,N/A,Emmylou Harris,"Hello stranger
Put your loving hand in mine
Hello stranger
Put your loving hand in mine
You are a stranger
And you're a friend of mine

Get up, rounder
Let a working girl lay down
Get up, rounder
Let a working girl lay down
You are a rounder
And you're all out and down

Now every time
I ride the four and six street cars
Every time
I ride the four and six street cars
I can see my baby
Peeping through the bars

Well, he bowed his head
And he waved both hands at me
He bowed his head
And he waved both hands at me
He's prison bound
And longing to be free

Well I'll see you
When your troubles are like mine
I'll see you
When your troubles are like mine
Yes, I'll see you
When you haven't got a dime

Weeping like a willow
And mournin' like a dove
Weeping like a willow
And mournin' like a dove
There's a man of country
That I really love

Well hello stranger
Put your loving hand in mine
Hello stranger
Put your loving hand in mine
You are a stranger
And you're a friend of mine...",Hello Stranger,Profile / Best Of Emmylou Harris,1978,12,3:32,Track 'B6',Single,False
215,N/A, Ronnie Milsap,"It's not over when you stop crying
And it's the end when you say goodbye
And it's not finally done when you just walk away from someone
'Cause love takes a long time, it takes such a long time to die.

There'll be times when you're alone, you'll softly speak her name
Each one's just about left you one time
Day-dreaming through the glass, you'll see pictures from the past
'Cause love takes a long time, it takes such a long time to die.

It's so hard to shut the door
When mem'ries won't stay behind
They'll come around to remind you
There's love still locked inside.

It's not over when you stop crying
And it's the end when you say goodbye
And it's not finally done when you just walk away from someone
'Cause love takes a long time, it takes such a long time to die...",Love Takes A Long Time To Die,What Goes On When The Sun Goes Down,1975,2,2:38,Track 'B',Single,False
216,N/A,Ronnie Milsap,"Looking back into the world we knew
When love was such a sweet surprise
Was it beautiful how strangers came to lovers
Like magic right before our eyes.

Strangers become friends and friends become lovers
But the same fire that warms the heart can burn
Then it's lovers, friends, strangers again
Ain't it funny how the circle turns.

And looking back I'd do it all again
Although the story's sad but true
Even lovers can be strangers once again
Stranger still I keep on loving you.

Strangers become friends and friends become lovers
But the same fire that warms the heart can burn
Then it's lovers, friends, strangers again
Ain't it funny how the circle turns.

Ain't it funny how the circle turns...","Lovers, Friends And Strangers","(I'm A) Stand By My Woman Man / Lovers, Friends And Strangers",1976,2,2:56,Track 'B',Single,False
217,N/A,Mary Kay Place,,Streets Of This Town (Ode To Fernwood),Baby Boy / Streets Of This Town (Ode To Fernwood),1976,2,3:04,Track 'B',Single,False
218,N/A,Jim Ed Brown,,Love Was What We Had,I Don't Want To Have To Marry You,1976,10,2:53,Track 'A1',Album,False
219,N/A,Jim Ed Brown,,I've Rode With The Best,I Don't Want To Have To Marry You,1976,10,3:00,Track 'A2',Album,False
220,N/A,Jim Ed Brown,,I'm Leaving It All Up To You,I Don't Want To Have To Marry You,1976,10,3:03,Track 'A4',Album,False
221,N/A,Jim Ed Brown,"Saying hello, saying I love you, saying goodbye.

Oh, I've had my share of strangers that turned into lovers
Then turned back to strangers again
Oh, I lost then in a crowd of sad passer's by
Saying hello, saying I love you, saying goodbye.

Yes it's a long way from nowhere to the place where we're standing
But baby, baby we've finally arrived
After traveling separate highways, taking all the dead-end rights
Saying hello, saying I love you, saying goodbye.

Oh baby, I hear you, I hear you and I really do believe it
I finally do believe it in my heart
Let's close all the doors behind us and route the night around us
Baby, now don't say a word.

Let's just make love to each other and leave the world outside
Saying hello, saying I love you, saying goodbye.
Let's just make love to each other and leave the world outside
Saying hello, saying I love you, saying goodbye.

Saying hello, saying I love you, saying goodbye. 

Saying hello, saying I love you, saying goodbye...","Saying Hello, Saying I Love You, Saying Goodbye",I Don't Want To Have To Marry You,1976,10,2:38,Track 'A5',Album,False
222,N/A,Jim Ed Brown,,My Heart Cries For You,I Don't Want To Have To Marry You,1976,10,2:27,Track 'B1',Album,False
223,N/A,Jim Ed Brown,,"One Man Woman, One Woman Man",I Don't Want To Have To Marry You,1976,10,2:35,Track 'B2',Album,False
224,N/A,Jim Ed Brown,,Burning Bridges,I Don't Want To Have To Marry You,1976,10,3:09,Track 'B3',Album,False
225,N/A,Jim Ed Brown,,There's Always A Goodbye,I Don't Want To Have To Marry You,1976,10,2:48,Track 'B4',Album,False
226,N/A,Jim Ed Brown,"Have I told you lately that I love you
Could I tell you once again somehow
Have I told with all my heart and soul how I adore you
Well darling, I'm telling you now.

This heart would break in two if you refuse me
I'm no good without you anyhow
Dear, have I told you lately that I love you
Well darling, I'm telling you now.

Have I told you lately how I miss you
Every dream I dream is you somehow
Have I told you why the nights are long
When you're not with me
Well darling, I'm telling you now.

This heart would break in two if you refuse me
I'm no good without you anyhow
Dear, have I told you lately that I love you
Well darling, I'm telling you now...",Have I Told You Lately That I Love You,I Don't Want To Have To Marry You,1976,10,3:42,Track 'B5',Album,False
227,N/A,Freddy Fender,,Take Her A Message! I'm Lonely,Living It Down,1976,2,2:30,Track 'B',Single,False
228,N/A,Billie Jo Spears,,Everytime Two Fools Collide,What I've Got In Mind,1976,2,2:39,Track 'B',Single,False
229,N/A,Merle Haggard,"I remember it all started in 1929 when me and Diana had gone to Alaska
To homestead some of that free government land

Forty miles from the nearest gravel road
We cut our life in the Ponderosa pines
We sweated hard to beat the winter snow
But the cabin's up and we've got lots of times

What have you got planned tonight, Diana?
Would you consider laying in my arms
I love you more than ever now, Diana
I'm sure you're the reason I was born

Jim was born the first year we were here
Look at him, my God he's almost grown
And the baby's in the cradle fast asleep
Just think in no time he'll be up and gone

What have you got planned tonight, Diana?
Would you consider laying in my arms
I love you more than ever now, Diana
I'm sure you're the reason I was born

Well, time sure does fly, doesn't it Diana?
It's been almost two years now since, since you've been gone
Speaking of time, I guess you know that mine's about up
I'm gonna see you tonight
Just another breath or two and I'll be home
By the way

What have you got planned tonight, Diana?
Would you consider laying in my arms
I love you more than ever now, Diana
I'm sure you're the reason I was born",What Have You Got Planned Tonight Diana,The Roots Of My Raising,1976,10,2:44,Track 'A2',Album,False
230,N/A,Merle Haggard,"Ever in dreams with you I'll sway dear
To the waltz you saved for me
Ever in dreams while I'm away dear
I'll hear this melody

Whisper goodbye and gently say dear
That in all the days to be
You will sometimes remember
The waltz you saved for me",The Waltz You Saved For Me,The Roots Of My Raising,1976,10,3:06,Track 'A3',Album,False
231,N/A,Merle Haggard,"I've been in here so long I forgot what I did wrong
Just a kid when they put me here inside

I don't have long to live and Lord what I would give
Mhm, just to walk on the outside

Phones would even end when they put me in this pen
And dad told me planes would never fly

There's a lot I've never seen except here on this screen
Lord, give me a walk on the outside

Now Lord, I'm not complained
But I'd walked at least a million miles behind these walls
I'd just like to see what's on this other side, that's all

There's a lot I've never seen except here on this screen
Lord, give me a walk on the outside

There's a lot I've never seen except here on this screen
Lord, lord give me a walk on the outside",Walk On The Outside,The Roots Of My Raising,1976,10,2:23,Track 'A4',Album,False
232,N/A,Merle Haggard,,Gamblin' Polka Dot Blues,The Roots Of My Raising,1976,10,3:43,Track 'A5',Album,False
233,N/A,Merle Haggard,"One night when the moon was bright o'er a moonlight glade
That is where I found my little Cherokee maid
The me'mry of that night of love is lingering yet
And I know I never will forget

My little Cherokee maiden I love her so and though we're far apart
I know I'll never be tradin' my love for her for anybody else's heart
Someday I'll make a trip back to the Cherokee strip
And I'll carry her away with me
And straight as an arrow flies, we'll ride to paradise
My sweet little chickadee, my little Cherokee maiden and me

My little Cherokee maiden I love her so and though we're far apart
I know I'll never be tradin' my love for her for anybody else's heart
Someday I'll make a trip back to the Cherokee strip
And I'll carry her away with me
And straight as an arrow flies, we'll ride to paradise
My sweet little chickadee, my little Cherokee maiden and me",Cherokee Maiden,The Roots Of My Raising,1976,10,2:37,Track 'B1',Album,False
234,N/A,Merle Haggard,"If he ever gets to you I know he'll ignite the flame
And it hurts to know how close he really came
Last night you both kept dancing when the music ceased to play
Is it all over, do you still love me or am I standing in your way?

Tell me the way you feel, I've got to know
Should I stay and keep trying or should I go?
Last night he almost made it, he's still on your mind today
Is it all over, do you still love me or am I standing in your way?

Tell me the way you feel, I've got to know
Should I stay and keep trying or should I go?
Last night he almost did it, he's still on your mind today
Is it all over, do you still love me or am I standing in your way?",Am I Standing In Your Way,The Roots Of My Raising,1976,10,2:56,Track 'B2',Album,False
235,N/A,Merle Haggard,"There's a place where mother nature's got it all together
She knows just when to let wild flowers bloom
Somehow she always seems to know exactly what she's doin'
And The Lord saw fit to furnish elbow room

Have you ever been down to Colorado?
I spend a lot of time there in my mind
And if God doesn't live in Colorado
I'll bet that's where He spends most of his time

I'd love to be there watching early in the morning
The sun comes up and crowns the mountain king
If by chance you dare to be high upon a mountain
I swear that you can hear the angels sing

Have you ever been down to Colorado?
I spend a lot of time there in my mind
And if God doesn't live in Colorado
I'll bet that's where He spends most of his time",Colorado,The Roots Of My Raising,1976,10,2:53,Track 'B3',Album,False
236,N/A,Merle Haggard,"I can't stand to see a good man go to waste
One who never combs his hair or shaves his face
A man who leans on wine over love that's told a lie
Oh, it tears me up to see a grown man cry

So I never go around mirrors
I can't stand to see me without you by my side
I never go around mirrors
'Cause I've got a heartache to hide

I never go around mirrors
I can't stand to see me without you by my side
I never go around mirrors
'Cause I've got a heartache to hide
And it tears me up to see a grown man cry",I Never Go Around Mirrors,The Roots Of My Raising,1976,10,3:28,Track 'B4',Album,False
237,N/A,Merle Haggard,"With friends around and even pals that I know are true
Still I'm lonely, homesick and blue
There's no one who can cheer me when I'm alone
Longing for my Mississippi home

Way down on the delta on that Mississippi shore
In that muddy water I long to be once more
When that shadows creep about and the whippoorwill call
You can hear old mammy shout, ""Come in here you all""

Way down on the levee strolling in the pale moon light
You can see those steamboats and fields of snowy white
There's a feeling I can't lose, muddy water in my shoes
When I get those Mississippi Delta blues

I long to hear them singing songs, them old melodies
Swanee River and Ol' Black Joe
That sweet magnolia perfume floating on the breeze
Way down south is where I long to go

Hey, way down on the delta on that Mississippi shore
In that muddy water I long to be once more
When that shadows creep about and the whippoorwill call
You can hear old mammy shout, ""Come in here you all""

Way down on the levee strolling in the pale moon light
You can see those steamboats and fields of snowy white
There's a feeling I can't lose, muddy water in my shoes
When I get those Mississippi Delta blues",Mississippi Delta Blues,The Roots Of My Raising,1976,10,2:39,Track 'B5',Album,False
238,N/A,Mickey Gilley,,Where Do You Go To Lose A Heartache,Don't The Girls All Get Prettier At Closing Time,1976,2,2:56,Track 'B',Single,False
239,N/A,Eddie Rabbitt,"Back upon an old dirt road 
Next to a swamp full of toads
Was a slanted wood shack with three little kids and a mama

Papa died in '63
Left little Jenny and me
To plant those taters and pull up another tomorrow

Rocky mountain music
Fills my memory
Rocky mountain music
Papa, can I hear you playing for me?

Little brother was never quite right
He used to sit on the floor in the sunlight
Play with the dust that danced on the beams in the window

And sister had to cook and clean
'Cause Mama, she got sick and lean
Sometimes I think she just died away missing Papa

Rocky mountain music
Fills my memory
Rocky mountain music
Mama, can I hear you singing to me?

Well, everything has changed today 
And little brother, he was taken away
And sister, she married a soldier and lives in Toledo

And me, I'm in a Nashville bar 
And I've never been so far
From that old gravel road and the rivers that run through my memory

Rocky mountain music
Fills my memory
Rocky mountain music
Brother, can I hear you calling me?

Rocky mountain music
Fills my memory
Rocky mountain music
Papa, can I hear you playing for me?",Rocky Mountain Music,The Best Of Eddie Rabbitt,1979,10,2:23,Track 'A2',Single,False
240,N/A,Eddie Rabbitt,"Maybe it's a man's world, but girls make it go 'round
But I wouldn't give a nickel for my peace of ground if it
Weren't for my lady standing on it, sweet and proud
Come on, lady, love me now

'Cause I'm gonna do you right tonight
Turn on your light tonight
I'll be right back to ease your mind
Honey, I'm gonna take my time
I'm gonna do you right tonight

Oh, hazel-eyed lady, you got the softest hands
You make me feel like I've got more than any man, and if you
Give me the time, honey, I'll love you more
Than anyone who came before

Then I'm gonna do you right tonight
Turn on your light tonight
I'll be right back to ease your mind
Honey, I'm gonna take my time
I'm gonna do you right tonight

Do you, do you right tonight
Do you, do you right tonight
I'll be right back to ease your mind
Honey, I'm gonna take my time
I'm gonna do you right tonight

Do you, do you right tonight
Do you, do you right tonight
I'll be right back to ease your mind
Honey, I'm gonna take my time
I'm gonna do you right tonight

Do you, do you right tonight
Do you, do you right tonight
I'll be right back to ease your mind
Honey, I'm gonna take my time
I'm gonna do you right tonight",Do You Right Tonight,The Best Of Eddie Rabbitt,1979,10,3:33,Track 'A3',Single,False
241,N/A,Eddie Rabbitt,"I've got two dollars in the jukebox
And five dollars in a bottle
And ten more just in case that don't do the trick

And I'll be dead broke tomorrow morning
With heart-aches by the dozen
And a lady on my mind that's driving me crazy

Why do I, why do I
Need to see those blue eyes
Lookin' at me that way again?
After the way she did me, it's a sin

How could she, how could she
Just walk out and leave me?
After all these nights in her arms
Look where I am

And I've got two dollars in the jukebox
And five dollars in a bottle
And ten more just in case that don't do the trick

And I'll be dead broke tomorrow morning
With heart-aches by the dozen
And a lady on my mind that's driving me crazy

I've got two dollars in the jukebox
And five dollars in a bottle
And ten more just in case that don't do the trick

And I'll be dead broke tomorrow morning
With heart-aches by the dozen
And a lady on my mind that's driving me crazy
I've got a lady on my mind that's driving me crazy",Two Dollars In The Jukebox,The Best Of Eddie Rabbitt,1979,10,2:30,Track 'A4',Single,False
242,N/A,Eddie Rabbitt,"Thought I was over you thought I could start anew
I got a new job, new friends on the other side of town
But here you are again just like a long lost friend
And when I touched your hand it started all over again

I can't help myself here comes that feeling
Just like a raging river rushing over me
No I can't help myself here I go falling
Head over heels falling for you again

Why does this heart of mine go crazy every time
When I know down deep inside you don't love me
But when you're standing there, wind blowing through your hair
Well I'm starting to make the same old mistake again

I can't help myself here comes that feeling
Just like a raging river rushing over me
No I can't help myself here I go falling
Head over heels falling for you again
Head over heels falling for you again",I Can't Help Myself,The Best Of Eddie Rabbitt,1979,10,2:22,Track 'A5',Single,False
243,N/A,Eddie Rabbitt,"When we look at each other now,
There's no love in our eyes.
And when we talk to each other now,
We just criticize.

And we're trying to be lovers now,
We never had to try before.
Where's that feeling,
That special feeling,
We're not feeling any more?

We can't go on, living like this,
Just going through the motions 
Every time we kiss.
Just think of all the good times we miss.
Let's get back together,
We can't go on, living like this.

And tonight, once again, I'll reach for you,
And you'll give yourself to me,
Like you always do,
And we'll fall away, unsatisfied,
And lonely at the end.
It was so good, once upon a time,
Can't we love that way again?

We can't go on, living like this,
Just going through the motions 
Every time we kiss.
Just think of all the good times we miss.
Let's get back together,
We can't go on, living like this.

Let's get back together,
We can't go on, living like this.",We Can't Go On Living Like This,The Best Of Eddie Rabbitt,1979,10,3:10,Track 'B1',Single,False
244,N/A,Eddie Rabbitt,"We shouldn't be together tonight
But here we are
I shouldn't taste the thrill of your kiss
Here in the dark
'Cause we're not free to be this free or go this far

Hearts on fire burnin' for each other
Goin' down in flames somewhere in the night
Stealin' love again when we're together
It's too late now, we can't put it out
Hearts on fire

You shouldn't feel this good in my arms
But you do
I shouldn't whisper these things in your ear
But they're true
So wrong or right, I'll stay tonight with you

Hearts on fire burnin' for each other
Goin' down in flames somewhere in the night
Stealin' love again when we're together
It's too late now, we can't put it out
Hearts on fire",Hearts On Fire,The Best Of Eddie Rabbitt,1979,10,3:29,Track 'B2',Single,False
