,Rank,Artist,Lyrics,Title,album_name,release_date,total_tracks,duration,track_number,album_single,chart
393,N/A,Stonewall Jackson,"Slowly I'm falling more in love with you
Slowly you're winning a heart that can be true
Now I can't hide my feelings no matter what I do
For slowly I'm falling more in love with you

More and more I need you and want you by my side
More and more I love you as each day passes by
My heart I know you're stealing, I hope that you'll be true
For slowly I'm falling more in love with you

Slowly I'm falling more in love with you
Slowly you're winning a heart that can be true
Now I can't hide my feelings no matter what I do
For slowly I'm falling more in love with you",Slowly,Slowly / Can't Hang Up The Phone,1962,2,,Track 'A',Single,False
394,N/A,Claude King,,Shopping Center,I've Got The World By The Tail,1962,2,,Track 'B',Single,False
395,N/A,Eddy Arnold,,Lonely Balladeer,Lonely Balladeer / Yesterday's Memories,1963,2,,Track 'A',Single,False
396,N/A,Leon McAuliff,,When My Blue Moon Turns Gold Again,Swingin' Western Strings of Leon McAuliff,1962,12,,Track 'A2',Album,False
397,N/A,Leon McAuliff,,Columbus Stockade Blues,Swingin' Western Strings of Leon McAuliff,1962,12,,Track 'A3',Album,False
398,N/A,Leon McAuliff,,Blue Eyes Crying In The Rain,Swingin' Western Strings of Leon McAuliff,1962,12,,Track 'A4',Album,False
399,N/A,Leon McAuliff,,Detour-Green Light,Swingin' Western Strings of Leon McAuliff,1962,12,,Track 'A5',Album,False
400,N/A,Leon McAuliff,,Slippin' Around,Swingin' Western Strings of Leon McAuliff,1962,12,,Track 'A6',Album,False
401,N/A,Leon McAuliff,,Walking The Floor Over You,Swingin' Western Strings of Leon McAuliff,1962,12,,Track 'B1',Album,False
402,N/A,Leon McAuliff,,My Adobe Hacienda,Swingin' Western Strings of Leon McAuliff,1962,12,,Track 'B2',Album,False
403,N/A,Leon McAuliff,,My Little Red Wagon,Swingin' Western Strings of Leon McAuliff,1962,12,,Track 'B3',Album,False
404,N/A,Leon McAuliff,,Texarkana Baby,Swingin' Western Strings of Leon McAuliff,1962,12,,Track 'B4',Album,False
405,N/A,Leon McAuliff,,Foggy River,Swingin' Western Strings of Leon McAuliff,1962,12,,Track 'B5',Album,False
406,N/A,Leon McAuliff,,Jambalaya (On The Bayou),Swingin' Western Strings of Leon McAuliff,1962,12,,Track 'B6',Album,False
407,N/A,Marty Robbins,"You treat me like the ground you walk around on
You say our love's not like it was before
And even though you hurt me, when it's over
You know that I'll come runnin' back for more

So I hope you learned a lot from all your heartaches
'Cause their bound to come to you, just wait and see
And I hope you learned a lot from all your heartaches
And when you do I hope that you'll come runnin' back to me

Sometimes I think you really like to hurt me
Your only happy when you make me blue
But every time you do I keep remembering
Someday someone will do the same to you

And I hope you learned a lot from all your heartaches
'Cause their bound to come to you, just wait and see
Oh, I hope you learned a lot from all your heartaches
And when you do I hope that you'll come runnin' back to me",I Hope You Learn A Lot,Not So Long Ago,1963,2,,Track 'B',Single,False
408,N/A,George Hamilton IV,"If you don't wanna kiss me say so baby
Somebody else will somebody else will well you know they will
If you don't wanna kiss me say so baby
Somebody else will somebody else could kiss me better

Now I ain't a gonna beg you for your love anymore
Ever since the first time I have done learned the score
I thought I had to have you once but that's in the past
And since I found out I'm free from you well I'm free at last

If you don't wanna hold me say so baby
Somebody else will somebody else will well you know they will
If you don't wanna hold me say so baby
Somebody else will somebody else could hold me better

If you don't wanna be mine say so baby
Somebody else will somebody else will well you know they will
If you don't wanna be mine say so baby
Somebody else will somebody else could love me better",If You Don't Somebody Else Will,If You Don't Somebody Else Will / There's More Pretty Girls Than One,1963,2,1:46,Track 'A',Single,False
409,N/A,Marty Robbins,,You're Humbuggin' Me,Cigarettes And Coffee Blues / You're Humbuggin' Me,1958,2,,Track 'B',Single,False
410,N/A,Claude King,"Tiger woman I heard that you were back in town (tiger woman)
Tiger woman I heard that you were back in town (tiger woman)
Just like a tiger woman girl you're still puttin' puttin' around
Tiger woman I wonder why I love you still (tiger woman)
Tiger woman I wonder why I love you still (tiger woman)
Just like a tiger woman I guess you come back home for the kill
Well you tore me up in little bitty pieces you dragged me all over the ground

I was a big man but now I ain't nothin' you sure know how to put a good man down
Tiger woman put your long short claws out of me (tiger woman)
Tiger woman put your long short claws out of me (tiger woman)
Just like a tiger woman what you leave ain't so good to see
(Guitar)
Well you tore me up...
Tiger woman well you better just keep movin' on (tiger woman)
Tiger woman I said you better just keep movin' on (tiger woman)
Just like a tiger tamer I'm gonna put you where you belong
(Hey looky here woman I don't like the way you come slink around me
I don't like that look you've got in your eye nor neither...)",Tiger Woman,Wolverton Mountain,1999,16,2:55,Track '1',Compilation,False
411,N/A,Claude King,"They say don't go on Wolverton Mountain if you're looking for a wife
Cause Clifton Clovers has a pretty young daughter
He's mighty handy with a gun and a knife
Her tender lips are sweeter than honey and Wolverton Mountain protects her there
The bears and the birds tell Clifton Clovers if a stranger should enter there

All of my dreams are on Wolverton Mountain I want his daughter for my wife
I'll take my chances and climb that mountain
Though Clifton Clovers he might take my life
Her tender lips are sweeter than honey...

I'm going up on Wolverton Mountain it's too lonesome down here below
It's just not right to hide his daughter from the one who loves her so
Her tender lips are sweeter than honey...
And I don't care about Clifron Clovers I'm gonna climb up on his mountain
I'm gonna take the girl I love I don't care about Clifron Clovers
I'm gonna climb up on that mountain and I'll get the one I love",Wolverton Mountain,Wolverton Mountain,1999,16,2:57,Track '2',Compilation,False
412,N/A,Claude King,"Way down on Mississippi big river came a mighty big man
He built a town on that river and owned everything in that glen
He fell in love and married a girl she was young and mean and wild
He tried to tame her but it couldn't been done it was too late to devil's own child
Big river (keep on growin' growin') big man (keep on growin' growin')
Big river (keep on growin' growin') big man (keep on growin' growin')
The love you have for greed and power surely pull you down
You lose your friends you lose your soul in that darn city to big man's town
Big river (keep on growin' growin') big man (keep on growin' growin')
Big river (keep on growin' growin') big man (keep on growin' growin')

Look down in the water all around you hear the steamboat whistle blow
Come on big man get a movin' you got a long way to go
Just like a big river big man you gotta move on and on
Take your money keep your dough you're gonna be left all alone
Big river (keep on growin' growin')...","Big River, Big Man",Wolverton Mountain,1999,16,2:24,Track '3',Compilation,False
413,N/A,Claude King,,I've Got The World By The Tail,Wolverton Mountain,1999,16,1:57,Track '4',Compilation,False
414,N/A,Claude King,,The Burning Of Atlanta,Wolverton Mountain,1999,16,2:33,Track '5',Compilation,False
415,N/A,Claude King,"The Comancheros are takin' this land
The Comancheros are takin' this land.

Paul Regret from New Orleans
A fast man with a gun
He didn't want to go he had to run
When he shot down the judge's son
Yes, he shot Judge Scofield's son.

With the dark of night he left that town
Never to return again
With a one-way ticket at the end of the line
He was told by a stranger man
The Comancheros are takin' this land.

Then the Comancheros came a-ridin' through the night
Stealin' and a-killin' takin' ever'thing in sight
Nothin' left behind but the blood and the sand
The Comancheros are takin' this land
The Comancheros are takin' this land.

I'll cover every inch of the ground where I stand
I'd die before I'd run
I'm not afraid of any living man
And here I'll make my stand
With a gun I'll make my stand.

He rode into the Comanchero town
Like a wild man on the run
Before he'd leave they'd all be dead
They'd die by his blazin' gun
They died by his blazin' gun.",The Comancheros,Wolverton Mountain,1999,16,2:10,Track '6',Compilation,False
416,N/A,Claude King,,Sheepskin Valley,Wolverton Mountain,1999,16,1:57,Track '7',Compilation,False
417,N/A,Claude King,"Catch a little raindrop (uh huh catch a little raindrop) uh huh
Catch a little raindrop (uh huh) and here's what you should do
Give it to a flower (uh huh give it to a flower) uh huh
Give it to a flower (uh huh) and it will give to you
A little bit of honey (uh huh a little bit of honey) uh huh
A little bit of honey (uh huh) for lips so sweet and true
Catch a little raindrop give it to a flower and a little bee will put it in a tree
And make a little honey for you
I caught a little raindrop (uh huh caught a little raindrop) uh huh
I caught a little raindrop (uh huh) and I gave it on you
'Cause you're my little flower (uh huh you're my little flower) uh huh
You're my little flower (uh huh) and you gave something too
A little bit of honey (uh huh a little bit of honey) uh huh
A little bit of honey (uh huh) from lips so sweet and true
I caught a little raindrop gave it to a flower and a little bee put it in a tree
And made a little honey for you and me",Catch A Little Raindrop,Wolverton Mountain,1999,16,2:15,Track '9',Compilation,False
418,N/A,Claude King,"Well today I'm so weary today I'm so blue
Sad and broken hearted and it's all because of you
Life was so sweet dear life was a song
Now you've gone and left me oh where do I belong
And it's all for the love of a dear little girl
All for the love that sets your heart in a whirl
I'm a man who'd give his life and the joys of this world all for the love of a girl
And it's all for the love of a dear little girl...
All for the love of a girl",All For The Love Of A Girl,Wolverton Mountain,1999,16,2:08,Track '10',Compilation,False
419,N/A,Claude King,,Hey Lucille,Wolverton Mountain,1999,16,2:49,Track '11',Compilation,False
420,N/A,Claude King,,Sam Hill,Wolverton Mountain,1999,16,2:28,Track '12',Compilation,False
421,N/A,Claude King,,Little Buddy,Wolverton Mountain,1999,16,2:23,Track '13',Compilation,False
422,N/A,Claude King,,"Friend, Lover, Woman, Wife",Wolverton Mountain,1999,16,2:55,Track '14',Compilation,False
423,N/A,Claude King,"The grapes in Mary's vineyard are the sweetest on the vine
Old man Oscar Dill lived back in the Tennessee hills
He's got him two or three stills and he makes heavy water
Oh I worked for him one time runnin' sour mash across the line
And he warned me to pay no mind to his three daughters
Yeah one was eighteen and one was twenty two one was just my age
One by one I opened the door to the gilded cage (yes I did now)
He don't know and I ain't gonna tell him what I've done one time
'Cause he thinks he raised three little angels ah I think that's fine
I made love to his sweet Martha and pretty little Caroline
But the grapes in Mary's vineyard are the sweetest on the vine

Now old man Oscar Dill said he wouldn't hesitate to kill
Anybody messin' round his stills or his three daughters
But even so late at night when the moon wasn't shining too bright
I'd sneaked around get brave all right sippin' his heavy water
Yeah one was eighteen...
I made love to his sweet Martha...",Mary's Vineyard,Wolverton Mountain,1999,16,2:43,Track '15',Compilation,False
424,N/A,Claude King,,Chip 'N' Dale's Place,Wolverton Mountain,1999,16,2:58,Track '16',Compilation,False
425,N/A,Cowboy Copas,"Well I went to a turkey roast down the street
The people down there eat like wild geese
I'm on my way, I'm goin' back to Alabam'

Talk about yer people have a whale of a time
Eatin' up chicken' and drinkin' their wine
I'm on my way, I'm goin' back to Alabam'

Now some folks say a tramp won't steal
But I caught three in my corn field
I'm on my way, I'm goin' back to Alabam'

One had a bushel and the other had a peck
One had a roast'n' ear tied round his neck
I'm on my way, I'm goin' back to Alabam'

There comes Sal walkin' down the street
With run down shoes tied to her feet
Good Mornin', honey, stand over there, baby
Get over there, now
Hello Sal, I know you
With a run down slipper and a tore up shoe
I'm on my way, I'm goin' back to Alabam'

When I get ready to leave this earth
I'm gonna look on my money's worth
I'm on my way, I'm goin' back to Alabam'

I'm goin' back to Alabam'!",Alabam,The Unforgettable Cowboy Copas,1963,12,,Track 'A1',Single,False
426,N/A,Cowboy Copas,,"Signed, Sealed, And Delivered",The Unforgettable Cowboy Copas,1963,12,,Track 'A2',Single,False
427,N/A,Cowboy Copas,,The Gypsy Girl,The Unforgettable Cowboy Copas,1963,12,,Track 'A3',Single,False
428,N/A,Cowboy Copas,,There'll Come A Time,The Unforgettable Cowboy Copas,1963,12,,Track 'A4',Single,False
429,N/A,Cowboy Copas,,Flat Top Guitar Blues,The Unforgettable Cowboy Copas,1963,12,,Track 'A5',Single,False
430,N/A,Cowboy Copas,,Cowboy's Meditation,The Unforgettable Cowboy Copas,1963,12,,Track 'A6',Single,False
431,N/A,Cowboy Copas,"When the warships left Manila sailing proudly o'er the sea
All the sailors hearts were filled with fond regret
Looking backward to this island where they spent such happy hours
Making love to every pretty girl they've met

Well, up stopped a little sailor with his pride eyes all aglow
Saying take a look at my girl's photograph
Then the sailors gathered 'round him just to look upon her face
And he said, ""I love my Filipino baby""

She's my Filipino baby, she's my treasure and my pet
Her teeth are bright and pearly and her hair is black as jet
Oh, her lips are sweet as honey and her heart is true I know
She's my darling little Filipino baby, oh, Jimmy

In a little rustic cottage in the port of Philippines
Dwells a lonely little maiden all alone
She is thinking of her true love though he's far across the sea
And her heart beats true for him and him alone

Then one day he whispered, ""Darling, I've come back
From Caroline, I've come back to claim the only girl I love""
And that night there was a wedding while the ships crew
Gathered 'round and he wed his little Filipino baby

She's my Filipino baby, she's my treasure and my pet
Her teeth are bright and pearly and her hair is black as jet
Oh, her lips are sweet as honey and her heart is true I know
She's my darling little Filipino baby",Filipino Baby,The Unforgettable Cowboy Copas,1963,12,,Track 'B1',Single,False
432,N/A,Cowboy Copas,,My Autobiography,The Unforgettable Cowboy Copas,1963,12,,Track 'B3',Single,False
433,N/A,Cowboy Copas,,A Satisfied Mind,The Unforgettable Cowboy Copas,1963,12,,Track 'B4',Single,False
434,N/A,Cowboy Copas,,God Put A Rainbow In The Clouds,The Unforgettable Cowboy Copas,1963,12,,Track 'B5',Single,False
435,N/A,Cowboy Copas,,I Dreamed Of A Hillbilly Heaven,The Unforgettable Cowboy Copas,1963,12,,Track 'B6',Single,False
436,N/A,Don Gibson,,It Was Worth It All,It Was Worth It All / Head Over Heels In Love With You,1963,2,1:59,Track 'A',Single,False
437,N/A,Claude King,"Thought about goin' back to you thought about holdin' you in my arms
Thought about kissing you too and got to my feet in the thought that you cheat Couldn't do it and I backed out
Thought about leaving this city catch the very next plane out of town
Took my suitcases down and got to the door hadn't seen you once more
Couldn't leave you and I backed out
Backed out of it ride into it from the devil to the deep blue sea
Can't live with you and can't live without you don't know what's gonna happen to me
(Don't know what's gonna happen to me)
(Ac.guitar)
Backed out of it ride into it from the devil to the deep blue sea
Can't live with you and can't live without you don't know what's gonna happen to me
Couldn't leave you and I backed out don't know what's gonna happen to me",I Backed Out,Sheepskin Valley,1963,2,,Track 'B',Single,False
438,N/A,Mac Wiseman,,When The Moon Comes Over The Mountain,When The Moon Comes Over The Mountain / Your Best Friend And Me,1963,2,2:25,Track 'A',Single,False
439,N/A,Burl Ives,,How Do You Fall Out Of Love,Mary Ann Regrets,1962,2,3:30,Track 'B',Single,False
440,N/A,The Rooftop Singers,,Hey Boys,Walk Right In!,1963,13,2:33,Track 'A2',Album,False
441,N/A,The Rooftop Singers,,Shoes,Walk Right In!,1963,13,2:05,Track 'A3',Album,False
442,N/A,The Rooftop Singers,"Oh, can't you hear that engine moanin'
As that fast freight goes rollin' by?
Oh, can't you hear that engine moanin'
As that fast freight goes rollin' by?
It's that Houston, Houston Special,
And she's right on time.

Oh, I was standin' on that platform,
And I was ready, ready to go,
Oh, I was standin' on that platform,
And I was ready, ready to go,
And I was waitin' for that Southern,
Southern whistle to blow.

Oh, my mama she done told me,
And my papa done told me, too,
Oh, my mama she done told me,
And my papa done told me, too,
That if you catch that Southern freight train,
It won't be home to you.

(Repeat first verse)",Houston Special,Walk Right In!,1963,13,2:55,Track 'A4',Album,False
443,N/A,The Rooftop Singers,"spoken:
I've got an old Tom Cat
And when he steps out
All the other cats in the neighborhood
They begin to shout

There goes a ring tail Tom
Struttin' round the town
And if you got your heat turned up
You better turn your damper down

Ringtail Tom is a star
He's a boss around this town
He don't allow no other Tom Cats
Come pussy footin' around

Ringtail Tom on the fence
Little pussy cat on the ground
Ringtail Tom com-a-off-a that fence
They start rousin around

Ringtail Tom is a star
He's a natural born crack shot
He finds a new target every night
And he sure does practice alot

And if you got your heat turned up
You better turn your damper down",Tom Cat,Walk Right In!,1963,13,3:16,Track 'A5',Album,False
444,N/A,The Rooftop Singers,,Cool Water,Walk Right In!,1963,13,2:05,Track 'A6',Album,False
445,N/A,The Rooftop Singers,,Somebody Came Home,Walk Right In!,1963,13,2:52,Track 'B1',Album,False
446,N/A,The Rooftop Singers,,You Don't Know,Walk Right In!,1963,13,2:08,Track 'B2',Album,False
447,N/A,The Rooftop Singers,"Stagolee went down to the levee
Just about the break of day.
Saw old Billy a-gamblin', so
He set him down to stay.
Stagolee and Billy they gambled,
Gambled mighty late.
Stagolee drew a seven, Billy
He swore he drew an eight.
Stagolee said to Billy,
""You can't get away with that,
Bad enough to take my money, but
You can't have my Stetson hat.""
Stagolee said to Billy,
""You better run down by the track,
'Cause I ain't gonna shoot you now,
But don't be here when I get back.""

Stagolee, Stagolee,
Meanest boy around.
Stagolee is dealin', boy,
You better lay your money down.
Way down in New Orleans
Got the Lyon's club,
And every step you step,
You're steppin' in Billy the Lyon's blood.

Stagolee went back to his woman,
And he got his forty-four.
""Gonna fix ol' Billy's wagon, so
He won't gamble wrong no more.""
Stagolee went back to the levee,
Billy still hangin' around,
Stagolee drew his gun, and
Poor Billy he went down.

Sheriff said to Stagolee,
""You better leave this town.
If I find old Billy's body,
I'm gonna have to run you down.""
Stagolee said to the Sheriff,
The very words that he said,
""The man I run away from,
He ain't born yet on his mammy's bed.""
Stagolee went to heaven,
And he met St. Peter there.
""Go the other way, boy,
We don't allow no gamblers here.""
Stagolee said to the Devil,
""You better get back on your shelf,
'Cause my name is Stagolee,
And I'm gonna run this place myself.""",Stagolee,Walk Right In!,1963,13,2:26,Track 'B3',Album,False
448,N/A,The Rooftop Singers,,Rained Five Days,Walk Right In!,1963,13,3:12,Track 'B4',Album,False
449,N/A,The Rooftop Singers,,Ham And Eggs,Walk Right In!,1963,13,2:53,Track 'B5',Album,False
450,N/A,The Rooftop Singers,,Ha Ha Thisaway,Walk Right In!,1963,13,2:29,Track 'B6',Album,False
451,N/A,The Rooftop Singers,,Brandy Leave Me Alone,Walk Right In!,1963,13,1:31,Track 'B7',Album,False
452,N/A,Eddy Arnold,,Just A Ribbon,A Million Years Or So,1963,2,2:30,Track 'B',Single,False
453,N/A,Johnny and Jonie Mosby,,You'd Better Go,Mr. & Mrs. Country Music,1965,9,,Track 'A1',Album,False
454,N/A,Johnny and Jonie Mosby,,I'd Fight The World,Mr. & Mrs. Country Music,1965,9,,Track 'A2',Album,False
455,N/A,Johnny and Jonie Mosby,,Charlie\'s Shoes,Mr. & Mrs. Country Music,1965,9,,Track 'A3',Album,False
456,N/A,Johnny and Jonie Mosby,,Who's Been Cheatin' Who,Mr. & Mrs. Country Music,1965,9,,Track 'A4',Album,False
457,N/A,Johnny and Jonie Mosby,,Strawberry Wine,Mr. & Mrs. Country Music,1965,9,,Track 'A5',Album,False
458,N/A,Johnny and Jonie Mosby,,How The Other Half Lives,Mr. & Mrs. Country Music,1965,9,,Track 'B1',Album,False
459,N/A,Johnny and Jonie Mosby,,Keep Those Cards And Letters Coming In,Mr. & Mrs. Country Music,1965,9,,Track 'B2',Album,False
460,N/A,Johnny and Jonie Mosby,,Take Me Home,Mr. & Mrs. Country Music,1965,9,,Track 'B3',Album,False
461,N/A,Claude King,,This Land Is Yours And Mine,The Best Of Claude King,1968,9,,Track 'A1',Single,False
462,N/A,Claude King,"They say don't go on Wolverton Mountain if you're looking for a wife
Cause Clifton Clovers has a pretty young daughter
He's mighty handy with a gun and a knife
Her tender lips are sweeter than honey and Wolverton Mountain protects her there
The bears and the birds tell Clifton Clovers if a stranger should enter there

All of my dreams are on Wolverton Mountain I want his daughter for my wife
I'll take my chances and climb that mountain
Though Clifton Clovers he might take my life
Her tender lips are sweeter than honey...

I'm going up on Wolverton Mountain it's too lonesome down here below
It's just not right to hide his daughter from the one who loves her so
Her tender lips are sweeter than honey...
And I don't care about Clifron Clovers I'm gonna climb up on his mountain
I'm gonna take the girl I love I don't care about Clifron Clovers
I'm gonna climb up on that mountain and I'll get the one I love",Wolverton Mountain,The Best Of Claude King,1968,9,,Track 'A2',Single,False
463,N/A,Claude King,"Nobody knows where I came from nobody even knows my name
Nobody cares where I'm goin' or if I'll ever pass this way again
I guess that I was born to wander never seem like I could settle down
I'm as free as the wind when it's blowin' I won't be long in your town
Hey hey little girl I won't marry I never will be that kind
Love me now if you want to then I'll be movin' on down the line
(Ac.guitar)
I don't wanna cause you no trouble the road I travel has no end
Little girl I don't know when I'll be leaving or if I'll ever pass this way again
Kiss me one time fore I'll leave you little girl don't cry when I'm gone
The good things in life are not many the way with no son with no home
Love me now if you want to don't ever try to tie me down
I'm as free as the wind when it's blowin' I won't be long in your town
Oh no I won't be long in your town",I Won't Be Long In Your Town,The Best Of Claude King,1968,9,,Track 'A3',Single,False
464,N/A,Claude King,"One of these days I'm gonna take me a trip
I might as well cause you don't want me no more
Your kind of lovin' won't be easy to forget when you gotta go you gotta go
I might catch a train and go to New York City or LA or Folsom I don't know
Babe you might find me down in old Chicago when you gotta go you gotta go
(Dobro)
I don't know where these weary feet're gonna take me
I got no money not a penny can I show
All I can say is I do know that I'm bound when you gotta go you gotta go
If your new love ever put you down think of me and let the sweet tears flow
Just take this same this same old road that I'm traveling
When you gotta go you gotta go when you gotta go you gotta go",When You Gotta Go (You Gotta Go),The Best Of Claude King,1968,9,,Track 'A4',Single,False
465,N/A,Claude King,"I got a big ole shoulder to cry on so bring your big ole heartache to me
Don't go looking for someone else cause this is where you ought to be
This is the first one that you'd cried on when the last one set you free
I got a big ole shoulder to cry on so bring your big ole heartache to me
Don't go looking for somebody else to cry to
He may have a big ole shoulder but I'll bet
You'll turn out to be another one he's lied to
And you'll still be looking for someone to help you to forget
So bundle up your sweet love bring it home to me
I got a big ole shoulder to cry on so bring your big ole heartache to me
Don't go looking for somebody else...",Big Ole Shoulder,The Best Of Claude King,1968,9,,Track 'A5',Single,False
466,N/A,Claude King,"The strangest thing in all the world is a heart so small
It will just keep right on breaking if you ever let it fall
And I guess I've never known how to solve the mystery
Oh how a thing so tiny could control so much of me
A little bitty love can grow the strongest
A little bitty time away from you can be the longest
Oh how I wish I had never come to know how a little bitty heart can break so big
(Ac.guitar)
I wish that I could find a way to get a heart that's new
I would lock it deep inside me just out of reach of you
But I guess there is no way how to solve the mystery
Oh how a thing so tiny could control so much of me
A little bitty love can grow...
How a little bitty heart can break so big",Little Bitty Heart,The Best Of Claude King,1968,9,,Track 'B2',Single,False
